Unnamed: 0,Unnamed: 0.1,title,description,published date,url,publisher,company
0,0,Amazon stock sinks 13% on weak fourth-quarter guidance - CNBC,Amazon stock sinks 13% on weak fourth-quarter guidance  CNBC,"Thu, 27 Oct 2022 07:00:00 GMT",https://news.google.com/rss/articles/CBMiQWh0dHBzOi8vd3d3LmNuYmMuY29tLzIwMjIvMTAvMjcvYW1hem9uLWFtem4tZWFybmluZ3MtcTMtMjAyMi5odG1s0gFFaHR0cHM6Ly93d3cuY25iYy5jb20vYW1wLzIwMjIvMTAvMjcvYW1hem9uLWFtem4tZWFybmluZ3MtcTMtMjAyMi5odG1s?oc=5&hl=en-MY&gl=MY&ceid=MY:en,"{'href': 'https://www.cnbc.com', 'title': 'CNBC'}",AMZN
1,1,Amazon Earnings: Return to Profitability But Slow Growth Signaled Ahead - The New York Times,Amazon Earnings: Return to Profitability But Slow Growth Signaled Ahead  The New York Times,"Thu, 27 Oct 2022 07:00:00 GMT",https://news.google.com/rss/articles/CBMiSmh0dHBzOi8vd3d3Lm55dGltZXMuY29tLzIwMjIvMTAvMjcvdGVjaG5vbG9neS9hbWF6b24tYW16bi1xMy1lYXJuaW5ncy5odG1s0gEA?oc=5&hl=en-MY&gl=MY&ceid=MY:en,"{'href': 'https://www.nytimes.com', 'title': 'The New York Times'}",AMZN
2,2,Amazon (AMZN) Q3 2022 Earnings Call Transcript - The Motley Fool,Amazon (AMZN) Q3 2022 Earnings Call Transcript  The Motley Fool,"Thu, 27 Oct 2022 07:00:00 GMT",https://news.google.com/rss/articles/CBMiZ2h0dHBzOi8vd3d3LmZvb2wuY29tL2Vhcm5pbmdzL2NhbGwtdHJhbnNjcmlwdHMvMjAyMi8xMC8yNy9hbWF6b24tYW16bi1xMy0yMDIyLWVhcm5pbmdzLWNhbGwtdHJhbnNjcmlwdC_SAQA?oc=5&hl=en-MY&gl=MY&ceid=MY:en,"{'href': 'https://www.fool.com', 'title': 'The Motley Fool'}",AMZN
3,3,Amazon expands satellite manufacturing at newly acquired Project Kuiper facility - About Amazon,Amazon expands satellite manufacturing at newly acquired Project Kuiper facility  About Amazon,"Thu, 27 Oct 2022 07:00:00 GMT",https://news.google.com/rss/articles/CBMihgFodHRwczovL3d3dy5hYm91dGFtYXpvbi5jb20vbmV3cy9pbm5vdmF0aW9uLWF0LWFtYXpvbi9hbWF6b24tZXhwYW5kcy1zYXRlbGxpdGUtbWFudWZhY3R1cmluZy1hdC1uZXdseS1hY3F1aXJlZC1wcm9qZWN0LWt1aXBlci1mYWNpbGl0edIBAA?oc=5&hl=en-MY&gl=MY&ceid=MY:en,"{'href': 'https://www.aboutamazon.com', 'title': 'About Amazon'}",AMZN
4,4,"Amazon Stock Is a Top Pick for 2023, Analysts Say - Kiplinger's Personal Finance","Amazon Stock Is a Top Pick for 2023, Analysts Say  Kiplinger's Personal Finance","Mon, 28 Nov 2022 08:00:00 GMT",https://news.google.com/rss/articles/CBMiVGh0dHBzOi8vd3d3LmtpcGxpbmdlci5jb20vaW52ZXN0aW5nL2FtYXpvbi1zdG9jay1pcy1hLXRvcC1waWNrLWZvci0yMDIzLWFuYWx5c3RzLXNhedIBAA?oc=5&hl=en-MY&gl=MY&ceid=MY:en,"{'href': 'https://www.kiplinger.com', 'title': ""Kiplinger's Personal Finance""}",AMZN
5,5,"Amazon earnings miss expectations, stock tanks 20% - Yahoo Finance","Amazon earnings miss expectations, stock tanks 20%  Yahoo Finance","Thu, 27 Oct 2022 07:00:00 GMT",https://news.google.com/rss/articles/CBMiS2h0dHBzOi8vZmluYW5jZS55YWhvby5jb20vbmV3cy9hbWF6b24tdGhpcmQtcXVhcnRlci1lYXJuaW5ncy0xNjM1NTgzNDIuaHRtbNIBAA?oc=5&hl=en-MY&gl=MY&ceid=MY:en,"{'href': 'https://finance.yahoo.com', 'title': 'Yahoo Finance'}",AMZN
6,6,"Announcing Amazon CodeCatalyst, a Unified Software Development Service (Preview) | Amazon Web Services - AWS Blog","Announcing Amazon CodeCatalyst, a Unified Software Development Service (Preview) | Amazon Web Services  AWS Blog","Thu, 01 Dec 2022 08:00:00 GMT",https://news.google.com/rss/articles/CBMib2h0dHBzOi8vYXdzLmFtYXpvbi5jb20vYmxvZ3MvYXdzL2Fubm91bmNpbmctYW1hem9uLWNvZGVjYXRhbHlzdC1wcmV2aWV3LWEtdW5pZmllZC1zb2Z0d2FyZS1kZXZlbG9wbWVudC1zZXJ2aWNlL9IBAA?oc=5&hl=en-MY&gl=MY&ceid=MY:en,"{'href': 'https://aws.amazon.com', 'title': 'AWS Blog'}",AMZN
7,7,Hawaiian Airlines Announces Agreement with Amazon to Operate Freighter Aircraft - Hawaiian Airlines | Newsroom,Hawaiian Airlines Announces Agreement with Amazon to Operate Freighter Aircraft  Hawaiian Airlines | Newsroom,"Fri, 21 Oct 2022 07:00:00 GMT",https://news.google.com/rss/articles/CBMifmh0dHBzOi8vbmV3c3Jvb20uaGF3YWlpYW5haXJsaW5lcy5jb20vcmVsZWFzZXMvaGF3YWlpYW4tYWlybGluZXMtYW5ub3VuY2VzLWFncmVlbWVudC13aXRoLWFtYXpvbi10by1vcGVyYXRlLWZyZWlnaHRlci1haXJjcmFmdNIBAA?oc=5&hl=en-MY&gl=MY&ceid=MY:en,"{'href': 'https://newsroom.hawaiianairlines.com', 'title': 'Hawaiian Airlines | Newsroom'}",AMZN
8,8,"If You Invested $1000 in AMZN Stock Right Before the 2008 Market Crash, Here's What You'd Have Today - InvestorPlace","If You Invested $1000 in AMZN Stock Right Before the 2008 Market Crash, Here's What You'd Have Today  InvestorPlace","Wed, 05 Oct 2022 07:00:00 GMT",https://news.google.com/rss/articles/CBMiUWh0dHBzOi8vaW52ZXN0b3JwbGFjZS5jb20vMjAyMi8xMC9pZi15b3UtaW52ZXN0ZWQtMTAwMC1pbi1hbWF6b24tYW16bi1zdG9jay0yMDA4L9IBAA?oc=5&hl=en-MY&gl=MY&ceid=MY:en,"{'href': 'https://investorplace.com', 'title': 'InvestorPlace'}",AMZN
9,9,Amazon lost half its value this year as tech stocks got crushed and recession fears grew - CNBC,Amazon lost half its value this year as tech stocks got crushed and recession fears grew  CNBC,"Thu, 29 Dec 2022 08:00:00 GMT",https://news.google.com/rss/articles/CBMiYmh0dHBzOi8vd3d3LmNuYmMuY29tLzIwMjIvMTIvMjkvYW1hem9uLXNoZWQtaGFsZi1pdHMtdmFsdWUtaW4tMjAyMi1hcy10ZWNoLXN0b2Nrcy1nb3QtY3J1c2hlZC5odG1s0gFmaHR0cHM6Ly93d3cuY25iYy5jb20vYW1wLzIwMjIvMTIvMjkvYW1hem9uLXNoZWQtaGFsZi1pdHMtdmFsdWUtaW4tMjAyMi1hcy10ZWNoLXN0b2Nrcy1nb3QtY3J1c2hlZC5odG1s?oc=5&hl=en-MY&gl=MY&ceid=MY:en,"{'href': 'https://www.cnbc.com', 'title': 'CNBC'}",AMZN
10,10,Amazon to invest more than €1 billion to electrify its European transportation network and reduce carbon emissions - About Amazon,Amazon to invest more than €1 billion to electrify its European transportation network and reduce carbon emissions  About Amazon,"Tue, 18 Oct 2022 07:00:00 GMT",https://news.google.com/rss/articles/CBMigwFodHRwczovL3d3dy5hYm91dGFtYXpvbi5jb20vbmV3cy9zdXN0YWluYWJpbGl0eS9hbWF6b24taW52ZXN0cy1tb3JlLXRoYW4tMS1iaWxsaW9uLXRvLWVsZWN0cmlmeS1pdHMtZXVyb3BlYW4tdHJhbnNwb3J0YXRpb24tbmV0d29ya9IBAA?oc=5&hl=en-MY&gl=MY&ceid=MY:en,"{'href': 'https://www.aboutamazon.com', 'title': 'About Amazon'}",AMZN
11,11,Amazon.com's (NASDAQ:AMZN) 12% CAGR outpaced the company's earnings growth over the same five-year period - Yahoo Finance,Amazon.com's (NASDAQ:AMZN) 12% CAGR outpaced the company's earnings growth over the same five-year period  Yahoo Finance,"Sun, 13 Nov 2022 08:00:00 GMT",https://news.google.com/rss/articles/CBMiSGh0dHBzOi8vZmluYW5jZS55YWhvby5jb20vbmV3cy9hbWF6b24tY29tcy1uYXNkYXEtYW16bi0xMi0xMTAxMjc3ODAuaHRtbNIBAA?oc=5&hl=en-MY&gl=MY&ceid=MY:en,"{'href': 'https://finance.yahoo.com', 'title': 'Yahoo Finance'}",AMZN
12,12,Where Will Amazon's Stock Be in 5 Years? - The Motley Fool,Where Will Amazon's Stock Be in 5 Years?  The Motley Fool,"Tue, 27 Dec 2022 08:00:00 GMT",https://news.google.com/rss/articles/CBMiUWh0dHBzOi8vd3d3LmZvb2wuY29tL2ludmVzdGluZy8yMDIyLzEyLzI3L3doZXJlLXdpbGwtYW1hem9ucy1zdG9jay1iZS1pbi01LXllYXJzL9IBAA?oc=5&hl=en-MY&gl=MY&ceid=MY:en,"{'href': 'https://www.fool.com', 'title': 'The Motley Fool'}",AMZN
13,13,Preview: Amazon Security Lake – A Purpose-Built Customer-Owned Data Lake Service | Amazon Web Services - AWS Blog,Preview: Amazon Security Lake – A Purpose-Built Customer-Owned Data Lake Service | Amazon Web Services  AWS Blog,"Tue, 29 Nov 2022 08:00:00 GMT",https://news.google.com/rss/articles/CBMib2h0dHBzOi8vYXdzLmFtYXpvbi5jb20vYmxvZ3MvYXdzL3ByZXZpZXctYW1hem9uLXNlY3VyaXR5LWxha2UtYS1wdXJwb3NlLWJ1aWx0LWN1c3RvbWVyLW93bmVkLWRhdGEtbGFrZS1zZXJ2aWNlL9IBAA?oc=5&hl=en-MY&gl=MY&ceid=MY:en,"{'href': 'https://aws.amazon.com', 'title': 'AWS Blog'}",AMZN
14,14,"Introducing Amazon Clinic, a virtual health service that delivers convenient, affordable care for common conditions - About Amazon","Introducing Amazon Clinic, a virtual health service that delivers convenient, affordable care for common conditions  About Amazon","Tue, 15 Nov 2022 08:00:00 GMT",https://news.google.com/rss/articles/CBMiPWh0dHBzOi8vd3d3LmFib3V0YW1hem9uLmNvbS9uZXdzL3JldGFpbC93aGF0LWlzLWFtYXpvbi1jbGluaWPSAQA?oc=5&hl=en-MY&gl=MY&ceid=MY:en,"{'href': 'https://www.aboutamazon.com', 'title': 'About Amazon'}",AMZN
15,15,"If You Invested $1,000 In Amazon Stock at Its IPO, Here's How Much You'd Have Now - The Motley Fool","If You Invested $1,000 In Amazon Stock at Its IPO, Here's How Much You'd Have Now  The Motley Fool","Thu, 13 Oct 2022 07:00:00 GMT",https://news.google.com/rss/articles/CBMiXGh0dHBzOi8vd3d3LmZvb2wuY29tL2ludmVzdGluZy8yMDIyLzEwLzEzL2ludmVzdGVkLTEwMDAtaW4tYW1hem9uLXN0b2NrLWF0LWlwby1ob3ctbXVjaC1ub3cv0gEA?oc=5&hl=en-MY&gl=MY&ceid=MY:en,"{'href': 'https://www.fool.com', 'title': 'The Motley Fool'}",AMZN
16,16,"Introducing Amazon Omics – A Purpose-Built Service to Store, Query, and Analyze Genomic and Biological Data at ... - AWS Blog","Introducing Amazon Omics – A Purpose-Built Service to Store, Query, and Analyze Genomic and Biological Data at ...  AWS Blog","Tue, 29 Nov 2022 08:00:00 GMT",https://news.google.com/rss/articles/CBMikgFodHRwczovL2F3cy5hbWF6b24uY29tL2Jsb2dzL2F3cy9pbnRyb2R1Y2luZy1hbWF6b24tb21pY3MtYS1wdXJwb3NlLWJ1aWx0LXNlcnZpY2UtdG8tc3RvcmUtcXVlcnktYW5kLWFuYWx5emUtZ2Vub21pYy1hbmQtYmlvbG9naWNhbC1kYXRhLWF0LXNjYWxlL9IBAA?oc=5&hl=en-MY&gl=MY&ceid=MY:en,"{'href': 'https://aws.amazon.com', 'title': 'AWS Blog'}",AMZN
17,17,Amazon commits $53 million to fast-track innovations by female climate tech entrepreneurs - About Amazon,Amazon commits $53 million to fast-track innovations by female climate tech entrepreneurs  About Amazon,"Thu, 03 Nov 2022 07:00:00 GMT",https://news.google.com/rss/articles/CBMiiAFodHRwczovL3d3dy5hYm91dGFtYXpvbi5jb20vbmV3cy9zdXN0YWluYWJpbGl0eS9hbWF6b24tY29tbWl0cy01My1taWxsaW9uLXRvLWZhc3QtdHJhY2staW5ub3ZhdGlvbnMtYnktZmVtYWxlLWNsaW1hdGUtdGVjaC1lbnRyZXByZW5ldXJz0gEA?oc=5&hl=en-MY&gl=MY&ceid=MY:en,"{'href': 'https://www.aboutamazon.com', 'title': 'About Amazon'}",AMZN
18,18,"Announcing Amazon Access, a resource for discounts and savings - About Amazon","Announcing Amazon Access, a resource for discounts and savings  About Amazon","Mon, 03 Oct 2022 13:05:08 GMT",https://news.google.com/rss/articles/CBMibGh0dHBzOi8vd3d3LmFib3V0YW1hem9uLmNvbS9uZXdzL3JldGFpbC9pbnRyb2R1Y2luZy1hbWF6b24tYWNjZXNzLWEtbmV3LXJlc291cmNlLXRvLWhlbHAtY3VzdG9tZXJzLXNhdmUtbW9yZdIBAA?oc=5&hl=en-MY&gl=MY&ceid=MY:en,"{'href': 'https://www.aboutamazon.com', 'title': 'About Amazon'}",AMZN
19,19,Amazon Abandons Autonomous Home-Delivery Robot Scout in Latest Cut (AMZN) - Bloomberg,Amazon Abandons Autonomous Home-Delivery Robot Scout in Latest Cut (AMZN)  Bloomberg,"Thu, 06 Oct 2022 07:00:00 GMT",https://news.google.com/rss/articles/CBMib2h0dHBzOi8vd3d3LmJsb29tYmVyZy5jb20vbmV3cy9hcnRpY2xlcy8yMDIyLTEwLTA2L2FtYXpvbi1hYmFuZG9ucy1hdXRvbm9tb3VzLWhvbWUtZGVsaXZlcnktcm9ib3QtaW4tbGF0ZXN0LWN1dNIBAA?oc=5&hl=en-MY&gl=MY&ceid=MY:en,"{'href': 'https://www.bloomberg.com', 'title': 'Bloomberg'}",AMZN
20,20,Ohio University selected by Amazon to serve as Education Partner for Career Choice Program - Ohio University,Ohio University selected by Amazon to serve as Education Partner for Career Choice Program  Ohio University,"Tue, 13 Dec 2022 08:00:00 GMT",https://news.google.com/rss/articles/CBMib2h0dHBzOi8vd3d3Lm9oaW8uZWR1L25ld3MvMjAyMi8xMi9vaGlvLXVuaXZlcnNpdHktc2VsZWN0ZWQtYW1hem9uLXNlcnZlLWVkdWNhdGlvbi1wYXJ0bmVyLWNhcmVlci1jaG9pY2UtcHJvZ3JhbdIBAA?oc=5&hl=en-MY&gl=MY&ceid=MY:en,"{'href': 'https://www.ohio.edu', 'title': 'Ohio University'}",AMZN
21,21,"If You Invested $10,000 in Amazon Stock at Its IPO, Here's How Much You'd Have Today - The Motley Fool","If You Invested $10,000 in Amazon Stock at Its IPO, Here's How Much You'd Have Today  The Motley Fool","Sat, 24 Dec 2022 08:00:00 GMT",https://news.google.com/rss/articles/CBMiXGh0dHBzOi8vd3d3LmZvb2wuY29tL2ludmVzdGluZy8yMDIyLzEyLzI0L2lmLWludmVzdGVkLTEwMDAwLWFtYXpvbi1zdG9jay1pcG8taG93LW11Y2gtdG9kYXkv0gEA?oc=5&hl=en-MY&gl=MY&ceid=MY:en,"{'href': 'https://www.fool.com', 'title': 'The Motley Fool'}",AMZN
22,22,Amazon's new electric vans will be making deliveries in over 100 U.S. cities this holiday season - About Amazon,Amazon's new electric vans will be making deliveries in over 100 U.S. cities this holiday season  About Amazon,"Mon, 07 Nov 2022 08:00:00 GMT",https://news.google.com/rss/articles/CBMiaWh0dHBzOi8vd3d3LmFib3V0YW1hem9uLmNvbS9uZXdzL3RyYW5zcG9ydGF0aW9uL3Jpdmlhbi1hbWF6b24tdmFuLWV4cGFuZHMtdG8tMTAwLXVzLWNpdGllcy1ieS1lbmQtb2YtMjAyMtIBAA?oc=5&hl=en-MY&gl=MY&ceid=MY:en,"{'href': 'https://www.aboutamazon.com', 'title': 'About Amazon'}",AMZN
23,23,Announcing Additional Data Connectors for Amazon AppFlow - AWS Blog,Announcing Additional Data Connectors for Amazon AppFlow  AWS Blog,"Wed, 30 Nov 2022 08:00:00 GMT",https://news.google.com/rss/articles/CBMiWmh0dHBzOi8vYXdzLmFtYXpvbi5jb20vYmxvZ3MvYXdzL2Fubm91bmNpbmctYWRkaXRpb25hbC1kYXRhLWNvbm5lY3RvcnMtZm9yLWFtYXpvbi1hcHBmbG93L9IBAA?oc=5&hl=en-MY&gl=MY&ceid=MY:en,"{'href': 'https://aws.amazon.com', 'title': 'AWS Blog'}",AMZN
24,24,Amazon film and television sets are reducing their use of fossil fuels—here's how - About Amazon,Amazon film and television sets are reducing their use of fossil fuels—here's how  About Amazon,"Wed, 14 Dec 2022 08:00:00 GMT",https://news.google.com/rss/articles/CBMigAFodHRwczovL3d3dy5hYm91dGFtYXpvbi5jb20vbmV3cy9zdXN0YWluYWJpbGl0eS9hbWF6b24tZmlsbS1hbmQtdGVsZXZpc2lvbi1zZXRzLWFyZS1yZWR1Y2luZy10aGVpci11c2Utb2YtZm9zc2lsLWZ1ZWxzLWhlcmVzLWhvd9IBAA?oc=5&hl=en-MY&gl=MY&ceid=MY:en,"{'href': 'https://www.aboutamazon.com', 'title': 'About Amazon'}",AMZN
25,25,"'Alexa, let's make a story': Amazon introduces a new feature that turns your Echo device into a storytelling companion - About Amazon","'Alexa, let's make a story': Amazon introduces a new feature that turns your Echo device into a storytelling companion  About Amazon","Tue, 29 Nov 2022 08:00:00 GMT",https://news.google.com/rss/articles/CBMiQmh0dHBzOi8vd3d3LmFib3V0YW1hem9uLmNvbS9uZXdzL2RldmljZXMvd2hhdC1pcy1jcmVhdGUtd2l0aC1hbGV4YdIBAA?oc=5&hl=en-MY&gl=MY&ceid=MY:en,"{'href': 'https://www.aboutamazon.com', 'title': 'About Amazon'}",AMZN
26,26,"Amazon Connect – New ML-Powered Capabilities for Forecasting, Capacity Planning, Scheduling, and Agent ... - AWS Blog","Amazon Connect – New ML-Powered Capabilities for Forecasting, Capacity Planning, Scheduling, and Agent ...  AWS Blog","Tue, 29 Nov 2022 08:00:00 GMT",https://news.google.com/rss/articles/CBMijwFodHRwczovL2F3cy5hbWF6b24uY29tL2Jsb2dzL2F3cy9hbWF6b24tY29ubmVjdC1uZXctbWwtcG93ZXJlZC1jYXBhYmlsaXRpZXMtZm9yLWZvcmVjYXN0aW5nLWNhcGFjaXR5LXBsYW5uaW5nLXNjaGVkdWxpbmctYW5kLWFnZW50LWVtcG93ZXJtZW50L9IBAA?oc=5&hl=en-MY&gl=MY&ceid=MY:en,"{'href': 'https://aws.amazon.com', 'title': 'AWS Blog'}",AMZN
27,27,Amazon stock tanks nearly 20% after lower than expected holiday quarter guidance - GeekWire,Amazon stock tanks nearly 20% after lower than expected holiday quarter guidance  GeekWire,"Thu, 27 Oct 2022 07:00:00 GMT",https://news.google.com/rss/articles/CBMibmh0dHBzOi8vd3d3LmdlZWt3aXJlLmNvbS8yMDIyL2FtYXpvbi1zdG9jay10YW5rcy1uZWFybHktMjAtYWZ0ZXItbG93ZXItdGhhbi1leHBlY3RlZC1ob2xpZGF5LXF1YXJ0ZXItZ3VpZGFuY2Uv0gEA?oc=5&hl=en-MY&gl=MY&ceid=MY:en,"{'href': 'https://www.geekwire.com', 'title': 'GeekWire'}",AMZN
28,28,New – Announcing Amazon EFS Elastic Throughput - AWS Blog,New – Announcing Amazon EFS Elastic Throughput  AWS Blog,"Sun, 27 Nov 2022 08:00:00 GMT",https://news.google.com/rss/articles/CBMiTmh0dHBzOi8vYXdzLmFtYXpvbi5jb20vYmxvZ3MvYXdzL25ldy1hbm5vdW5jaW5nLWFtYXpvbi1lZnMtZWxhc3RpYy10aHJvdWdocHV0L9IBAA?oc=5&hl=en-MY&gl=MY&ceid=MY:en,"{'href': 'https://aws.amazon.com', 'title': 'AWS Blog'}",AMZN
29,29,3 Amazon employees share how the company approaches accessibility and inclusivity - About Amazon,3 Amazon employees share how the company approaches accessibility and inclusivity  About Amazon,"Thu, 01 Dec 2022 08:00:00 GMT",https://news.google.com/rss/articles/CBMicmh0dHBzOi8vd3d3LmFib3V0YW1hem9uLmNvbS9uZXdzL2RldmljZXMvaW50ZXJuYXRpb25hbC1kYXktb2YtcGVyc29ucy13aXRoLWRpc2FiaWxpdGllcy1hbWF6b24tZW1wbG95ZWVzLXNwb3RsaWdodNIBAA?oc=5&hl=en-MY&gl=MY&ceid=MY:en,"{'href': 'https://www.aboutamazon.com', 'title': 'About Amazon'}",AMZN
30,30,Why These Two Experts Are Bullish on AMZN - TheStreet,Why These Two Experts Are Bullish on AMZN  TheStreet,"Fri, 28 Oct 2022 07:00:00 GMT",https://news.google.com/rss/articles/CBMiT2h0dHBzOi8vd3d3LnRoZXN0cmVldC5jb20vYW1hem9uL25ld3Mvd2h5LXRoZXNlLXR3by1leHBlcnRzLWFyZS1idWxsaXNoLW9uLWFtem7SAQA?oc=5&hl=en-MY&gl=MY&ceid=MY:en,"{'href': 'https://www.thestreet.com', 'title': 'TheStreet'}",AMZN
31,31,Amazon Stock Price Drops 13% on Forecast for Sluggish Holiday Sales (AMZN) - Bloomberg,Amazon Stock Price Drops 13% on Forecast for Sluggish Holiday Sales (AMZN)  Bloomberg,"Thu, 27 Oct 2022 07:00:00 GMT",https://news.google.com/rss/articles/CBMia2h0dHBzOi8vd3d3LmJsb29tYmVyZy5jb20vbmV3cy9hcnRpY2xlcy8yMDIyLTEwLTI3L2FtYXpvbi1wbHVuZ2VzLWFmdGVyLXByb2plY3RpbmctbGFja2x1c3Rlci1ob2xpZGF5LXNhbGVz0gEA?oc=5&hl=en-MY&gl=MY&ceid=MY:en,"{'href': 'https://www.bloomberg.com', 'title': 'Bloomberg'}",AMZN
32,32,Introducing Amazon EventBridge Scheduler - AWS Blog,Introducing Amazon EventBridge Scheduler  AWS Blog,"Thu, 10 Nov 2022 08:00:00 GMT",https://news.google.com/rss/articles/CBMiTmh0dHBzOi8vYXdzLmFtYXpvbi5jb20vYmxvZ3MvY29tcHV0ZS9pbnRyb2R1Y2luZy1hbWF6b24tZXZlbnRicmlkZ2Utc2NoZWR1bGVyL9IBAA?oc=5&hl=en-MY&gl=MY&ceid=MY:en,"{'href': 'https://aws.amazon.com', 'title': 'AWS Blog'}",AMZN
33,33,AWS announces Amazon Verified Permissions (Preview) - AWS Blog,AWS announces Amazon Verified Permissions (Preview)  AWS Blog,"Mon, 28 Nov 2022 08:00:00 GMT",https://news.google.com/rss/articles/CBMiV2h0dHBzOi8vYXdzLmFtYXpvbi5jb20vYWJvdXQtYXdzL3doYXRzLW5ldy8yMDIyLzExL2FtYXpvbi12ZXJpZmllZC1wZXJtaXNzaW9ucy1wcmV2aWV3L9IBAA?oc=5&hl=en-MY&gl=MY&ceid=MY:en,"{'href': 'https://aws.amazon.com', 'title': 'AWS Blog'}",AMZN
34,34,Amazon-Music-Expands-Its-Prime-Benefit-Now-With-a-Full-Catalog-of-Music-and-the-Most-Top-Podcasts-Ad-Free - Amazon Press Release,Amazon-Music-Expands-Its-Prime-Benefit-Now-With-a-Full-Catalog-of-Music-and-the-Most-Top-Podcasts-Ad-Free  Amazon Press Release,"Tue, 01 Nov 2022 07:00:00 GMT",https://news.google.com/rss/articles/CBMijwFodHRwczovL3ByZXNzLmFib3V0YW1hem9uLmNvbS8yMDIyLzExL2FtYXpvbi1tdXNpYy1leHBhbmRzLWl0cy1wcmltZS1iZW5lZml0LW5vdy13aXRoLWEtZnVsbC1jYXRhbG9nLW9mLW11c2ljLWFuZC10aGUtbW9zdC10b3AtcG9kY2FzdHMtYWQtZnJlZdIBAA?oc=5&hl=en-MY&gl=MY&ceid=MY:en,"{'href': 'https://press.aboutamazon.com', 'title': 'Amazon Press Release'}",AMZN
35,35,Amazon is making your life easier through ambient intelligence - About Amazon,Amazon is making your life easier through ambient intelligence  About Amazon,"Wed, 05 Oct 2022 07:00:00 GMT",https://news.google.com/rss/articles/CBMiZ2h0dHBzOi8vd3d3LmFib3V0YW1hem9uLmNvbS9uZXdzL2RldmljZXMvYW1hem9uLWlzLW1ha2luZy15b3VyLWxpZmUtZWFzaWVyLXRocm91Z2gtYW1iaWVudC1pbnRlbGxpZ2VuY2XSAQA?oc=5&hl=en-MY&gl=MY&ceid=MY:en,"{'href': 'https://www.aboutamazon.com', 'title': 'About Amazon'}",AMZN
36,36,6 new mental health benefits and resources for Amazon employees - About Amazon,6 new mental health benefits and resources for Amazon employees  About Amazon,"Thu, 13 Oct 2022 07:00:00 GMT",https://news.google.com/rss/articles/CBMiamh0dHBzOi8vd3d3LmFib3V0YW1hem9uLmNvbS9uZXdzL3dvcmtwbGFjZS82LW5ldy1tZW50YWwtaGVhbHRoLWJlbmVmaXRzLWFuZC1yZXNvdXJjZXMtZm9yLWFtYXpvbi1lbXBsb3llZXPSAQA?oc=5&hl=en-MY&gl=MY&ceid=MY:en,"{'href': 'https://www.aboutamazon.com', 'title': 'About Amazon'}",AMZN
37,37,Amazon reveals the new design for Prime Air's delivery drone - About Amazon,Amazon reveals the new design for Prime Air's delivery drone  About Amazon,"Thu, 10 Nov 2022 08:00:00 GMT",https://news.google.com/rss/articles/CBMiXWh0dHBzOi8vd3d3LmFib3V0YW1hem9uLmNvbS9uZXdzL3RyYW5zcG9ydGF0aW9uL2FtYXpvbi1wcmltZS1haXItZGVsaXZlcnktZHJvbmUtcmV2ZWFsLXBob3Rvc9IBAA?oc=5&hl=en-MY&gl=MY&ceid=MY:en,"{'href': 'https://www.aboutamazon.com', 'title': 'About Amazon'}",AMZN
38,38,Automated Data Discovery for Amazon Macie - AWS Blog,Automated Data Discovery for Amazon Macie  AWS Blog,"Mon, 28 Nov 2022 08:00:00 GMT",https://news.google.com/rss/articles/CBMiS2h0dHBzOi8vYXdzLmFtYXpvbi5jb20vYmxvZ3MvYXdzL2F1dG9tYXRlZC1kYXRhLWRpc2NvdmVyeS1mb3ItYW1hem9uLW1hY2llL9IBAA?oc=5&hl=en-MY&gl=MY&ceid=MY:en,"{'href': 'https://aws.amazon.com', 'title': 'AWS Blog'}",AMZN
39,39,Amazon introduces Sparrow—a state-of-the-art robot that handles millions of diverse products - About Amazon,Amazon introduces Sparrow—a state-of-the-art robot that handles millions of diverse products  About Amazon,"Thu, 10 Nov 2022 08:00:00 GMT",https://news.google.com/rss/articles/CBMiiAFodHRwczovL3d3dy5hYm91dGFtYXpvbi5jb20vbmV3cy9vcGVyYXRpb25zL2FtYXpvbi1pbnRyb2R1Y2VzLXNwYXJyb3ctYS1zdGF0ZS1vZi10aGUtYXJ0LXJvYm90LXRoYXQtaGFuZGxlcy1taWxsaW9ucy1vZi1kaXZlcnNlLXByb2R1Y3Rz0gEA?oc=5&hl=en-MY&gl=MY&ceid=MY:en,"{'href': 'https://www.aboutamazon.com', 'title': 'About Amazon'}",AMZN
40,40,Sell AMZN? Why This Expert Thinks Amazon Is Still Overpriced - TheStreet,Sell AMZN? Why This Expert Thinks Amazon Is Still Overpriced  TheStreet,"Fri, 16 Dec 2022 08:00:00 GMT",https://news.google.com/rss/articles/CBMiYWh0dHBzOi8vd3d3LnRoZXN0cmVldC5jb20vYW1hem9uL25ld3Mvc2VsbC1hbXpuLXdoeS10aGlzLWV4cGVydC10aGlua3MtYW1hem9uLWlzLXN0aWxsLW92ZXJwcmljZWTSAQA?oc=5&hl=en-MY&gl=MY&ceid=MY:en,"{'href': 'https://www.thestreet.com', 'title': 'TheStreet'}",AMZN
41,41,Mason/Amazon hackathon is a win for Mason students - George Mason University,Mason/Amazon hackathon is a win for Mason students  George Mason University,"Mon, 07 Nov 2022 08:00:00 GMT",https://news.google.com/rss/articles/CBMiSWh0dHBzOi8vd3d3LmdtdS5lZHUvbmV3cy8yMDIyLTExL21hc29uYW1hem9uLWhhY2thdGhvbi13aW4tbWFzb24tc3R1ZGVudHPSAQA?oc=5&hl=en-MY&gl=MY&ceid=MY:en,"{'href': 'https://www.gmu.edu', 'title': 'George Mason University'}",AMZN
42,42,The Amazon in crisis: Forest loss threatens the region and the planet | Stories - World Wildlife Fund,The Amazon in crisis: Forest loss threatens the region and the planet | Stories  World Wildlife Fund,"Tue, 08 Nov 2022 08:00:00 GMT",https://news.google.com/rss/articles/CBMiamh0dHBzOi8vd3d3Lndvcmxkd2lsZGxpZmUub3JnL3N0b3JpZXMvdGhlLWFtYXpvbi1pbi1jcmlzaXMtZm9yZXN0LWxvc3MtdGhyZWF0ZW5zLXRoZS1yZWdpb24tYW5kLXRoZS1wbGFuZXTSAQA?oc=5&hl=en-MY&gl=MY&ceid=MY:en,"{'href': 'https://www.worldwildlife.org', 'title': 'World Wildlife Fund'}",AMZN
43,43,Stolen Amazon: The Roots of Environmental Crime in Five Countries - InSight Crime,Stolen Amazon: The Roots of Environmental Crime in Five Countries  InSight Crime,"Wed, 09 Nov 2022 14:17:36 GMT",https://news.google.com/rss/articles/CBMiUGh0dHBzOi8vaW5zaWdodGNyaW1lLm9yZy9pbnZlc3RpZ2F0aW9ucy9zdG9sZW4tYW1hem9uLXJvb3RzLWVudmlyb25tZW50YWwtY3JpbWUv0gEA?oc=5&hl=en-MY&gl=MY&ceid=MY:en,"{'href': 'https://insightcrime.org', 'title': 'InSight Crime'}",AMZN
44,44,Learn From Amazon's Approach To Innovation - Forrester,Learn From Amazon's Approach To Innovation  Forrester,"Sat, 22 Oct 2022 07:00:00 GMT",https://news.google.com/rss/articles/CBMiSmh0dHBzOi8vd3d3LmZvcnJlc3Rlci5jb20vYmxvZ3MvbGVhcm4tZnJvbS1hbWF6b25zLWFwcHJvYWNoLXRvLWlubm92YXRpb24v0gEA?oc=5&hl=en-MY&gl=MY&ceid=MY:en,"{'href': 'https://www.forrester.com', 'title': 'Forrester'}",AMZN
45,45,Introducing Amazon GameLift Anywhere – Run Your Game Servers on Your Own Infrastructure | Amazon Web Services - AWS Blog,Introducing Amazon GameLift Anywhere – Run Your Game Servers on Your Own Infrastructure | Amazon Web Services  AWS Blog,"Thu, 01 Dec 2022 08:00:00 GMT",https://news.google.com/rss/articles/CBMid2h0dHBzOi8vYXdzLmFtYXpvbi5jb20vYmxvZ3MvYXdzL2ludHJvZHVjaW5nLWFtYXpvbi1nYW1lbGlmdC1hbnl3aGVyZS1ydW4teW91ci1nYW1lLXNlcnZlcnMtb24teW91ci1vd24taW5mcmFzdHJ1Y3R1cmUv0gEA?oc=5&hl=en-MY&gl=MY&ceid=MY:en,"{'href': 'https://aws.amazon.com', 'title': 'AWS Blog'}",AMZN
46,46,Preview: Amazon OpenSearch Serverless – Run Search and Analytics Workloads without Managing Clusters | Amazon ... - AWS Blog,Preview: Amazon OpenSearch Serverless – Run Search and Analytics Workloads without Managing Clusters | Amazon ...  AWS Blog,"Tue, 29 Nov 2022 08:00:00 GMT",https://news.google.com/rss/articles/CBMigwFodHRwczovL2F3cy5hbWF6b24uY29tL2Jsb2dzL2F3cy9wcmV2aWV3LWFtYXpvbi1vcGVuc2VhcmNoLXNlcnZlcmxlc3MtcnVuLXNlYXJjaC1hbmQtYW5hbHl0aWNzLXdvcmtsb2Fkcy13aXRob3V0LW1hbmFnaW5nLWNsdXN0ZXJzL9IBAA?oc=5&hl=en-MY&gl=MY&ceid=MY:en,"{'href': 'https://aws.amazon.com', 'title': 'AWS Blog'}",AMZN
47,47,"Amazon Braket launches Aquila, the first neutral-atom quantum processor from QuEra Computing | Amazon Web ... - AWS Blog","Amazon Braket launches Aquila, the first neutral-atom quantum processor from QuEra Computing | Amazon Web ...  AWS Blog","Tue, 01 Nov 2022 07:00:00 GMT",https://news.google.com/rss/articles/CBMiiwFodHRwczovL2F3cy5hbWF6b24uY29tL2Jsb2dzL3F1YW50dW0tY29tcHV0aW5nL2FtYXpvbi1icmFrZXQtbGF1bmNoZXMtYXF1aWxhLXRoZS1maXJzdC1uZXV0cmFsLWF0b20tcXVhbnR1bS1wcm9jZXNzb3ItZnJvbS1xdWVyYS1jb21wdXRpbmcv0gEA?oc=5&hl=en-MY&gl=MY&ceid=MY:en,"{'href': 'https://aws.amazon.com', 'title': 'AWS Blog'}",AMZN
48,48,The eyes of Amazon: a hidden… - The Bureau of Investigative Journalism,The eyes of Amazon: a hidden…  The Bureau of Investigative Journalism,"Mon, 21 Nov 2022 08:00:00 GMT",https://news.google.com/rss/articles/CBMigQFodHRwczovL3d3dy50aGVidXJlYXVpbnZlc3RpZ2F0ZXMuY29tL3N0b3JpZXMvMjAyMi0xMS0yMS90aGUtZXllcy1vZi1hbWF6b24tYS1oaWRkZW4td29ya2ZvcmNlLWRyaXZpbmctYS12YXN0LXN1cnZlaWxsYW5jZS1zeXN0ZW3SAQA?oc=5&hl=en-MY&gl=MY&ceid=MY:en,"{'href': 'https://www.thebureauinvestigates.com', 'title': 'The Bureau of Investigative Journalism'}",AMZN
49,49,New – Amazon CloudWatch Cross-Account Observability - AWS Blog,New – Amazon CloudWatch Cross-Account Observability  AWS Blog,"Sun, 27 Nov 2022 08:00:00 GMT",https://news.google.com/rss/articles/CBMiU2h0dHBzOi8vYXdzLmFtYXpvbi5jb20vYmxvZ3MvYXdzL25ldy1hbWF6b24tY2xvdWR3YXRjaC1jcm9zcy1hY2NvdW50LW9ic2VydmFiaWxpdHkv0gEA?oc=5&hl=en-MY&gl=MY&ceid=MY:en,"{'href': 'https://aws.amazon.com', 'title': 'AWS Blog'}",AMZN
