Unnamed: 0,Unnamed: 0.1,Unnamed: 0.1.1,title,description,published date,url,publisher,company
52,52,52,Former Tesla Executive Jonathan McNeil Joins GM's Board - Bloomberg,Former Tesla Executive Jonathan McNeil Joins GM's Board  Bloomberg,"Tue, 04 Oct 2022 07:00:00 GMT",https://news.google.com/rss/articles/CBMiamh0dHBzOi8vd3d3LmJsb29tYmVyZy5jb20vbmV3cy9hcnRpY2xlcy8yMDIyLTEwLTA0L2Zvcm1lci10ZXNsYS1leGVjdXRpdmUtam9uYXRoYW4tbWNuZWlsLWpvaW5zLWdtLXMtYm9hcmTSAQA?oc=5&hl=en-MY&gl=MY&ceid=MY:en,"{'href': 'https://www.bloomberg.com', 'title': 'Bloomberg'}",TSLA
53,53,53,Tesla Q3 FY2022 Earnings Report Preview: What to Look For - Investopedia,Tesla Q3 FY2022 Earnings Report Preview: What to Look For  Investopedia,"Mon, 17 Oct 2022 07:00:00 GMT",https://news.google.com/rss/articles/CBMiTGh0dHBzOi8vd3d3LmludmVzdG9wZWRpYS5jb20vdGVzbGEtcTMtZnkyMDIyLWVhcm5pbmdzLXJlcG9ydC1wcmV2aWV3LTY3NTE4MjLSAQA?oc=5&hl=en-MY&gl=MY&ceid=MY:en,"{'href': 'https://www.investopedia.com', 'title': 'Investopedia'}",TSLA
54,54,54,"Tesla (TSLA) has a new 'Champion of People,' aka head of HR - Electrek.co","Tesla (TSLA) has a new 'Champion of People,' aka head of HR  Electrek.co","Thu, 08 Dec 2022 08:00:00 GMT",https://news.google.com/rss/articles/CBMiSWh0dHBzOi8vZWxlY3RyZWsuY28vMjAyMi8xMi8wOC90ZXNsYS10c2xhLWNoYW1waW9uLW9mLXBlb3BsZS1ha2EtaGVhZC1oci_SAQA?oc=5&hl=en-MY&gl=MY&ceid=MY:en,"{'href': 'https://electrek.co', 'title': 'Electrek.co'}",TSLA
55,55,55,"2022 was Tesla's best year ever, but not for its stock (TSLA), and investors are not happy - Electrek.co","2022 was Tesla's best year ever, but not for its stock (TSLA), and investors are not happy  Electrek.co","Fri, 09 Dec 2022 08:00:00 GMT",https://news.google.com/rss/articles/CBMiVmh0dHBzOi8vZWxlY3RyZWsuY28vMjAyMi8xMi8wOS90ZXNsYS10c2xhLTIwMjItYmVzdC15ZWFyLWV2ZXItYnV0LW5vdC1pbnZlc3RvcnMtc3RvY2sv0gEA?oc=5&hl=en-MY&gl=MY&ceid=MY:en,"{'href': 'https://electrek.co', 'title': 'Electrek.co'}",TSLA
56,56,56,Tesla cuts prices in China on concern over softening demand - Yahoo Finance,Tesla cuts prices in China on concern over softening demand  Yahoo Finance,"Mon, 24 Oct 2022 07:00:00 GMT",https://news.google.com/rss/articles/CBMiaWh0dHBzOi8vZmluYW5jZS55YWhvby5jb20vbmV3cy90ZXNsYS1jdXRzLXByaWNlcy1pbi1jaGluYS1vbi1jb25jZXJuLW92ZXItc29mdGVuaW5nLWRlbWFuZC0xNTMwMTg5MTEuaHRtbNIBAA?oc=5&hl=en-MY&gl=MY&ceid=MY:en,"{'href': 'https://finance.yahoo.com', 'title': 'Yahoo Finance'}",TSLA
57,57,57,Tesla (TSLA) investors see negative impact of Elon Musk's Twitter antics - Electrek.co,Tesla (TSLA) investors see negative impact of Elon Musk's Twitter antics  Electrek.co,"Tue, 29 Nov 2022 08:00:00 GMT",https://news.google.com/rss/articles/CBMiZWh0dHBzOi8vZWxlY3RyZWsuY28vMjAyMi8xMS8yOS90ZXNsYS10c2xhLWludmVzdG9ycy1uZWdhdGl2ZS1pbXBhY3QtZWxvbi1tdXNrLXR3aXR0ZXItYW50aWNzLWxhc3Rpbmcv0gEA?oc=5&hl=en-MY&gl=MY&ceid=MY:en,"{'href': 'https://electrek.co', 'title': 'Electrek.co'}",TSLA
58,58,58,Strength Seen in Tesla (TSLA): Can Its 8.1% Jump Turn into More Strength? - Yahoo Lifestyle UK,Strength Seen in Tesla (TSLA): Can Its 8.1% Jump Turn into More Strength?  Yahoo Lifestyle UK,"Fri, 30 Dec 2022 08:00:00 GMT",https://news.google.com/rss/articles/CBMiUWh0dHBzOi8vdWsuc3R5bGUueWFob28uY29tL2ZpbmFuY2UvbmV3cy9zdHJlbmd0aC1zZWVuLXRlc2xhLXRzbGEtOC0xMTA2MTEwNjEuaHRtbNIBAA?oc=5&hl=en-MY&gl=MY&ceid=MY:en,"{'href': 'https://uk.style.yahoo.com', 'title': 'Yahoo Lifestyle UK'}",TSLA
59,59,59,Cathie Wood Is Doubling Down on Tesla (TSLA) Stock. Should You? - InvestorPlace,Cathie Wood Is Doubling Down on Tesla (TSLA) Stock. Should You?  InvestorPlace,"Thu, 10 Nov 2022 08:00:00 GMT",https://news.google.com/rss/articles/CBMiXmh0dHBzOi8vaW52ZXN0b3JwbGFjZS5jb20vMjAyMi8xMS9jYXRoaWUtd29vZC1pcy1kb3VibGluZy1kb3duLW9uLXRlc2xhLXRzbGEtc3RvY2stc2hvdWxkLXlvdS_SAQA?oc=5&hl=en-MY&gl=MY&ceid=MY:en,"{'href': 'https://investorplace.com', 'title': 'InvestorPlace'}",TSLA
60,60,60,Elon Musk Says He Won’t Sell Tesla (TSLA) Stock for Two Years - Bloomberg,Elon Musk Says He Won’t Sell Tesla (TSLA) Stock for Two Years  Bloomberg,"Thu, 22 Dec 2022 08:00:00 GMT",https://news.google.com/rss/articles/CBMib2h0dHBzOi8vd3d3LmJsb29tYmVyZy5jb20vbmV3cy9hcnRpY2xlcy8yMDIyLTEyLTIyL211c2stc2F5cy1oZS13b24tdC1zZWxsLXRlc2xhLXN0b2NrLWZvci0yLXllYXJzLXJldXRlcnMtc2F5c9IBAA?oc=5&hl=en-MY&gl=MY&ceid=MY:en,"{'href': 'https://www.bloomberg.com', 'title': 'Bloomberg'}",TSLA
61,61,61,Tesla Lures $2.8 Billion in Korean Retail Funds Amid Stock Slide (TSLA) - Bloomberg,Tesla Lures $2.8 Billion in Korean Retail Funds Amid Stock Slide (TSLA)  Bloomberg,"Tue, 27 Dec 2022 08:00:00 GMT",https://news.google.com/rss/articles/CBMicmh0dHBzOi8vd3d3LmJsb29tYmVyZy5jb20vbmV3cy9hcnRpY2xlcy8yMDIyLTEyLTI4L3Rlc2xhLWx1cmVzLTItOC1iaWxsaW9uLWluLWtvcmVhbi1yZXRhaWwtZnVuZHMtYW1pZC1zdG9jay1zbGlkZdIBAA?oc=5&hl=en-MY&gl=MY&ceid=MY:en,"{'href': 'https://www.bloomberg.com', 'title': 'Bloomberg'}",TSLA
62,62,62,These New YieldMax ETFs Are Not What You'd Think (but in a Good Way) - TheStreet,These New YieldMax ETFs Are Not What You'd Think (but in a Good Way)  TheStreet,"Thu, 01 Dec 2022 08:00:00 GMT",https://news.google.com/rss/articles/CBMiNGh0dHBzOi8vcHJvLnRoZXN0cmVldC5jb20vaW52ZXN0aW5nL3RzbHktdGstMTYxMDk5NzDSAQA?oc=5&hl=en-MY&gl=MY&ceid=MY:en,"{'href': 'https://pro.thestreet.com', 'title': 'TheStreet'}",TSLA
63,63,63,Tesla (TSLA) is planning massive output from Giga Texas in Q1 2023 - Electrek.co,Tesla (TSLA) is planning massive output from Giga Texas in Q1 2023  Electrek.co,"Wed, 30 Nov 2022 08:00:00 GMT",https://news.google.com/rss/articles/CBMiTGh0dHBzOi8vZWxlY3RyZWsuY28vMjAyMi8xMS8zMC90ZXNsYS10c2xhLW1hc3NpdmUtb3V0cHV0LWdpZ2EtdGV4YXMtcTEtMjAyMy_SAQA?oc=5&hl=en-MY&gl=MY&ceid=MY:en,"{'href': 'https://electrek.co', 'title': 'Electrek.co'}",TSLA
64,64,64,Tesla (TSLA) Q3 2022 preview: Here's what to expect - Electrek.co,Tesla (TSLA) Q3 2022 preview: Here's what to expect  Electrek.co,"Tue, 18 Oct 2022 07:00:00 GMT",https://news.google.com/rss/articles/CBMiOmh0dHBzOi8vZWxlY3RyZWsuY28vMjAyMi8xMC8xOC90ZXNsYS10c2xhLXEzLTIwMjItcHJldmlldy_SAQA?oc=5&hl=en-MY&gl=MY&ceid=MY:en,"{'href': 'https://electrek.co', 'title': 'Electrek.co'}",TSLA
65,65,65,Tesla (TSLA) Stock Tanks Another 8% amid Concerns of Musk's Focus on Twitter - Coinspeaker,Tesla (TSLA) Stock Tanks Another 8% amid Concerns of Musk's Focus on Twitter  Coinspeaker,"Wed, 21 Dec 2022 08:00:00 GMT",https://news.google.com/rss/articles/CBMiO2h0dHBzOi8vd3d3LmNvaW5zcGVha2VyLmNvbS90ZXNsYS10c2xhLXN0b2NrLXRhbmtzLXR3aXR0ZXIv0gE_aHR0cHM6Ly93d3cuY29pbnNwZWFrZXIuY29tL3Rlc2xhLXRzbGEtc3RvY2stdGFua3MtdHdpdHRlci9hbXAv?oc=5&hl=en-MY&gl=MY&ceid=MY:en,"{'href': 'https://www.coinspeaker.com', 'title': 'Coinspeaker'}",TSLA
66,66,66,Tesla's Drop Puts $157 Million Korea Structured Products at Risk - Bloomberg,Tesla's Drop Puts $157 Million Korea Structured Products at Risk  Bloomberg,"Wed, 28 Dec 2022 08:00:00 GMT",https://news.google.com/rss/articles/CBMicmh0dHBzOi8vd3d3LmJsb29tYmVyZy5jb20vbmV3cy9hcnRpY2xlcy8yMDIyLTEyLTI5L3Rlc2xhLXMtZHJvcC1wdXRzLTE1Ny1taWxsaW9uLWtvcmVhLXN0cnVjdHVyZWQtcHJvZHVjdHMtYXQtcmlza9IBAA?oc=5&hl=en-MY&gl=MY&ceid=MY:en,"{'href': 'https://www.bloomberg.com', 'title': 'Bloomberg'}",TSLA
67,67,67,"Here's How Much A $1,000 Investment In Tesla Stock Will Be Worth In 2030 If Ron Baron's Price Target Hits - Benzinga","Here's How Much A $1,000 Investment In Tesla Stock Will Be Worth In 2030 If Ron Baron's Price Target Hits  Benzinga","Tue, 13 Dec 2022 08:00:00 GMT",https://news.google.com/rss/articles/CBMikQFodHRwczovL3d3dy5iZW56aW5nYS5jb20vbmV3cy8yMi8xMi8zMDA1MTU5Ni9oZXJlcy1ob3ctbXVjaC1hLTEtMDAwLWludmVzdG1lbnQtaW4tdGVzbGEtc3RvY2std2lsbC1iZS13b3J0aC1pbi0yMDMwLWlmLXJvbi1iYXJvbnMtcHJpY2UtdGFyZ2V0LWhp0gEtaHR0cHM6Ly93d3cuYmVuemluZ2EuY29tL2FtcC9jb250ZW50LzMwMDUxNTk2?oc=5&hl=en-MY&gl=MY&ceid=MY:en,"{'href': 'https://www.benzinga.com', 'title': 'Benzinga'}",TSLA
68,68,68,How Tesla's Outrageous Valuation Could Destroy All Zombie Stocks - Forbes,How Tesla's Outrageous Valuation Could Destroy All Zombie Stocks  Forbes,"Tue, 18 Oct 2022 07:00:00 GMT",https://news.google.com/rss/articles/CBMiemh0dHBzOi8vd3d3LmZvcmJlcy5jb20vc2l0ZXMvZ3JlYXRzcGVjdWxhdGlvbnMvMjAyMi8xMC8xOC9ob3ctdGVzbGFzLW91dHJhZ2VvdXMtdmFsdWF0aW9uLWNvdWxkLWRlc3Ryb3ktYWxsLXpvbWJpZS1zdG9ja3Mv0gEA?oc=5&hl=en-MY&gl=MY&ceid=MY:en,"{'href': 'https://www.forbes.com', 'title': 'Forbes'}",TSLA
69,69,69,"Tesla (TSLA) Q3 2022 earnings results miss on revenue, beat EPS - Shacknews","Tesla (TSLA) Q3 2022 earnings results miss on revenue, beat EPS  Shacknews","Wed, 19 Oct 2022 07:00:00 GMT",https://news.google.com/rss/articles/CBMiTGh0dHBzOi8vd3d3LnNoYWNrbmV3cy5jb20vYXJ0aWNsZS8xMzI3MzcvdGVzbGEtdHNsYS1xMy0yMDIyLWVhcm5pbmdzLXJlc3VsdHPSAVZodHRwczovL3d3dy5zaGFja25ld3MuY29tL2FydGljbGUvMTMyNzM3L3Rlc2xhLXRzbGEtcTMtMjAyMi1lYXJuaW5ncy1yZXN1bHRzP2FtcGh0bWw9MQ?oc=5&hl=en-MY&gl=MY&ceid=MY:en,"{'href': 'https://www.shacknews.com', 'title': 'Shacknews'}",TSLA
70,70,70,"Dissecting Tesla’s Q3 2022 delivery count, and why it missed expectations - TESLARATI","Dissecting Tesla’s Q3 2022 delivery count, and why it missed expectations  TESLARATI","Mon, 03 Oct 2022 07:00:00 GMT",https://news.google.com/rss/articles/CBMiUWh0dHBzOi8vd3d3LnRlc2xhcmF0aS5jb20vZGlzc2VjdGluZy10ZXNsYS10c2xhLXEzLTIwMjItZGVsaXZlcnktcHJvZHVjdGlvbi1taXNzL9IBVWh0dHBzOi8vd3d3LnRlc2xhcmF0aS5jb20vZGlzc2VjdGluZy10ZXNsYS10c2xhLXEzLTIwMjItZGVsaXZlcnktcHJvZHVjdGlvbi1taXNzL2FtcC8?oc=5&hl=en-MY&gl=MY&ceid=MY:en,"{'href': 'https://www.teslarati.com', 'title': 'TESLARATI'}",TSLA
71,71,71,Tesla (TSLA) stock falls on robot getting ridiculed as Elon Musk claims it's misunderstood - Electrek.co,Tesla (TSLA) stock falls on robot getting ridiculed as Elon Musk claims it's misunderstood  Electrek.co,"Mon, 03 Oct 2022 07:00:00 GMT",https://news.google.com/rss/articles/CBMid2h0dHBzOi8vZWxlY3RyZWsuY28vMjAyMi8xMC8wMy90ZXNsYS10c2xhLXN0b2NrLWZhbGxzLW9uLXJvYm90LWdldHRpbmctcmlkaWN1bGVkLWFzLWVsb24tbXVzay1jbGFpbXMtaXRzLW1pc3VuZGVyc3Rvb2Qv0gEA?oc=5&hl=en-MY&gl=MY&ceid=MY:en,"{'href': 'https://electrek.co', 'title': 'Electrek.co'}",TSLA
72,72,72,Tesla (TSLA) increases discount on cars delivered this month - Electrek.co,Tesla (TSLA) increases discount on cars delivered this month  Electrek.co,"Wed, 21 Dec 2022 08:00:00 GMT",https://news.google.com/rss/articles/CBMiQmh0dHBzOi8vZWxlY3RyZWsuY28vMjAyMi8xMi8yMS90ZXNsYS10c2xhLWluY3JlYXNlcy1kaXNjb3VudC1jYXJzL9IBAA?oc=5&hl=en-MY&gl=MY&ceid=MY:en,"{'href': 'https://electrek.co', 'title': 'Electrek.co'}",TSLA
73,73,73,Tesla Stock Charts Show Two Major Levels of Potential Support - TheStreet,Tesla Stock Charts Show Two Major Levels of Potential Support  TheStreet,"Mon, 07 Nov 2022 08:00:00 GMT",https://news.google.com/rss/articles/CBMiZmh0dHBzOi8vd3d3LnRoZXN0cmVldC5jb20vaW52ZXN0aW5nL3Rlc2xhLXRzbGEtc3RvY2stY2hhcnRzLXNob3ctdHdvLW1ham9yLWxldmVscy1vZi1wb3RlbnRpYWwtc3VwcG9ydNIBAA?oc=5&hl=en-MY&gl=MY&ceid=MY:en,"{'href': 'https://www.thestreet.com', 'title': 'TheStreet'}",TSLA
74,74,74,"If You Invested $1000 In Tesla Stock When Donald Trump Announced He Was Running For President, Here's How ... - Markets Insider","If You Invested $1000 In Tesla Stock When Donald Trump Announced He Was Running For President, Here's How ...  Markets Insider","Sun, 06 Nov 2022 07:00:00 GMT",https://news.google.com/rss/articles/CBMitwFodHRwczovL21hcmtldHMuYnVzaW5lc3NpbnNpZGVyLmNvbS9uZXdzL3N0b2Nrcy9pZi15b3UtaW52ZXN0ZWQtMS0wMDAtaW4tdGVzbGEtc3RvY2std2hlbi1kb25hbGQtdHJ1bXAtYW5ub3VuY2VkLWhlLXdhcy1ydW5uaW5nLWZvci1wcmVzaWRlbnQtaGVyZS1zLWhvdy1tdWNoLXlvdS1kLWhhdmUtbm93LTEwMzE4Nzg0NzLSAQA?oc=5&hl=en-MY&gl=MY&ceid=MY:en,"{'href': 'https://markets.businessinsider.com', 'title': 'Markets Insider'}",TSLA
75,75,75,Tesla (TSLA) ended Q3 2022 with $21.1 billion in cash - Shacknews,Tesla (TSLA) ended Q3 2022 with $21.1 billion in cash  Shacknews,"Wed, 19 Oct 2022 07:00:00 GMT",https://news.google.com/rss/articles/CBMiSGh0dHBzOi8vd3d3LnNoYWNrbmV3cy5jb20vYXJ0aWNsZS8xMzI3MzgvdGVzbGEtdHNsYS1xMy0yMDIyLWNhc2gtb24taGFuZNIBAA?oc=5&hl=en-MY&gl=MY&ceid=MY:en,"{'href': 'https://www.shacknews.com', 'title': 'Shacknews'}",TSLA
76,76,76,Musk says it is likely that Tesla (TSLA) will do a share buyback in 2023 - Shacknews,Musk says it is likely that Tesla (TSLA) will do a share buyback in 2023  Shacknews,"Wed, 19 Oct 2022 07:00:00 GMT",https://news.google.com/rss/articles/CBMiSGh0dHBzOi8vd3d3LnNoYWNrbmV3cy5jb20vYXJ0aWNsZS8xMzI3NDcvdGVzbGEtc2hhcmUtYnV5YmFjay1saWtlbHktMjAyM9IBAA?oc=5&hl=en-MY&gl=MY&ceid=MY:en,"{'href': 'https://www.shacknews.com', 'title': 'Shacknews'}",TSLA
77,77,77,Tesla (TSLA) reported an automotive gross margin of 27.9% in Q3 2022 - Shacknews,Tesla (TSLA) reported an automotive gross margin of 27.9% in Q3 2022  Shacknews,"Wed, 19 Oct 2022 07:00:00 GMT",https://news.google.com/rss/articles/CBMiSGh0dHBzOi8vd3d3LnNoYWNrbmV3cy5jb20vYXJ0aWNsZS8xMzI3NDAvdGVzbGEtdHNsYS1xMy0yMDIyLWdyb3NzLW1hcmdpbtIBUmh0dHBzOi8vd3d3LnNoYWNrbmV3cy5jb20vYXJ0aWNsZS8xMzI3NDAvdGVzbGEtdHNsYS1xMy0yMDIyLWdyb3NzLW1hcmdpbj9hbXBodG1sPTE?oc=5&hl=en-MY&gl=MY&ceid=MY:en,"{'href': 'https://www.shacknews.com', 'title': 'Shacknews'}",TSLA
78,78,78,Elon Musk Sells $3.6 Billion Of Tesla Stock As TSLA Is Down 60% YTD - InsideEVs,Elon Musk Sells $3.6 Billion Of Tesla Stock As TSLA Is Down 60% YTD  InsideEVs ,"Fri, 16 Dec 2022 08:00:00 GMT",https://news.google.com/rss/articles/CBMibmh0dHBzOi8vaW5zaWRlZXZzLmNvbS9uZXdzLzYyNjkzOS9lbG9uLW11c2stc2VsbHMtM3BvaW50Ni1iaWxsaW9uLXVzZC10ZXNsYS1zdG9jay10c2xhLWRvd24tNTVwZXJjZW50LWluLTIwMjIv0gFyaHR0cHM6Ly9pbnNpZGVldnMuY29tL25ld3MvNjI2OTM5L2Vsb24tbXVzay1zZWxscy0zcG9pbnQ2LWJpbGxpb24tdXNkLXRlc2xhLXN0b2NrLXRzbGEtZG93bi01NXBlcmNlbnQtaW4tMjAyMi9hbXAv?oc=5&hl=en-MY&gl=MY&ceid=MY:en,"{'href': 'https://insideevs.com', 'title': 'InsideEVs'}",TSLA
79,79,79,Tesla Denies Malfunction to Blame for Deadly Crash Caught on Video in China - Bloomberg,Tesla Denies Malfunction to Blame for Deadly Crash Caught on Video in China  Bloomberg,"Sun, 13 Nov 2022 08:00:00 GMT",https://news.google.com/rss/articles/CBMicGh0dHBzOi8vd3d3LmJsb29tYmVyZy5jb20vbmV3cy9hcnRpY2xlcy8yMDIyLTExLTE0L3Rlc2xhLXRvLWFzc2lzdC1pbnZlc3RpZ2F0aW9uLWludG8tZmF0YWwtY2hpbmVzZS1jYXItYWNjaWRlbnTSAQA?oc=5&hl=en-MY&gl=MY&ceid=MY:en,"{'href': 'https://www.bloomberg.com', 'title': 'Bloomberg'}",TSLA
80,80,80,Here's How Much Tesla Has Dragged Down The S&P 500 Since It Was Added 2 Years Ago - Tesla (NASDAQ:TSLA) - Benzinga,Here's How Much Tesla Has Dragged Down The S&P 500 Since It Was Added 2 Years Ago - Tesla (NASDAQ:TSLA)  Benzinga,"Fri, 23 Dec 2022 08:00:00 GMT",https://news.google.com/rss/articles/CBMiigFodHRwczovL3d3dy5iZW56aW5nYS5jb20vZ2VuZXJhbC9lZHVjYXRpb24vMjIvMTIvMzAxODk0MTEvaGVyZXMtaG93LW11Y2gtdGVzbGEtaGFzLWRyYWdnZWQtZG93bi10aGUtcy1wLTUwMC1zaW5jZS1pdC13YXMtYWRkZWQtMi15ZWFycy1hZ2_SAS1odHRwczovL3d3dy5iZW56aW5nYS5jb20vYW1wL2NvbnRlbnQvMzAxODk0MTE?oc=5&hl=en-MY&gl=MY&ceid=MY:en,"{'href': 'https://www.benzinga.com', 'title': 'Benzinga'}",TSLA
81,81,81,Tesla Tops Apple As Most Popular Stock With Retail Investors in 2022 - Markets Insider,Tesla Tops Apple As Most Popular Stock With Retail Investors in 2022  Markets Insider,"Wed, 21 Dec 2022 08:00:00 GMT",https://news.google.com/rss/articles/CBMifmh0dHBzOi8vbWFya2V0cy5idXNpbmVzc2luc2lkZXIuY29tL25ld3Mvc3RvY2tzL3Rlc2xhLXRzbGEtYXBwbGUtc3RvY2stcHJpY2UtaW52ZXN0b3JzLXBvcHVsYXItZmF2b3JpdGUtcmV0YWlsLW1hcmtldHMtMjAyMi0xMtIBAA?oc=5&hl=en-MY&gl=MY&ceid=MY:en,"{'href': 'https://markets.businessinsider.com', 'title': 'Markets Insider'}",TSLA
82,82,82,Tesla's market cap drop is worth almost the entire legacy auto industry - Electrek.co,Tesla's market cap drop is worth almost the entire legacy auto industry  Electrek.co,"Wed, 28 Dec 2022 08:00:00 GMT",https://news.google.com/rss/articles/CBMiY2h0dHBzOi8vZWxlY3RyZWsuY28vMjAyMi8xMi8yOC90ZXNsYS10c2xhLW1hcmtldC1jYXAtZHJvcC13b3J0aC1hbG1vc3QtZW50aXJlLWxlZ2FjeS1hdXRvLWluZHVzdHJ5L9IBAA?oc=5&hl=en-MY&gl=MY&ceid=MY:en,"{'href': 'https://electrek.co', 'title': 'Electrek.co'}",TSLA
83,83,83,"Tesla (TSLA) delivered 343,840 EVs in Q3 2022, missing expectations - Shacknews","Tesla (TSLA) delivered 343,840 EVs in Q3 2022, missing expectations  Shacknews","Mon, 03 Oct 2022 07:00:00 GMT",https://news.google.com/rss/articles/CBMiSmh0dHBzOi8vd3d3LnNoYWNrbmV3cy5jb20vYXJ0aWNsZS8xMzI1MTQvdHNsYS10ZXNsYS1xMy0yMDIyLWRlbGl2ZXJpZXMtZXZz0gFUaHR0cHM6Ly93d3cuc2hhY2tuZXdzLmNvbS9hcnRpY2xlLzEzMjUxNC90c2xhLXRlc2xhLXEzLTIwMjItZGVsaXZlcmllcy1ldnM_YW1waHRtbD0x?oc=5&hl=en-MY&gl=MY&ceid=MY:en,"{'href': 'https://www.shacknews.com', 'title': 'Shacknews'}",TSLA
84,84,84,"Tesla (NASDAQ:TSLA) Shrinks its Solar Business, Cancels Projects - TipRanks.com - TipRanks","Tesla (NASDAQ:TSLA) Shrinks its Solar Business, Cancels Projects - TipRanks.com  TipRanks","Fri, 11 Nov 2022 11:01:20 GMT",https://news.google.com/rss/articles/CBMiWmh0dHBzOi8vd3d3LnRpcHJhbmtzLmNvbS9uZXdzL3Rlc2xhLW5hc2RhcXRzbGEtY3V0cy1vbi1zb2xhci1wcm9qZWN0cy1wb3N0LW11c2tzLXN0YWtlLWN1dNIBAA?oc=5&hl=en-MY&gl=MY&ceid=MY:en,"{'href': 'https://www.tipranks.com', 'title': 'TipRanks'}",TSLA
85,85,85,Tesla (TSLA) offers 10000 free Supercharging miles to buyers as it tries to create urgency - Electrek.co,Tesla (TSLA) offers 10000 free Supercharging miles to buyers as it tries to create urgency  Electrek.co,"Thu, 15 Dec 2022 08:00:00 GMT",https://news.google.com/rss/articles/CBMieGh0dHBzOi8vZWxlY3RyZWsuY28vMjAyMi8xMi8xNS90ZXNsYS10c2xhLW9mZmVycy0xMDAwMC1mcmVlLXN1cGVyY2hhcmdpbmctbWlsZXMtdG8tYnV5ZXJzLWFzLWl0LXRyaWVzLXRvLWNyZWF0ZS11cmdlbmN5L9IBAA?oc=5&hl=en-MY&gl=MY&ceid=MY:en,"{'href': 'https://electrek.co', 'title': 'Electrek.co'}",TSLA
