Unnamed: 0,Unnamed: 0.1,title,description,published date,url,publisher,company
0,0,Amazon (AMZN) Stock Moves -1.09%: What You Should Know - Yahoo Finance,Amazon (AMZN) Stock Moves -1.09%: What You Should Know  Yahoo Finance,"Wed, 20 Dec 2023 08:00:00 GMT",https://news.google.com/rss/articles/CBMiR2h0dHBzOi8vZmluYW5jZS55YWhvby5jb20vbmV3cy9hbWF6b24tYW16bi1zdG9jay1tb3Zlcy0xLTIyNDUxOTUxMi5odG1s0gEA?oc=5&hl=en-MY&gl=MY&ceid=MY:en,"{'href': 'https://finance.yahoo.com', 'title': 'Yahoo Finance'}",AMZN
1,1,Amazon Stock: How AMZN Became An Advertising Juggernaut - Investor's Business Daily,Amazon Stock: How AMZN Became An Advertising Juggernaut  Investor's Business Daily,"Thu, 05 Oct 2023 07:00:00 GMT",https://news.google.com/rss/articles/CBMiYWh0dHBzOi8vd3d3LmludmVzdG9ycy5jb20vbmV3cy90ZWNobm9sb2d5L2FtYXpvbi1zdG9jay1ob3ctYW16bi1iZWNhbWUtYW4tYWR2ZXJ0aXNpbmctanVnZ2VybmF1dC_SAQA?oc=5&hl=en-MY&gl=MY&ceid=MY:en,"{'href': 'https://www.investors.com', 'title': ""Investor's Business Daily""}",AMZN
2,2,"Amazon Stock (NASDAQ:AMZN): Every Analyst Covering It Says ""Buy."" Should You? - Nasdaq","Amazon Stock (NASDAQ:AMZN): Every Analyst Covering It Says ""Buy."" Should You?  Nasdaq","Mon, 13 Nov 2023 08:00:00 GMT",https://news.google.com/rss/articles/CBMiaGh0dHBzOi8vd3d3Lm5hc2RhcS5jb20vYXJ0aWNsZXMvYW1hem9uLXN0b2NrLW5hc2RhcTphbXpuOi1ldmVyeS1hbmFseXN0LWNvdmVyaW5nLWl0LXNheXMtYnV5Li1zaG91bGQteW910gEA?oc=5&hl=en-MY&gl=MY&ceid=MY:en,"{'href': 'https://www.nasdaq.com', 'title': 'Nasdaq'}",AMZN
3,3,"Amazon reports better-than-expected results, as revenue jumps 13% - CNBC","Amazon reports better-than-expected results, as revenue jumps 13%  CNBC","Thu, 26 Oct 2023 07:00:00 GMT",https://news.google.com/rss/articles/CBMiSGh0dHBzOi8vd3d3LmNuYmMuY29tLzIwMjMvMTAvMjYvYW1hem9uLWFtem4tcTMtZWFybmluZ3MtcmVwb3J0LTIwMjMuaHRtbNIBTGh0dHBzOi8vd3d3LmNuYmMuY29tL2FtcC8yMDIzLzEwLzI2L2FtYXpvbi1hbXpuLXEzLWVhcm5pbmdzLXJlcG9ydC0yMDIzLmh0bWw?oc=5&hl=en-MY&gl=MY&ceid=MY:en,"{'href': 'https://www.cnbc.com', 'title': 'CNBC'}",AMZN
4,4,New Amazon Prime benefit: One Medical health care for $9 a month - About Amazon,New Amazon Prime benefit: One Medical health care for $9 a month  About Amazon,"Wed, 08 Nov 2023 08:00:00 GMT",https://news.google.com/rss/articles/CBMiSGh0dHBzOi8vd3d3LmFib3V0YW1hem9uLmNvbS9uZXdzL3JldGFpbC9vbmUtbWVkaWNhbC1hbWF6b24tcHJpbWUtYmVuZWZpdNIBAA?oc=5&hl=en-MY&gl=MY&ceid=MY:en,"{'href': 'https://www.aboutamazon.com', 'title': 'About Amazon'}",AMZN
5,5,Amazon (AMZN) stock forecast and price prediction - USA TODAY,Amazon (AMZN) stock forecast and price prediction  USA TODAY,"Fri, 27 Oct 2023 07:00:00 GMT",https://news.google.com/rss/articles/CBMiSWh0dHBzOi8vd3d3LnVzYXRvZGF5LmNvbS9tb25leS9ibHVlcHJpbnQvaW52ZXN0aW5nL3N0b2NrLWZvcmVjYXN0LWFtYXpvbi_SAQA?oc=5&hl=en-MY&gl=MY&ceid=MY:en,"{'href': 'https://www.usatoday.com', 'title': 'USA TODAY'}",AMZN
6,6,Amazon Stock Pops More Than 5% as Earnings and Revenue Crush Expectations - The Motley Fool,Amazon Stock Pops More Than 5% as Earnings and Revenue Crush Expectations  The Motley Fool,"Fri, 27 Oct 2023 07:00:00 GMT",https://news.google.com/rss/articles/CBMiRmh0dHBzOi8vd3d3LmZvb2wuY29tL2ludmVzdGluZy8yMDIzLzEwLzI3L2Ftem4tc3RvY2stZWFybmluZ3MtcTMtMjAyMy_SAQA?oc=5&hl=en-MY&gl=MY&ceid=MY:en,"{'href': 'https://www.fool.com', 'title': 'The Motley Fool'}",AMZN
7,7,Can Amazon Stock (NASDAQ:AMZN) Reach Record Highs in 2024? - Yahoo Finance,Can Amazon Stock (NASDAQ:AMZN) Reach Record Highs in 2024?  Yahoo Finance,"Thu, 23 Nov 2023 08:00:00 GMT",https://news.google.com/rss/articles/CBMiTGh0dHBzOi8vZmluYW5jZS55YWhvby5jb20vbmV3cy9hbWF6b24tc3RvY2stbmFzZGFxLWFtem4tcmVhY2gtMjIxMzMyNTUwLmh0bWzSAQA?oc=5&hl=en-MY&gl=MY&ceid=MY:en,"{'href': 'https://finance.yahoo.com', 'title': 'Yahoo Finance'}",AMZN
8,8,"Amazon Stock: AMZN Rises As Earnings Beat, AWS Builds AI Momentum - Investor's Business Daily","Amazon Stock: AMZN Rises As Earnings Beat, AWS Builds AI Momentum  Investor's Business Daily","Fri, 27 Oct 2023 07:00:00 GMT",https://news.google.com/rss/articles/CBMiTWh0dHBzOi8vd3d3LmludmVzdG9ycy5jb20vbmV3cy90ZWNobm9sb2d5L2FtYXpvbi1zdG9jay1hbXpuLXEzLWVhcm5pbmdzLTIwMjMv0gEA?oc=5&hl=en-MY&gl=MY&ceid=MY:en,"{'href': 'https://www.investors.com', 'title': ""Investor's Business Daily""}",AMZN
9,9,"Amazon announces new fulfillment center robots, Sequoia and Digit - About Amazon","Amazon announces new fulfillment center robots, Sequoia and Digit  About Amazon","Wed, 18 Oct 2023 07:00:00 GMT",https://news.google.com/rss/articles/CBMiVGh0dHBzOi8vd3d3LmFib3V0YW1hem9uLmNvbS9uZXdzL29wZXJhdGlvbnMvYW1hem9uLWludHJvZHVjZXMtbmV3LXJvYm90aWNzLXNvbHV0aW9uc9IBAA?oc=5&hl=en-MY&gl=MY&ceid=MY:en,"{'href': 'https://www.aboutamazon.com', 'title': 'About Amazon'}",AMZN
10,10,Amazon (AMZN) Stock Sinks As Market Gains: What You Should Know - Yahoo Finance,Amazon (AMZN) Stock Sinks As Market Gains: What You Should Know  Yahoo Finance,"Thu, 14 Dec 2023 08:00:00 GMT",https://news.google.com/rss/articles/CBMiTGh0dHBzOi8vZmluYW5jZS55YWhvby5jb20vbmV3cy9hbWF6b24tYW16bi1zdG9jay1zaW5rcy1tYXJrZXQtMjI0NTE5NDg3Lmh0bWzSAQA?oc=5&hl=en-MY&gl=MY&ceid=MY:en,"{'href': 'https://finance.yahoo.com', 'title': 'Yahoo Finance'}",AMZN
11,11,AMZN Stock: Is Microsoft Or Google A Better Preview For AWS Earnings? - Investor's Business Daily,AMZN Stock: Is Microsoft Or Google A Better Preview For AWS Earnings?  Investor's Business Daily,"Wed, 25 Oct 2023 07:00:00 GMT",https://news.google.com/rss/articles/CBMiWGh0dHBzOi8vd3d3LmludmVzdG9ycy5jb20vbmV3cy90ZWNobm9sb2d5L2Ftem4tc3RvY2stcTMtMjAyMy1lYXJuaW5ncy1wcmV2aWV3LW1zZnQtZ29vZy_SAQA?oc=5&hl=en-MY&gl=MY&ceid=MY:en,"{'href': 'https://www.investors.com', 'title': ""Investor's Business Daily""}",AMZN
12,12,Is Amazon (AMZN) a Buy as Wall Street Analysts Look Optimistic? - Yahoo Finance,Is Amazon (AMZN) a Buy as Wall Street Analysts Look Optimistic?  Yahoo Finance,"Mon, 25 Dec 2023 08:00:00 GMT",https://news.google.com/rss/articles/CBMiSWh0dHBzOi8vZmluYW5jZS55YWhvby5jb20vbmV3cy9hbWF6b24tYW16bi1idXktd2FsbC1zdHJlZXQtMTQzMDA2MDY2Lmh0bWzSAQA?oc=5&hl=en-MY&gl=MY&ceid=MY:en,"{'href': 'https://finance.yahoo.com', 'title': 'Yahoo Finance'}",AMZN
13,13,Amazon Stock: AMZN Is Still The Favorite For Gen Z Shoppers As Temu Challenges - Investor's Business Daily,Amazon Stock: AMZN Is Still The Favorite For Gen Z Shoppers As Temu Challenges  Investor's Business Daily,"Wed, 11 Oct 2023 07:00:00 GMT",https://news.google.com/rss/articles/CBMidWh0dHBzOi8vd3d3LmludmVzdG9ycy5jb20vbmV3cy90ZWNobm9sb2d5L2FtYXpvbi1zdG9jay1hbXpuLXN0aWxsLXRoZS1mYXZvcml0ZS1mb3ItZ2VuLXotc2hvcHBlcnMtYXMtdGVtdS1jaGFsbGVuZ2VzL9IBAA?oc=5&hl=en-MY&gl=MY&ceid=MY:en,"{'href': 'https://www.investors.com', 'title': ""Investor's Business Daily""}",AMZN
14,14,"Amazon.com, Inc. (NASDAQ:AMZN) Q3 2023 Earnings Call Transcript - Yahoo Finance","Amazon.com, Inc. (NASDAQ:AMZN) Q3 2023 Earnings Call Transcript  Yahoo Finance","Fri, 27 Oct 2023 07:00:00 GMT",https://news.google.com/rss/articles/CBMiSGh0dHBzOi8vZmluYW5jZS55YWhvby5jb20vbmV3cy9hbWF6b24tY29tLWluYy1uYXNkYXEtYW16bi0xNTU5MDEwOTIuaHRtbNIBAA?oc=5&hl=en-MY&gl=MY&ceid=MY:en,"{'href': 'https://finance.yahoo.com', 'title': 'Yahoo Finance'}",AMZN
15,15,Here's Why You Should Consider Acquiring Amazon (AMZN) Shares - Yahoo Finance,Here's Why You Should Consider Acquiring Amazon (AMZN) Shares  Yahoo Finance,"Fri, 08 Dec 2023 08:00:00 GMT",https://news.google.com/rss/articles/CBMiUGh0dHBzOi8vZmluYW5jZS55YWhvby5jb20vbmV3cy93aHktY29uc2lkZXItYWNxdWlyaW5nLWFtYXpvbi1hbXpuLTA2NTEwMjI3NC5odG1s0gEA?oc=5&hl=en-MY&gl=MY&ceid=MY:en,"{'href': 'https://finance.yahoo.com', 'title': 'Yahoo Finance'}",AMZN
16,16,Amazon (AMZN) Stock Drops Despite Market Gains: Important Facts to Note - Yahoo Finance,Amazon (AMZN) Stock Drops Despite Market Gains: Important Facts to Note  Yahoo Finance,"Wed, 27 Dec 2023 08:00:00 GMT",https://news.google.com/rss/articles/CBMiTWh0dHBzOi8vZmluYW5jZS55YWhvby5jb20vbmV3cy9hbWF6b24tYW16bi1zdG9jay1kcm9wcy1kZXNwaXRlLTIyNDUyMjY0Ny5odG1s0gEA?oc=5&hl=en-MY&gl=MY&ceid=MY:en,"{'href': 'https://finance.yahoo.com', 'title': 'Yahoo Finance'}",AMZN
17,17,Amazon Stock (NASDAQ:AMZN): The Ultimate Holiday Season Winner - TipRanks.com - TipRanks,Amazon Stock (NASDAQ:AMZN): The Ultimate Holiday Season Winner - TipRanks.com  TipRanks,"Mon, 27 Nov 2023 22:02:28 GMT",https://news.google.com/rss/articles/CBMiYGh0dHBzOi8vd3d3LnRpcHJhbmtzLmNvbS9uZXdzL2FydGljbGUvYW1hem9uLXN0b2NrLW5hc2RhcWFtem4tdGhlLXVsdGltYXRlLWhvbGlkYXktc2Vhc29uLXdpbm5lctIBAA?oc=5&hl=en-MY&gl=MY&ceid=MY:en,"{'href': 'https://www.tipranks.com', 'title': 'TipRanks'}",AMZN
18,18,Amazon’s stock cheered as 2024 top pick — even after a 75% jump this year - MarketWatch,Amazon’s stock cheered as 2024 top pick — even after a 75% jump this year  MarketWatch,"Thu, 07 Dec 2023 08:00:00 GMT",https://news.google.com/rss/articles/CBMicGh0dHBzOi8vd3d3Lm1hcmtldHdhdGNoLmNvbS9zdG9yeS9hbWF6b25zLXN0b2NrLWNoZWVyZWQtYXMtMjAyNC10b3AtcGljay1ldmVuLWFmdGVyLWEtNzUtanVtcC10aGlzLXllYXItMTg1NTQ1MDnSAXRodHRwczovL3d3dy5tYXJrZXR3YXRjaC5jb20vYW1wL3N0b3J5L2FtYXpvbnMtc3RvY2stY2hlZXJlZC1hcy0yMDI0LXRvcC1waWNrLWV2ZW4tYWZ0ZXItYS03NS1qdW1wLXRoaXMteWVhci0xODU1NDUwOQ?oc=5&hl=en-MY&gl=MY&ceid=MY:en,"{'href': 'https://www.marketwatch.com', 'title': 'MarketWatch'}",AMZN
19,19,AMZN Stock: Can New NFL Game Boost Amazon's Black Friday Sales? - Investor's Business Daily,AMZN Stock: Can New NFL Game Boost Amazon's Black Friday Sales?  Investor's Business Daily,"Fri, 24 Nov 2023 08:00:00 GMT",https://news.google.com/rss/articles/CBMiZ2h0dHBzOi8vd3d3LmludmVzdG9ycy5jb20vbmV3cy90ZWNobm9sb2d5L2Ftem4tc3RvY2stYmxhY2stZnJpZGF5LXBsYXlib29rLWluY2x1ZGVzLW5mbC1icm9hZGNhc3QtZGVhbC_SAQA?oc=5&hl=en-MY&gl=MY&ceid=MY:en,"{'href': 'https://www.investors.com', 'title': ""Investor's Business Daily""}",AMZN
20,20,Amazon Stock (NASDAQ:AMZN): The Growth Story is Shaping Up Well - Nasdaq,Amazon Stock (NASDAQ:AMZN): The Growth Story is Shaping Up Well  Nasdaq,"Wed, 18 Oct 2023 07:00:00 GMT",https://news.google.com/rss/articles/CBMiXWh0dHBzOi8vd3d3Lm5hc2RhcS5jb20vYXJ0aWNsZXMvYW1hem9uLXN0b2NrLW5hc2RhcTphbXpuOi10aGUtZ3Jvd3RoLXN0b3J5LWlzLXNoYXBpbmctdXAtd2VsbNIBAA?oc=5&hl=en-MY&gl=MY&ceid=MY:en,"{'href': 'https://www.nasdaq.com', 'title': 'Nasdaq'}",AMZN
21,21,Why Amazon (AMZN) Might be Well Poised for a Surge - Yahoo Finance,Why Amazon (AMZN) Might be Well Poised for a Surge  Yahoo Finance,"Wed, 01 Nov 2023 07:00:00 GMT",https://news.google.com/rss/articles/CBMiSGh0dHBzOi8vZmluYW5jZS55YWhvby5jb20vbmV3cy93aHktYW1hem9uLWFtem4tbWlnaHQtd2VsbC0xNjIwMDYzOTMuaHRtbNIBAA?oc=5&hl=en-MY&gl=MY&ceid=MY:en,"{'href': 'https://finance.yahoo.com', 'title': 'Yahoo Finance'}",AMZN
22,22,"New Amazon AI initiative includes scholarships, free AI courses - About Amazon","New Amazon AI initiative includes scholarships, free AI courses  About Amazon","Mon, 20 Nov 2023 08:00:00 GMT",https://news.google.com/rss/articles/CBMiSGh0dHBzOi8vd3d3LmFib3V0YW1hem9uLmNvbS9uZXdzL2F3cy9hd3MtZnJlZS1haS1za2lsbHMtdHJhaW5pbmctY291cnNlc9IBAA?oc=5&hl=en-MY&gl=MY&ceid=MY:en,"{'href': 'https://www.aboutamazon.com', 'title': 'About Amazon'}",AMZN
23,23,Amazon stock dropped after Alphabet's earnings news. Here's why. - USA TODAY,Amazon stock dropped after Alphabet's earnings news. Here's why.  USA TODAY,"Wed, 25 Oct 2023 07:00:00 GMT",https://news.google.com/rss/articles/CBMiYWh0dHBzOi8vd3d3LnVzYXRvZGF5LmNvbS9zdG9yeS9tb25leS8yMDIzLzEwLzI1L2FtYXpvbi1zdG9jay1kcm9wcy1hbHBoYWJldC1lYXJuaW5ncy83MTMxNjE3NzAwNy_SAQA?oc=5&hl=en-MY&gl=MY&ceid=MY:en,"{'href': 'https://www.usatoday.com', 'title': 'USA TODAY'}",AMZN
24,24,Where Will Amazon Stock Be in 2024? - Yahoo Finance,Where Will Amazon Stock Be in 2024?  Yahoo Finance,"Thu, 28 Dec 2023 08:00:00 GMT",https://news.google.com/rss/articles/CBMiRWh0dHBzOi8vZmluYW5jZS55YWhvby5jb20vbmV3cy93aGVyZS1hbWF6b24tc3RvY2stMjAyNC0yMDU4NDI5MjAuaHRtbNIBAA?oc=5&hl=en-MY&gl=MY&ceid=MY:en,"{'href': 'https://finance.yahoo.com', 'title': 'Yahoo Finance'}",AMZN
25,25,Amazon Stock Scores Bullish Target Price On Ad Business Potential - Investor's Business Daily,Amazon Stock Scores Bullish Target Price On Ad Business Potential  Investor's Business Daily,"Thu, 21 Dec 2023 08:00:00 GMT",https://news.google.com/rss/articles/CBMib2h0dHBzOi8vd3d3LmludmVzdG9ycy5jb20vbmV3cy90ZWNobm9sb2d5L2FtYXpvbi1zdG9jay1nZXRzLWJ1bGxpc2gtbmV3LXRhcmdldC1hZC1idXNpbmVzcy1pcy1wcmltZS1mb3ItZ3Jvd3RoL9IBAA?oc=5&hl=en-MY&gl=MY&ceid=MY:en,"{'href': 'https://www.investors.com', 'title': ""Investor's Business Daily""}",AMZN
26,26,Amazon shares jump as analysts praise third-quarter results - CNBC,Amazon shares jump as analysts praise third-quarter results  CNBC,"Fri, 27 Oct 2023 07:00:00 GMT",https://news.google.com/rss/articles/CBMiSmh0dHBzOi8vd3d3LmNuYmMuY29tLzIwMjMvMTAvMjcvYW1hem9uLXN0b2NrLXVwLW9uLXEzLWVhcm5pbmdzLXJlcG9ydC5odG1s0gFOaHR0cHM6Ly93d3cuY25iYy5jb20vYW1wLzIwMjMvMTAvMjcvYW1hem9uLXN0b2NrLXVwLW9uLXEzLWVhcm5pbmdzLXJlcG9ydC5odG1s?oc=5&hl=en-MY&gl=MY&ceid=MY:en,"{'href': 'https://www.cnbc.com', 'title': 'CNBC'}",AMZN
27,27,Is it Still Safe to Invest in Amazon (AMZN)? - Yahoo Finance,Is it Still Safe to Invest in Amazon (AMZN)?  Yahoo Finance,"Sat, 04 Nov 2023 07:00:00 GMT",https://news.google.com/rss/articles/CBMiS2h0dHBzOi8vZmluYW5jZS55YWhvby5jb20vbmV3cy9zdGlsbC1zYWZlLWludmVzdC1hbWF6b24tYW16bi0wNTIzNDA4NzIuaHRtbNIBAA?oc=5&hl=en-MY&gl=MY&ceid=MY:en,"{'href': 'https://finance.yahoo.com', 'title': 'Yahoo Finance'}",AMZN
28,28,"Calculating The Fair Value Of Amazon.com, Inc. (NASDAQ:AMZN) - Yahoo Finance","Calculating The Fair Value Of Amazon.com, Inc. (NASDAQ:AMZN)  Yahoo Finance","Fri, 01 Dec 2023 08:00:00 GMT",https://news.google.com/rss/articles/CBMiT2h0dHBzOi8vZmluYW5jZS55YWhvby5jb20vbmV3cy9jYWxjdWxhdGluZy1mYWlyLXZhbHVlLWFtYXpvbi1jb20tMTIwMDE2NzgzLmh0bWzSAQA?oc=5&hl=en-MY&gl=MY&ceid=MY:en,"{'href': 'https://finance.yahoo.com', 'title': 'Yahoo Finance'}",AMZN
29,29,"Amazon (AMZN), Microsoft (MSFT) Fight for Cloud Computing Government Contracts - Bloomberg","Amazon (AMZN), Microsoft (MSFT) Fight for Cloud Computing Government Contracts  Bloomberg","Thu, 16 Nov 2023 08:00:00 GMT",https://news.google.com/rss/articles/CBMifGh0dHBzOi8vd3d3LmJsb29tYmVyZy5jb20vbmV3cy9hcnRpY2xlcy8yMDIzLTExLTE2L2FtYXpvbi1hbXpuLW1pY3Jvc29mdC1tc2Z0LWZpZ2h0LWZvci1jbG91ZC1jb21wdXRpbmctZ292ZXJubWVudC1jb250cmFjdHPSAQA?oc=5&hl=en-MY&gl=MY&ceid=MY:en,"{'href': 'https://www.bloomberg.com', 'title': 'Bloomberg'}",AMZN
30,30,Amazon.com's (AMZN) Quarterly Results Far Exceed Expectations - Yahoo Finance,Amazon.com's (AMZN) Quarterly Results Far Exceed Expectations  Yahoo Finance,"Tue, 05 Dec 2023 08:00:00 GMT",https://news.google.com/rss/articles/CBMiT2h0dHBzOi8vZmluYW5jZS55YWhvby5jb20vbmV3cy9hbWF6b24tY29tLWFtem4tcXVhcnRlcmx5LXJlc3VsdHMtMDk1MjQ0ODExLmh0bWzSAQA?oc=5&hl=en-MY&gl=MY&ceid=MY:en,"{'href': 'https://finance.yahoo.com', 'title': 'Yahoo Finance'}",AMZN
31,31,Amazon (AMZN) Bets on One Medical After Past Health-Care Initiatives Sputter - Bloomberg,Amazon (AMZN) Bets on One Medical After Past Health-Care Initiatives Sputter  Bloomberg,"Mon, 27 Nov 2023 08:00:00 GMT",https://news.google.com/rss/articles/CBMifWh0dHBzOi8vd3d3LmJsb29tYmVyZy5jb20vbmV3cy9mZWF0dXJlcy8yMDIzLTExLTI3L2FtYXpvbi1hbXpuLWJldHMtb24tb25lLW1lZGljYWwtYWZ0ZXItcGFzdC1oZWFsdGgtY2FyZS1pbml0aWF0aXZlcy1zcHV0dGVy0gEA?oc=5&hl=en-MY&gl=MY&ceid=MY:en,"{'href': 'https://www.bloomberg.com', 'title': 'Bloomberg'}",AMZN
32,32,"Weekly Preview: Earnings To Watch (AMZN, META, MSFT) - Nasdaq","Weekly Preview: Earnings To Watch (AMZN, META, MSFT)  Nasdaq","Sun, 22 Oct 2023 07:00:00 GMT",https://news.google.com/rss/articles/CBMiXmh0dHBzOi8vd3d3Lm5hc2RhcS5jb20vYXJ0aWNsZXMvd2Vla2x5LXByZXZpZXctZWFybmluZ3MtdG8td2F0Y2gtdGhpcy13ZWVrLWFtem4taW50Yy1tZXRhLW1zZnTSAQA?oc=5&hl=en-MY&gl=MY&ceid=MY:en,"{'href': 'https://www.nasdaq.com', 'title': 'Nasdaq'}",AMZN
33,33,Amazon Stock: Why AMZN Could See Sales Boost From Prime Video Ads - Investor's Business Daily,Amazon Stock: Why AMZN Could See Sales Boost From Prime Video Ads  Investor's Business Daily,"Mon, 02 Oct 2023 07:00:00 GMT",https://news.google.com/rss/articles/CBMia2h0dHBzOi8vd3d3LmludmVzdG9ycy5jb20vbmV3cy90ZWNobm9sb2d5L2FtYXpvbi1zdG9jay13aHktYW16bi1jb3VsZC1zZWUtc2FsZXMtYm9vc3QtZnJvbS1wcmltZS12aWRlby1hZHMv0gEA?oc=5&hl=en-MY&gl=MY&ceid=MY:en,"{'href': 'https://www.investors.com', 'title': ""Investor's Business Daily""}",AMZN
34,34,Great Sales and New AI Can't Stop Amazon's (NASDAQ:AMZN) Slump - TipRanks.com - TipRanks,Great Sales and New AI Can't Stop Amazon's (NASDAQ:AMZN) Slump - TipRanks.com  TipRanks,"Tue, 28 Nov 2023 18:42:32 GMT",https://news.google.com/rss/articles/CBMiUmh0dHBzOi8vd3d3LnRpcHJhbmtzLmNvbS9uZXdzL2dyZWF0LXNhbGVzLW5ldy1haS1jYW50LXN0b3AtYW1hem9uLW5hc2RhcWFtem4tc2x1bXDSAQA?oc=5&hl=en-MY&gl=MY&ceid=MY:en,"{'href': 'https://www.tipranks.com', 'title': 'TipRanks'}",AMZN
35,35,"Amazon Shares Soar on Earnings Beat, Pulling Nasdaq Higher - Investopedia","Amazon Shares Soar on Earnings Beat, Pulling Nasdaq Higher  Investopedia","Fri, 27 Oct 2023 07:00:00 GMT",https://news.google.com/rss/articles/CBMiXmh0dHBzOi8vd3d3LmludmVzdG9wZWRpYS5jb20vYW1hem9uLXNoYXJlcy1zb2FyLW9uLWVhcm5pbmdzLWJlYXQtcHVsbGluZy1uYXNkYXEtaGlnaGVyLTgzODM2MTfSAQA?oc=5&hl=en-MY&gl=MY&ceid=MY:en,"{'href': 'https://www.investopedia.com', 'title': 'Investopedia'}",AMZN
36,36,"Amazon Stock: Buy, Sell, or Hold? - The Motley Fool","Amazon Stock: Buy, Sell, or Hold?  The Motley Fool","Sat, 18 Nov 2023 08:00:00 GMT",https://news.google.com/rss/articles/CBMiRWh0dHBzOi8vd3d3LmZvb2wuY29tL2ludmVzdGluZy8yMDIzLzExLzE4L2FtYXpvbi1zdG9jay1idXktc2VsbC1ob2xkL9IBAA?oc=5&hl=en-MY&gl=MY&ceid=MY:en,"{'href': 'https://www.fool.com', 'title': 'The Motley Fool'}",AMZN
37,37,Is Still Safe to Invest in Amazon (AMZN)? - Yahoo Finance,Is Still Safe to Invest in Amazon (AMZN)?  Yahoo Finance,"Thu, 07 Dec 2023 08:00:00 GMT",https://news.google.com/rss/articles/CBMiS2h0dHBzOi8vZmluYW5jZS55YWhvby5jb20vbmV3cy9zdGlsbC1zYWZlLWludmVzdC1hbWF6b24tYW16bi0wODQ3NTA3MDMuaHRtbNIBAA?oc=5&hl=en-MY&gl=MY&ceid=MY:en,"{'href': 'https://finance.yahoo.com', 'title': 'Yahoo Finance'}",AMZN
38,38,Amazon: Jeff Bezos' company promoted sexism through meritocracy. - Slate,Amazon: Jeff Bezos' company promoted sexism through meritocracy.  Slate,"Sun, 22 Oct 2023 07:00:00 GMT",https://news.google.com/rss/articles/CBMiZWh0dHBzOi8vc2xhdGUuY29tL2N1bHR1cmUvMjAyMy8xMC9hbWF6b24tamVmZi1iZXpvc3MtY29tcGFueS1wcm9tb3RlZC1zZXhpc20tdGhyb3VnaC1tZXJpdG9jcmFjeS5odG1s0gEA?oc=5&hl=en-MY&gl=MY&ceid=MY:en,"{'href': 'https://slate.com', 'title': 'Slate'}",AMZN
39,39,Should You Hold Amazon.com (AMZN)? - Yahoo Finance,Should You Hold Amazon.com (AMZN)?  Yahoo Finance,"Mon, 16 Oct 2023 07:00:00 GMT",https://news.google.com/rss/articles/CBMiQmh0dHBzOi8vZmluYW5jZS55YWhvby5jb20vbmV3cy9ob2xkLWFtYXpvbi1jb20tYW16bi0xMjMwMzQ4NTQuaHRtbNIBAA?oc=5&hl=en-MY&gl=MY&ceid=MY:en,"{'href': 'https://finance.yahoo.com', 'title': 'Yahoo Finance'}",AMZN
40,40,Is Amazon.com (AMZN) Outperforming Other Retail-Wholesale Stocks This Year? - Yahoo Finance,Is Amazon.com (AMZN) Outperforming Other Retail-Wholesale Stocks This Year?  Yahoo Finance,"Fri, 22 Dec 2023 08:00:00 GMT",https://news.google.com/rss/articles/CBMiUWh0dHBzOi8vZmluYW5jZS55YWhvby5jb20vbmV3cy9hbWF6b24tY29tLWFtem4tb3V0cGVyZm9ybWluZy1vdGhlci0xNDQwMDg4NTQuaHRtbNIBAA?oc=5&hl=en-MY&gl=MY&ceid=MY:en,"{'href': 'https://finance.yahoo.com', 'title': 'Yahoo Finance'}",AMZN
41,41,Amazon’s stock reaches a milestone not seen in 19 months - MarketWatch,Amazon’s stock reaches a milestone not seen in 19 months  MarketWatch,"Tue, 14 Nov 2023 08:00:00 GMT",https://news.google.com/rss/articles/CBMibGh0dHBzOi8vd3d3Lm1hcmtldHdhdGNoLmNvbS9zdG9yeS9hbWF6b25zLXN0b2NrLWlzLWFib3V0LXRvLXJlYWNoLWEtbWlsZXN0b25lLW5vdC1zZWVuLWluLTE5LW1vbnRocy0zOWNhYjIyMdIBcGh0dHBzOi8vd3d3Lm1hcmtldHdhdGNoLmNvbS9hbXAvc3RvcnkvYW1hem9ucy1zdG9jay1pcy1hYm91dC10by1yZWFjaC1hLW1pbGVzdG9uZS1ub3Qtc2Vlbi1pbi0xOS1tb250aHMtMzljYWIyMjE?oc=5&hl=en-MY&gl=MY&ceid=MY:en,"{'href': 'https://www.marketwatch.com', 'title': 'MarketWatch'}",AMZN
42,42,Amazon.com's (NASDAQ:AMZN) five-year earnings growth trails the 10% YoY shareholder returns - Yahoo Finance,Amazon.com's (NASDAQ:AMZN) five-year earnings growth trails the 10% YoY shareholder returns  Yahoo Finance,"Sat, 04 Nov 2023 07:00:00 GMT",https://news.google.com/rss/articles/CBMiSmh0dHBzOi8vZmluYW5jZS55YWhvby5jb20vbmV3cy9hbWF6b24tY29tcy1uYXNkYXEtYW16bi1maXZlLTExMDAxOTA4Ny5odG1s0gEA?oc=5&hl=en-MY&gl=MY&ceid=MY:en,"{'href': 'https://finance.yahoo.com', 'title': 'Yahoo Finance'}",AMZN
43,43,"Is Amazon (AMZN) a Solid Growth Stock? 3 Reasons to Think ""Yes"" - Yahoo Finance","Is Amazon (AMZN) a Solid Growth Stock? 3 Reasons to Think ""Yes""  Yahoo Finance","Mon, 27 Nov 2023 08:00:00 GMT",https://news.google.com/rss/articles/CBMiTGh0dHBzOi8vZmluYW5jZS55YWhvby5jb20vbmV3cy9hbWF6b24tYW16bi1zb2xpZC1ncm93dGgtc3RvY2stMTc0NTA1OTc5Lmh0bWzSAQA?oc=5&hl=en-MY&gl=MY&ceid=MY:en,"{'href': 'https://finance.yahoo.com', 'title': 'Yahoo Finance'}",AMZN
44,44,Amazon Stock (NASDAQ:AMZN): Analysts Bullish Ahead of Key Holiday Season - TipRanks.com - TipRanks,Amazon Stock (NASDAQ:AMZN): Analysts Bullish Ahead of Key Holiday Season - TipRanks.com  TipRanks,"Thu, 16 Nov 2023 05:55:08 GMT",https://news.google.com/rss/articles/CBMiamh0dHBzOi8vd3d3LnRpcHJhbmtzLmNvbS9uZXdzL2FydGljbGUvYW1hem9uLXN0b2NrLW5hc2RhcWFtem4tYW5hbHlzdHMtYnVsbGlzaC1haGVhZC1vZi1rZXktaG9saWRheS1zZWFzb27SAQA?oc=5&hl=en-MY&gl=MY&ceid=MY:en,"{'href': 'https://www.tipranks.com', 'title': 'TipRanks'}",AMZN
45,45,Amazon fulfillment center eliminates plastic outbound packaging - About Amazon,Amazon fulfillment center eliminates plastic outbound packaging  About Amazon,"Wed, 18 Oct 2023 07:00:00 GMT",https://news.google.com/rss/articles/CBMiZmh0dHBzOi8vd3d3LmFib3V0YW1hem9uLmNvbS9uZXdzL3N1c3RhaW5hYmlsaXR5L2FtYXpvbi1mdWxmaWxsbWVudC1jZW50ZXItZWxpbWluYXRlcy1wbGFzdGljLXBhY2thZ2luZ9IBAA?oc=5&hl=en-MY&gl=MY&ceid=MY:en,"{'href': 'https://www.aboutamazon.com', 'title': 'About Amazon'}",AMZN
46,46,3 Reasons Why Amazon (AMZN) Is a Great Growth Stock - Yahoo Finance,3 Reasons Why Amazon (AMZN) Is a Great Growth Stock  Yahoo Finance,"Fri, 29 Dec 2023 08:00:00 GMT",https://news.google.com/rss/articles/CBMiR2h0dHBzOi8vZmluYW5jZS55YWhvby5jb20vbmV3cy8zLXJlYXNvbnMtd2h5LWFtYXpvbi1hbXpuLTE3NDUwNDA4OC5odG1s0gEA?oc=5&hl=en-MY&gl=MY&ceid=MY:en,"{'href': 'https://finance.yahoo.com', 'title': 'Yahoo Finance'}",AMZN
47,47,Why Is Warren Buffett Selling Amazon Stock Instead of Buying It Hand Over Fist? - The Motley Fool,Why Is Warren Buffett Selling Amazon Stock Instead of Buying It Hand Over Fist?  The Motley Fool,"Tue, 28 Nov 2023 08:00:00 GMT",https://news.google.com/rss/articles/CBMiXWh0dHBzOi8vd3d3LmZvb2wuY29tL2ludmVzdGluZy8yMDIzLzExLzI4L3doeS1pcy13YXJyZW4tYnVmZmV0dC1zZWxsaW5nLWFtYXpvbi1zdG9jay1pbnN0ZWFkL9IBAA?oc=5&hl=en-MY&gl=MY&ceid=MY:en,"{'href': 'https://www.fool.com', 'title': 'The Motley Fool'}",AMZN
48,48,Amazon in talks to invest in Diamond Sports - WSJ - Reuters,Amazon in talks to invest in Diamond Sports - WSJ  Reuters,"Mon, 18 Dec 2023 08:00:00 GMT",https://news.google.com/rss/articles/CBMiWGh0dHBzOi8vd3d3LnJldXRlcnMuY29tL21hcmtldHMvZGVhbHMvYW1hem9uLXRhbGtzLWludmVzdC1kaWFtb25kLXNwb3J0cy13c2otMjAyMy0xMi0xOC_SAQA?oc=5&hl=en-MY&gl=MY&ceid=MY:en,"{'href': 'https://www.reuters.com', 'title': 'Reuters'}",AMZN
49,49,What to Expect Ahead of Amazon's (AMZN) Q3 Earnings Release? - Yahoo Finance,What to Expect Ahead of Amazon's (AMZN) Q3 Earnings Release?  Yahoo Finance,"Mon, 23 Oct 2023 07:00:00 GMT",https://news.google.com/rss/articles/CBMiSmh0dHBzOi8vZmluYW5jZS55YWhvby5jb20vbmV3cy9leHBlY3QtYWhlYWQtYW1hem9ucy1hbXpuLXEzLTExMjUwMDA2MC5odG1s0gEA?oc=5&hl=en-MY&gl=MY&ceid=MY:en,"{'href': 'https://finance.yahoo.com', 'title': 'Yahoo Finance'}",AMZN
50,50,"Amazon.com, Inc. (NASDAQ:AMZN) is largely controlled by institutional shareholders who own 60% of the company - Yahoo Finance","Amazon.com, Inc. (NASDAQ:AMZN) is largely controlled by institutional shareholders who own 60% of the company  Yahoo Finance","Sun, 08 Oct 2023 07:00:00 GMT",https://news.google.com/rss/articles/CBMiSGh0dHBzOi8vZmluYW5jZS55YWhvby5jb20vbmV3cy9hbWF6b24tY29tLWluYy1uYXNkYXEtYW16bi0xMjAwNDU2ODcuaHRtbNIBAA?oc=5&hl=en-MY&gl=MY&ceid=MY:en,"{'href': 'https://finance.yahoo.com', 'title': 'Yahoo Finance'}",AMZN
51,51,Amazon Stock: Bull vs. Bear - The Motley Fool,Amazon Stock: Bull vs. Bear  The Motley Fool,"Fri, 22 Dec 2023 08:00:00 GMT",https://news.google.com/rss/articles/CBMiRGh0dHBzOi8vd3d3LmZvb2wuY29tL2ludmVzdGluZy8yMDIzLzEyLzIyL2FtYXpvbi1zdG9jay1idWxsLXZzLWJlYXIv0gEA?oc=5&hl=en-MY&gl=MY&ceid=MY:en,"{'href': 'https://www.fool.com', 'title': 'The Motley Fool'}",AMZN
52,52,"Amazon Robotics unveils Titan, new fulfillment center robot - About Amazon","Amazon Robotics unveils Titan, new fulfillment center robot  About Amazon","Tue, 14 Nov 2023 08:00:00 GMT",https://news.google.com/rss/articles/CBMiWWh0dHBzOi8vd3d3LmFib3V0YW1hem9uLmNvbS9uZXdzL29wZXJhdGlvbnMvYW1hem9uLXVudmVpbHMtdGl0YW4tZnVsZmlsbG1lbnQtY2VudGVyLXJvYm900gEA?oc=5&hl=en-MY&gl=MY&ceid=MY:en,"{'href': 'https://www.aboutamazon.com', 'title': 'About Amazon'}",AMZN
53,53,Amazon and Hyundai launch strategic partnership—including vehicle sales in 2024 - About Amazon,Amazon and Hyundai launch strategic partnership—including vehicle sales in 2024  About Amazon,"Thu, 16 Nov 2023 08:00:00 GMT",https://news.google.com/rss/articles/CBMiSGh0dHBzOi8vd3d3LmFib3V0YW1hem9uLmNvbS9uZXdzL2NvbXBhbnktbmV3cy9hbWF6b24taHl1bmRhaS1wYXJ0bmVyc2hpcNIBAA?oc=5&hl=en-MY&gl=MY&ceid=MY:en,"{'href': 'https://www.aboutamazon.com', 'title': 'About Amazon'}",AMZN
54,54,Should You Buy Amazon Stock in 2024? - The Motley Fool,Should You Buy Amazon Stock in 2024?  The Motley Fool,"Fri, 29 Dec 2023 08:00:00 GMT",https://news.google.com/rss/articles/CBMiTmh0dHBzOi8vd3d3LmZvb2wuY29tL2ludmVzdGluZy8yMDIzLzEyLzI5L3Nob3VsZC15b3UtYnV5LWFtYXpvbi1zdG9jay1pbi0yMDI0L9IBAA?oc=5&hl=en-MY&gl=MY&ceid=MY:en,"{'href': 'https://www.fool.com', 'title': 'The Motley Fool'}",AMZN
