Unnamed: 0,Unnamed: 0.1,Unnamed: 0.1.1,title,description,published date,url,publisher,company
51,51,51,"Musk says Tesla would be shut down if its cars spied in China, elsewhere - Fox Business","Musk says Tesla would be shut down if its cars spied in China, elsewhere  Fox Business","Sat, 20 Mar 2021 07:00:00 GMT",https://news.google.com/rss/articles/CBMiUWh0dHBzOi8vd3d3LmZveGJ1c2luZXNzLmNvbS90ZWNobm9sb2d5L2Vsb24tbXVzay10ZXNsYS1zaHV0LWRvd24tY2Fycy1zcGllZC1jaGluYdIBAA?oc=5&hl=en-MY&gl=MY&ceid=MY:en,"{'href': 'https://www.foxbusiness.com', 'title': 'Fox Business'}",TSLA
52,52,52,"Tesla’s Bitcoin investment ‘a distraction’ from quality issues, Big Short investor says - TESLARATI","Tesla’s Bitcoin investment ‘a distraction’ from quality issues, Big Short investor says  TESLARATI","Tue, 09 Feb 2021 08:00:00 GMT",https://news.google.com/rss/articles/CBMiXGh0dHBzOi8vd3d3LnRlc2xhcmF0aS5jb20vdGVzbGEtdHNsYS1iaXRjb2luLWRpc3RyYWN0aW9uLWNoaW5hLXF1YWxpdHktaXNzdWVzLW1pY2hhZWwtYnVycnkv0gFgaHR0cHM6Ly93d3cudGVzbGFyYXRpLmNvbS90ZXNsYS10c2xhLWJpdGNvaW4tZGlzdHJhY3Rpb24tY2hpbmEtcXVhbGl0eS1pc3N1ZXMtbWljaGFlbC1idXJyeS9hbXAv?oc=5&hl=en-MY&gl=MY&ceid=MY:en,"{'href': 'https://www.teslarati.com', 'title': 'TESLARATI'}",TSLA
53,53,53,Tesla's (TSLA) Elon Musk Has a Serious Rival: Volkswagen's TechnoKaiser - Bloomberg - Bloomberg,Tesla's (TSLA) Elon Musk Has a Serious Rival: Volkswagen's TechnoKaiser - Bloomberg  Bloomberg,"Tue, 16 Mar 2021 07:00:00 GMT",https://news.google.com/rss/articles/CBMiemh0dHBzOi8vd3d3LmJsb29tYmVyZy5jb20vb3Bpbmlvbi9hcnRpY2xlcy8yMDIxLTAzLTE3L3Rlc2xhLXMtdHNsYS1lbG9uLW11c2staGFzLWEtc2VyaW91cy1yaXZhbC12b2xrc3dhZ2VuLXMtdGVjaG5va2Fpc2Vy0gEA?oc=5&hl=en-MY&gl=MY&ceid=MY:en,"{'href': 'https://www.bloomberg.com', 'title': 'Bloomberg'}",TSLA
54,54,54,Tesla’s Q4 FY 2020 earnings may herald $7B options payout to Elon Musk - TESLARATI,Tesla’s Q4 FY 2020 earnings may herald $7B options payout to Elon Musk  TESLARATI,"Wed, 27 Jan 2021 08:00:00 GMT",https://news.google.com/rss/articles/CBMiSGh0dHBzOi8vd3d3LnRlc2xhcmF0aS5jb20vdGVzbGEtdHNsYS1lbG9uLW11c2stNXRoLXN0b2NrLW9wdGlvbnMtcGF5b3V0L9IBTGh0dHBzOi8vd3d3LnRlc2xhcmF0aS5jb20vdGVzbGEtdHNsYS1lbG9uLW11c2stNXRoLXN0b2NrLW9wdGlvbnMtcGF5b3V0L2FtcC8?oc=5&hl=en-MY&gl=MY&ceid=MY:en,"{'href': 'https://www.teslarati.com', 'title': 'TESLARATI'}",TSLA
55,55,55,Tesla investor Vanguard becomes third-largest TSLA shareholder after 57.8M share purchase - TESLARATI,Tesla investor Vanguard becomes third-largest TSLA shareholder after 57.8M share purchase  TESLARATI,"Wed, 10 Feb 2021 08:00:00 GMT",https://news.google.com/rss/articles/CBMiSmh0dHBzOi8vd3d3LnRlc2xhcmF0aS5jb20vdGVzbGEtdmFuZ3VhcmQtZ3JvdXAtc3RvY2stcHVyY2hhc2UtNi0xLXBlcmNlbnQv0gFOaHR0cHM6Ly93d3cudGVzbGFyYXRpLmNvbS90ZXNsYS12YW5ndWFyZC1ncm91cC1zdG9jay1wdXJjaGFzZS02LTEtcGVyY2VudC9hbXAv?oc=5&hl=en-MY&gl=MY&ceid=MY:en,"{'href': 'https://www.teslarati.com', 'title': 'TESLARATI'}",TSLA
56,56,56,"Roblox, AMC, General Electric, Tesla Hack - 5 Things You Must Know Wednesday - TheStreet","Roblox, AMC, General Electric, Tesla Hack - 5 Things You Must Know Wednesday  TheStreet","Wed, 10 Mar 2021 08:00:00 GMT",https://news.google.com/rss/articles/CBMiYWh0dHBzOi8vd3d3LnRoZXN0cmVldC5jb20vbWFya2V0cy81LXRoaW5ncy15b3UtbXVzdC1rbm93LWJlZm9yZS10aGUtbWFya2V0LW9wZW5zLXdlZG5lc2RheS0wMzEwMjHSAQA?oc=5&hl=en-MY&gl=MY&ceid=MY:en,"{'href': 'https://www.thestreet.com', 'title': 'TheStreet'}",TSLA
57,57,57,TSLA Stock Looks a Lot More Like BlackBerry Than It Does Apple - InvestorPlace,TSLA Stock Looks a Lot More Like BlackBerry Than It Does Apple  InvestorPlace,"Fri, 05 Mar 2021 08:00:00 GMT",https://news.google.com/rss/articles/CBMiSWh0dHBzOi8vaW52ZXN0b3JwbGFjZS5jb20vMjAyMS8wMy90c2xhLXN0b2NrLWJsYWNrYmVycnktYXBwbGUtY29tcGFyaXNvbi_SAQA?oc=5&hl=en-MY&gl=MY&ceid=MY:en,"{'href': 'https://investorplace.com', 'title': 'InvestorPlace'}",TSLA
58,58,58,Tesla Is Plugging a Secret Mega-Battery Into the Texas Grid - Bloomberg,Tesla Is Plugging a Secret Mega-Battery Into the Texas Grid  Bloomberg,"Mon, 08 Mar 2021 08:00:00 GMT",https://news.google.com/rss/articles/CBMibmh0dHBzOi8vd3d3LmJsb29tYmVyZy5jb20vbmV3cy9mZWF0dXJlcy8yMDIxLTAzLTA4L3Rlc2xhLWlzLXBsdWdnaW5nLWEtc2VjcmV0LW1lZ2EtYmF0dGVyeS1pbnRvLXRoZS10ZXhhcy1ncmlk0gEA?oc=5&hl=en-MY&gl=MY&ceid=MY:en,"{'href': 'https://www.bloomberg.com', 'title': 'Bloomberg'}",TSLA
59,59,59,Surprise! These 2 Auto Stocks Are Beating Tesla This Year - The Motley Fool,Surprise! These 2 Auto Stocks Are Beating Tesla This Year  The Motley Fool,"Tue, 26 Jan 2021 08:00:00 GMT",https://news.google.com/rss/articles/CBMiXWh0dHBzOi8vd3d3LmZvb2wuY29tL2ludmVzdGluZy8yMDIxLzAxLzI2L3N1cnByaXNlLXRoZXNlLTItYXV0by1zdG9ja3MtYXJlLWJlYXRpbmctdGVzbGEtdGhpL9IBAA?oc=5&hl=en-MY&gl=MY&ceid=MY:en,"{'href': 'https://www.fool.com', 'title': 'The Motley Fool'}",TSLA
60,60,60,"Tesla (TSLA) buys $1.5B in bitcoin, pushing the crypto to all-time high; plans to accept as payment - Electrek","Tesla (TSLA) buys $1.5B in bitcoin, pushing the crypto to all-time high; plans to accept as payment  Electrek","Mon, 08 Feb 2021 08:00:00 GMT",https://news.google.com/rss/articles/CBMifmh0dHBzOi8vZWxlY3RyZWsuY28vMjAyMS8wMi8wOC90ZXNsYS10c2xhLWJ1eXMtMS01Yi1pbi1iaXRjb2luLXB1c2hpbmctdGhlLWNyeXB0by10by1hbGwtdGltZS1oaWdoLXBsYW5zLXRvLWFjY2VwdC1hcy1wYXltZW50L9IBAA?oc=5&hl=en-MY&gl=MY&ceid=MY:en,"{'href': 'https://electrek.co', 'title': 'Electrek'}",TSLA
61,61,61,GameStop Has Overtaken Tesla on Google Finance | Market Insights - TradeStation Market Insights,GameStop Has Overtaken Tesla on Google Finance | Market Insights  TradeStation Market Insights,"Wed, 27 Jan 2021 08:00:00 GMT",https://news.google.com/rss/articles/CBMiUmh0dHBzOi8vd3d3LnRyYWRlc3RhdGlvbi5jb20vaW5zaWdodHMvMjAyMS8wMS8yNy9nYW1lc3RvcC12cy10ZXNsYS1nb29nbGUtZmluYW5jZS_SAQA?oc=5&hl=en-MY&gl=MY&ceid=MY:en,"{'href': 'https://www.tradestation.com', 'title': 'TradeStation Market Insights'}",TSLA
62,62,62,Tesla (TSLA) incorporates Indian company amid rumors of a local factory - Electrek,Tesla (TSLA) incorporates Indian company amid rumors of a local factory  Electrek,"Tue, 12 Jan 2021 08:00:00 GMT",https://news.google.com/rss/articles/CBMiUWh0dHBzOi8vZWxlY3RyZWsuY28vMjAyMS8wMS8xMi90ZXNsYS10c2xhLWluY29ycG9yYXRlcy1pbmRpYS1ydW1vci1sb2NhbC1mYWN0b3J5L9IBAA?oc=5&hl=en-MY&gl=MY&ceid=MY:en,"{'href': 'https://electrek.co', 'title': 'Electrek'}",TSLA
63,63,63,Tesla Cybertruck Loses Out To Ford F-150 In Cox Survey Of US Pickup Buyers - Yahoo Finance,Tesla Cybertruck Loses Out To Ford F-150 In Cox Survey Of US Pickup Buyers  Yahoo Finance,"Sun, 24 Jan 2021 08:00:00 GMT",https://news.google.com/rss/articles/CBMiS2h0dHBzOi8vZmluYW5jZS55YWhvby5jb20vbmV3cy90ZXNsYS1jeWJlcnRydWNrLWxvc2VzLWZvcmQtZi0wNjMxMDA3NjAuaHRtbNIBAA?oc=5&hl=en-MY&gl=MY&ceid=MY:en,"{'href': 'https://finance.yahoo.com', 'title': 'Yahoo Finance'}",TSLA
64,64,64,Tesla (TSLA) CEO Musk Says FSD Could Make Company Most Valuable 'Within a Few Months' as Scathing Video ... - StreetInsider.com,Tesla (TSLA) CEO Musk Says FSD Could Make Company Most Valuable 'Within a Few Months' as Scathing Video ...  StreetInsider.com,"Fri, 26 Mar 2021 07:00:00 GMT",https://news.google.com/rss/articles/CBMisgFodHRwczovL3d3dy5zdHJlZXRpbnNpZGVyLmNvbS9NYW5hZ2VtZW50K0NvbW1lbnRzL1Rlc2xhKyUyOFRTTEElMjkrQ0VPK011c2srU2F5cytGU0QrQ291bGQrTWFrZStDb21wYW55K01vc3QrVmFsdWFibGUrV2l0aGluK2ErRmV3K01vbnRocythcytTY2F0aGluZytWaWRlbytTdXJmYWNlcy8xODE4Mjk0OS5odG1s0gEA?oc=5&hl=en-MY&gl=MY&ceid=MY:en,"{'href': 'https://www.streetinsider.com', 'title': 'StreetInsider.com'}",TSLA
65,65,65,Tesla soars past $800 as Elon Musk says it’s business as usual - TESLARATI,Tesla soars past $800 as Elon Musk says it’s business as usual  TESLARATI,"Thu, 07 Jan 2021 08:00:00 GMT",https://news.google.com/rss/articles/CBMiPWh0dHBzOi8vd3d3LnRlc2xhcmF0aS5jb20vdGVzbGEtdHNsYS04MDAtcGVyLXNoYXJlLWVsb24tbXVzay_SAUFodHRwczovL3d3dy50ZXNsYXJhdGkuY29tL3Rlc2xhLXRzbGEtODAwLXBlci1zaGFyZS1lbG9uLW11c2svYW1wLw?oc=5&hl=en-MY&gl=MY&ceid=MY:en,"{'href': 'https://www.teslarati.com', 'title': 'TESLARATI'}",TSLA
66,66,66,Tesla investor who predicted 2020 stock surge unloads shares - TESLARATI,Tesla investor who predicted 2020 stock surge unloads shares  TESLARATI,"Mon, 08 Feb 2021 08:00:00 GMT",https://news.google.com/rss/articles/CBMiTGh0dHBzOi8vd3d3LnRlc2xhcmF0aS5jb20vdGVzbGEtdHNsYS1pbnZlc3Rvci0yMDIwLXN0b2NrLXN1cmdlLXNlbGxzLXNoYXJlcy_SAVBodHRwczovL3d3dy50ZXNsYXJhdGkuY29tL3Rlc2xhLXRzbGEtaW52ZXN0b3ItMjAyMC1zdG9jay1zdXJnZS1zZWxscy1zaGFyZXMvYW1wLw?oc=5&hl=en-MY&gl=MY&ceid=MY:en,"{'href': 'https://www.teslarati.com', 'title': 'TESLARATI'}",TSLA
67,67,67,"Tesla, EV stocks have potential for ’40-50%’ gains in 2021: Wedbush - TESLARATI","Tesla, EV stocks have potential for ’40-50%’ gains in 2021: Wedbush  TESLARATI","Mon, 01 Mar 2021 08:00:00 GMT",https://news.google.com/rss/articles/CBMiW2h0dHBzOi8vd3d3LnRlc2xhcmF0aS5jb20vdGVzbGEtZXYtc3RvY2tzLTIwMjEtZ3Jvd3RoLTQwLTUwLXBlcmNlbnQtdmlkZW8tZGFuLWl2ZXMtd2VkYnVzaC_SAV9odHRwczovL3d3dy50ZXNsYXJhdGkuY29tL3Rlc2xhLWV2LXN0b2Nrcy0yMDIxLWdyb3d0aC00MC01MC1wZXJjZW50LXZpZGVvLWRhbi1pdmVzLXdlZGJ1c2gvYW1wLw?oc=5&hl=en-MY&gl=MY&ceid=MY:en,"{'href': 'https://www.teslarati.com', 'title': 'TESLARATI'}",TSLA
68,68,68,Here’s what Elon Musk has to say about becoming the richest person in the world - MarketWatch,Here’s what Elon Musk has to say about becoming the richest person in the world  MarketWatch,"Sat, 09 Jan 2021 08:00:00 GMT",https://news.google.com/rss/articles/CBMie2h0dHBzOi8vd3d3Lm1hcmtldHdhdGNoLmNvbS9zdG9yeS9oZXJlcy13aGF0LWVsb24tbXVzay1oYXMtdG8tc2F5LWFib3V0LWJlY29taW5nLXRoZS1yaWNoZXN0LXBlcnNvbi1pbi10aGUtd29ybGQtMjAyMS0wMS0wN9IBf2h0dHBzOi8vd3d3Lm1hcmtldHdhdGNoLmNvbS9hbXAvc3RvcnkvaGVyZXMtd2hhdC1lbG9uLW11c2staGFzLXRvLXNheS1hYm91dC1iZWNvbWluZy10aGUtcmljaGVzdC1wZXJzb24taW4tdGhlLXdvcmxkLTIwMjEtMDEtMDc?oc=5&hl=en-MY&gl=MY&ceid=MY:en,"{'href': 'https://www.marketwatch.com', 'title': 'MarketWatch'}",TSLA
69,69,69,Is Tesla (TSLA) Stock A Buy Right Now At Its New All-Time High? - Stock Market,Is Tesla (TSLA) Stock A Buy Right Now At Its New All-Time High?  Stock Market,"Fri, 08 Jan 2021 08:00:00 GMT",https://news.google.com/rss/articles/CBMiaGh0dHBzOi8vc3RvY2ttYXJrZXQuY29tL2ZlYXR1cmVkL2lzLXRlc2xhLXRzbGEtc3RvY2stYS1idXktcmlnaHQtbm93LWF0LWl0cy1uZXctYWxsLXRpbWUtaGlnaC0yMDIxLTAxLTA40gFoaHR0cHM6Ly9zdG9ja21hcmtldC5jb20vZmVhdHVyZWQvaXMtdGVzbGEtdHNsYS1zdG9jay1hLWJ1eS1yaWdodC1ub3ctYXQtaXRzLW5ldy1hbGwtdGltZS1oaWdoLTIwMjEtMDEtMDg?oc=5&hl=en-MY&gl=MY&ceid=MY:en,"{'href': 'https://stockmarket.com', 'title': 'Stock Market'}",TSLA
70,70,70,Tesla and other EV stocks boost with Biden’s $174B aid plan - TESLARATI,Tesla and other EV stocks boost with Biden’s $174B aid plan  TESLARATI,"Wed, 31 Mar 2021 07:00:00 GMT",https://news.google.com/rss/articles/CBMiVGh0dHBzOi8vd3d3LnRlc2xhcmF0aS5jb20vdGVzbGEtYW5kLW90aGVyLWV2LXN0b2Nrcy1ib29zdC13aXRoLWJpZGVucy0xNzRiLWFpZC1wbGFuL9IBWGh0dHBzOi8vd3d3LnRlc2xhcmF0aS5jb20vdGVzbGEtYW5kLW90aGVyLWV2LXN0b2Nrcy1ib29zdC13aXRoLWJpZGVucy0xNzRiLWFpZC1wbGFuL2FtcC8?oc=5&hl=en-MY&gl=MY&ceid=MY:en,"{'href': 'https://www.teslarati.com', 'title': 'TESLARATI'}",TSLA
71,71,71,"Tesla (TSLA) leads battery cell cost by wide margin, according to new report - Electrek","Tesla (TSLA) leads battery cell cost by wide margin, according to new report  Electrek","Wed, 10 Mar 2021 08:00:00 GMT",https://news.google.com/rss/articles/CBMiTWh0dHBzOi8vZWxlY3RyZWsuY28vMjAyMS8wMy8xMC90ZXNsYS10c2xhLWxlYWRzLWJhdHRlcnktY2VsbC1jb3N0LW5ldy1yZXBvcnQv0gEA?oc=5&hl=en-MY&gl=MY&ceid=MY:en,"{'href': 'https://electrek.co', 'title': 'Electrek'}",TSLA
72,72,72,How Does SpaceX Affect TSLA Stock? Elon Musk's Successes Trickle Down - Market Realist,How Does SpaceX Affect TSLA Stock? Elon Musk's Successes Trickle Down  Market Realist,"Wed, 20 Jan 2021 08:00:00 GMT",https://news.google.com/rss/articles/CBMiLmh0dHBzOi8vbWFya2V0cmVhbGlzdC5jb20vcC9zcGFjZXgtdHNsYS1zdG9jay_SAQA?oc=5&hl=en-MY&gl=MY&ceid=MY:en,"{'href': 'https://marketrealist.com', 'title': 'Market Realist'}",TSLA
73,73,73,Elon Musk puts Tesla Van on the EV automaker’s to-do list - TESLARATI,Elon Musk puts Tesla Van on the EV automaker’s to-do list  TESLARATI,"Thu, 28 Jan 2021 08:00:00 GMT",https://news.google.com/rss/articles/CBMiLmh0dHBzOi8vd3d3LnRlc2xhcmF0aS5jb20vZWxvbi1tdXNrLXRlc2xhLXZhbi_SATJodHRwczovL3d3dy50ZXNsYXJhdGkuY29tL2Vsb24tbXVzay10ZXNsYS12YW4vYW1wLw?oc=5&hl=en-MY&gl=MY&ceid=MY:en,"{'href': 'https://www.teslarati.com', 'title': 'TESLARATI'}",TSLA
74,74,74,"Carmaker Nio is 'well positioned' to capture a lot of China's electric vehicle market, analyst says - CNBC","Carmaker Nio is 'well positioned' to capture a lot of China's electric vehicle market, analyst says  CNBC","Mon, 11 Jan 2021 08:00:00 GMT",https://news.google.com/rss/articles/CBMiUmh0dHBzOi8vd3d3LmNuYmMuY29tLzIwMjEvMDEvMTIvY2hpbmEtZWxlY3RyaWMtdmVoaWNsZXMtbWFya2V0LW5pby10ZXNsYS10c2xhLmh0bWzSAVZodHRwczovL3d3dy5jbmJjLmNvbS9hbXAvMjAyMS8wMS8xMi9jaGluYS1lbGVjdHJpYy12ZWhpY2xlcy1tYXJrZXQtbmlvLXRlc2xhLXRzbGEuaHRtbA?oc=5&hl=en-MY&gl=MY&ceid=MY:en,"{'href': 'https://www.cnbc.com', 'title': 'CNBC'}",TSLA
75,75,75,How Is SpaceX's Starlink Service Shaping Up? - Trefis,How Is SpaceX's Starlink Service Shaping Up?  Trefis,"Tue, 09 Feb 2021 08:00:00 GMT",https://news.google.com/rss/articles/CBMiZ2h0dHBzOi8vd3d3LnRyZWZpcy5jb20vc3RvY2svdHNsYS9hcnRpY2xlcy81MDgyMzkvaG93LWlzLXNwYWNleHMtc3Rhcmxpbmstc2VydmljZS1zaGFwaW5nLXVwLzIwMjEtMDItMDnSAQA?oc=5&hl=en-MY&gl=MY&ceid=MY:en,"{'href': 'https://www.trefis.com', 'title': 'Trefis'}",TSLA
76,76,76,Tesla Total Debt is at $28 Billion: Will This Affect TSLA Stock Price? - Tech Times,Tesla Total Debt is at $28 Billion: Will This Affect TSLA Stock Price?  Tech Times,"Sun, 14 Feb 2021 08:00:00 GMT",https://news.google.com/rss/articles/CBMib2h0dHBzOi8vd3d3LnRlY2h0aW1lcy5jb20vYXJ0aWNsZXMvMjU3MDQ1LzIwMjEwMjE0L3Rlc2xhLXRvdGFsLWRlYnQtMjgtYmlsbGlvbi13aWxsLWFmZmVjdC10c2xhLXN0b2NrLXByaWNlLmh0bdIBc2h0dHBzOi8vd3d3LnRlY2h0aW1lcy5jb20vYW1wL2FydGljbGVzLzI1NzA0NS8yMDIxMDIxNC90ZXNsYS10b3RhbC1kZWJ0LTI4LWJpbGxpb24td2lsbC1hZmZlY3QtdHNsYS1zdG9jay1wcmljZS5odG0?oc=5&hl=en-MY&gl=MY&ceid=MY:en,"{'href': 'https://www.techtimes.com', 'title': 'Tech Times'}",TSLA
77,77,77,Tesla Is Getting Closer To India - Tesla (NASDAQ:TSLA) - Benzinga,Tesla Is Getting Closer To India - Tesla (NASDAQ:TSLA)  Benzinga,"Tue, 12 Jan 2021 08:00:00 GMT",https://news.google.com/rss/articles/CBMiTWh0dHBzOi8vd3d3LmJlbnppbmdhLmNvbS9uZXdzLzIxLzAxLzE5MTI3MDg5L3Rlc2xhLWlzLWdldHRpbmctY2xvc2VyLXRvLWluZGlh0gEtaHR0cHM6Ly93d3cuYmVuemluZ2EuY29tL2FtcC9jb250ZW50LzE5MTI3MDg5?oc=5&hl=en-MY&gl=MY&ceid=MY:en,"{'href': 'https://www.benzinga.com', 'title': 'Benzinga'}",TSLA
78,78,78,Tesla’s gains new Street-high price target from Bank of America - TESLARATI,Tesla’s gains new Street-high price target from Bank of America  TESLARATI,"Mon, 11 Jan 2021 08:00:00 GMT",https://news.google.com/rss/articles/CBMiamh0dHBzOi8vd3d3LnRlc2xhcmF0aS5jb20vdGVzbGEtdHNsYS1ib2EtYWdncmVzc2l2ZS1nbG9iYWwtYnVpbGRvdXQtc3RyZWV0LWhpZ2gtcHJpY2UtdGFyZ2V0LWphbnVhcnktMjAyMS_SAW5odHRwczovL3d3dy50ZXNsYXJhdGkuY29tL3Rlc2xhLXRzbGEtYm9hLWFnZ3Jlc3NpdmUtZ2xvYmFsLWJ1aWxkb3V0LXN0cmVldC1oaWdoLXByaWNlLXRhcmdldC1qYW51YXJ5LTIwMjEvYW1wLw?oc=5&hl=en-MY&gl=MY&ceid=MY:en,"{'href': 'https://www.teslarati.com', 'title': 'TESLARATI'}",TSLA
79,79,79,Tesla’s Bitcoin buy filled with advantages: ARK Invest’s Keeney - TESLARATI,Tesla’s Bitcoin buy filled with advantages: ARK Invest’s Keeney  TESLARATI,"Tue, 09 Feb 2021 08:00:00 GMT",https://news.google.com/rss/articles/CBMiT2h0dHBzOi8vd3d3LnRlc2xhcmF0aS5jb20vdGVzbGEtdHNsYS1iaXRjb2luLWFkdmFudGFnZXMtYXJrLXRhc2hhLWtlZW5leS12aWRlby_SAVNodHRwczovL3d3dy50ZXNsYXJhdGkuY29tL3Rlc2xhLXRzbGEtYml0Y29pbi1hZHZhbnRhZ2VzLWFyay10YXNoYS1rZWVuZXktdmlkZW8vYW1wLw?oc=5&hl=en-MY&gl=MY&ceid=MY:en,"{'href': 'https://www.teslarati.com', 'title': 'TESLARATI'}",TSLA
80,80,80,Tesla investor Ron Baron on BTC purchase: ‘I look forward to learning the rationale’ - TESLARATI,Tesla investor Ron Baron on BTC purchase: ‘I look forward to learning the rationale’  TESLARATI,"Mon, 08 Feb 2021 08:00:00 GMT",https://news.google.com/rss/articles/CBMiN2h0dHBzOi8vd3d3LnRlc2xhcmF0aS5jb20vdGVzbGEtdHNsYS1yb24tYmFyb24tYml0Y29pbi_SATtodHRwczovL3d3dy50ZXNsYXJhdGkuY29tL3Rlc2xhLXRzbGEtcm9uLWJhcm9uLWJpdGNvaW4vYW1wLw?oc=5&hl=en-MY&gl=MY&ceid=MY:en,"{'href': 'https://www.teslarati.com', 'title': 'TESLARATI'}",TSLA
81,81,81,"ARK Invest releases new Tesla research report, raises TSLA price target to $3000 by 2025 - Drive Tesla Canada","ARK Invest releases new Tesla research report, raises TSLA price target to $3000 by 2025  Drive Tesla Canada","Sat, 20 Mar 2021 07:00:00 GMT",https://news.google.com/rss/articles/CBMieGh0dHBzOi8vZHJpdmV0ZXNsYWNhbmFkYS5jYS9uZXdzL2Fyay1pbnZlc3QtcmVsZWFzZXMtbmV3LXRlc2xhLXJlc2VhcmNoLXJlcG9ydC1yYWlzZXMtdHNsYS1wcmljZS10YXJnZXQtdG8tMzAwMC1ieS0yMDI1L9IBAA?oc=5&hl=en-MY&gl=MY&ceid=MY:en,"{'href': 'https://driveteslacanada.ca', 'title': 'Drive Tesla Canada'}",TSLA
82,82,82,Tesla Semi critic Bill Gates almost admits that he shorted TSLA in the past - TESLARATI,Tesla Semi critic Bill Gates almost admits that he shorted TSLA in the past  TESLARATI,"Wed, 24 Feb 2021 08:00:00 GMT",https://news.google.com/rss/articles/CBMiRmh0dHBzOi8vd3d3LnRlc2xhcmF0aS5jb20vdGVzbGEtYmlsbC1nYXRlcy10c2xhLXNob3J0LWNvbmZpcm1lZC12aWRlby_SAUpodHRwczovL3d3dy50ZXNsYXJhdGkuY29tL3Rlc2xhLWJpbGwtZ2F0ZXMtdHNsYS1zaG9ydC1jb25maXJtZWQtdmlkZW8vYW1wLw?oc=5&hl=en-MY&gl=MY&ceid=MY:en,"{'href': 'https://www.teslarati.com', 'title': 'TESLARATI'}",TSLA
83,83,83,"Tesla's Share Of European EV Market Reduced To 3.5% - Tesla (NASDAQ:TSLA), Volkswagen (OTC:VLKAF) - Benzinga","Tesla's Share Of European EV Market Reduced To 3.5% - Tesla (NASDAQ:TSLA), Volkswagen (OTC:VLKAF)  Benzinga","Tue, 02 Mar 2021 08:00:00 GMT",https://news.google.com/rss/articles/CBMiXmh0dHBzOi8vd3d3LmJlbnppbmdhLmNvbS9uZXdzLzIxLzAzLzE5OTMxMDc4L3Rlc2xhcy1zaGFyZS1vZi1ldXJvcGVhbi1ldi1tYXJrZXQtcmVkdWNlZC10by0zLTXSAS1odHRwczovL3d3dy5iZW56aW5nYS5jb20vYW1wL2NvbnRlbnQvMTk5MzEwNzg?oc=5&hl=en-MY&gl=MY&ceid=MY:en,"{'href': 'https://www.benzinga.com', 'title': 'Benzinga'}",TSLA
84,84,84,Tesla Secures Top Spot In JD Power's Survey Of Premium EV Owners - Tesla (NASDAQ:TSLA) - Benzinga,Tesla Secures Top Spot In JD Power's Survey Of Premium EV Owners - Tesla (NASDAQ:TSLA)  Benzinga,"Fri, 22 Jan 2021 08:00:00 GMT",https://news.google.com/rss/articles/CBMibGh0dHBzOi8vd3d3LmJlbnppbmdhLmNvbS9uZXdzLzIxLzAxLzE5MjY5MDgzL3Rlc2xhLXNlY3VyZXMtdG9wLXNwb3QtaW4tamQtcG93ZXJzLXN1cnZleS1vZi1wcmVtaXVtLWV2LW93bmVyc9IBLWh0dHBzOi8vd3d3LmJlbnppbmdhLmNvbS9hbXAvY29udGVudC8xOTI2OTA4Mw?oc=5&hl=en-MY&gl=MY&ceid=MY:en,"{'href': 'https://www.benzinga.com', 'title': 'Benzinga'}",TSLA
85,85,85,NIO (NYSE: NIO) Can’t Become a Tesla Killer and Tesla (NASDAQ: TSLA) Can’t Vanquish NIO – Any Prediction of an Impending Deathmatch Is a Fallacy - Wccftech,NIO (NYSE: NIO) Can’t Become a Tesla Killer and Tesla (NASDAQ: TSLA) Can’t Vanquish NIO – Any Prediction of an Impending Deathmatch Is a Fallacy  Wccftech,"Tue, 02 Feb 2021 08:00:00 GMT",https://news.google.com/rss/articles/CBMihwFodHRwczovL3djY2Z0ZWNoLmNvbS9uaW8tY2FudC1iZWNvbWUtYS10ZXNsYS1raWxsZXItYW5kLXRlc2xhLWNhbnQtdmFucXVpc2gtbmlvLWFueS1wcmVkaWN0aW9uLW9mLWFuLWltcGVuZGluZy1kZWF0aG1hdGNoLWlzLWEtZmFsbGFjeS_SAYsBaHR0cHM6Ly93Y2NmdGVjaC5jb20vbmlvLWNhbnQtYmVjb21lLWEtdGVzbGEta2lsbGVyLWFuZC10ZXNsYS1jYW50LXZhbnF1aXNoLW5pby1hbnktcHJlZGljdGlvbi1vZi1hbi1pbXBlbmRpbmctZGVhdGhtYXRjaC1pcy1hLWZhbGxhY3kvYW1wLw?oc=5&hl=en-MY&gl=MY&ceid=MY:en,"{'href': 'https://wccftech.com', 'title': 'Wccftech'}",TSLA
86,86,86,Elon Musk Tesla Cybertruck Update Q2 2021 - HYPEBEAST,Elon Musk Tesla Cybertruck Update Q2 2021  HYPEBEAST,"Tue, 09 Mar 2021 08:00:00 GMT",https://news.google.com/rss/articles/CBMiUmh0dHBzOi8vaHlwZWJlYXN0LmNvbS8yMDIxLzMvZWxvbi1tdXNrLXRlc2xhLWN5YmVydHJ1Y2stdXBkYXRlLXRlYXNlci1xMi0yMDIxLW5ld3PSAQA?oc=5&hl=en-MY&gl=MY&ceid=MY:en,"{'href': 'https://hypebeast.com', 'title': 'HYPEBEAST'}",TSLA
