Unnamed: 0,Unnamed: 0.1,Unnamed: 0.1.1,title,description,published date,url,publisher,company
0,0,0,Tesla stock falls after company reports first profit miss in more than a year - MarketWatch,Tesla stock falls after company reports first profit miss in more than a year  MarketWatch,"Wed, 27 Jan 2021 08:00:00 GMT",https://news.google.com/rss/articles/CBMiYmh0dHBzOi8vd3d3Lm1hcmtldHdhdGNoLmNvbS9zdG9yeS90ZXNsYS1zdG9jay1zaW5rcy03LWFmdGVyLXF1YXJ0ZXJseS1wcm9maXQtaXMtYS1taXNzLTExNjExNzgyNzAw0gFmaHR0cHM6Ly93d3cubWFya2V0d2F0Y2guY29tL2FtcC9zdG9yeS90ZXNsYS1zdG9jay1zaW5rcy03LWFmdGVyLXF1YXJ0ZXJseS1wcm9maXQtaXMtYS1taXNzLTExNjExNzgyNzAw?oc=5&hl=en-MY&gl=MY&ceid=MY:en,"{'href': 'https://www.marketwatch.com', 'title': 'MarketWatch'}",TSLA
1,1,1,Tesla (TSLA) Extends Breakdown Amid Valuation Concerns - Investopedia,Tesla (TSLA) Extends Breakdown Amid Valuation Concerns  Investopedia,"Tue, 23 Feb 2021 08:00:00 GMT",https://news.google.com/rss/articles/CBMiWWh0dHBzOi8vd3d3LmludmVzdG9wZWRpYS5jb20vdGVzbGEtdHNsYS1leHRlbmRzLWJyZWFrZG93bi1hbWlkLXZhbHVhdGlvbi1jb25jZXJucy01MTEzNzgy0gEA?oc=5&hl=en-MY&gl=MY&ceid=MY:en,"{'href': 'https://www.investopedia.com', 'title': 'Investopedia'}",TSLA
2,2,2,Tesla Mutual Funds: Understanding TSLA's Addition to the S&P 500 - U.S News & World Report Money,Tesla Mutual Funds: Understanding TSLA's Addition to the S&P 500  U.S News & World Report Money,"Fri, 29 Jan 2021 08:00:00 GMT",https://news.google.com/rss/articles/CBMicGh0dHBzOi8vbW9uZXkudXNuZXdzLmNvbS9pbnZlc3RpbmcvZnVuZHMvYXJ0aWNsZXMvdGVzbGEtbXV0dWFsLWZ1bmRzLXVuZGVyc3RhbmRpbmctdHNsYXMtYWRkaXRpb24tdG8tdGhlLXMtcC01MDDSAQA?oc=5&hl=en-MY&gl=MY&ceid=MY:en,"{'href': 'https://money.usnews.com', 'title': 'U.S News & World Report Money'}",TSLA
3,3,3,"Tesla Call Was Completely Wrong, RBC Says After 1200% Rally - Bloomberg","Tesla Call Was Completely Wrong, RBC Says After 1200% Rally  Bloomberg","Thu, 07 Jan 2021 08:00:00 GMT",https://news.google.com/rss/articles/CBMibWh0dHBzOi8vd3d3LmJsb29tYmVyZy5jb20vbmV3cy9hcnRpY2xlcy8yMDIxLTAxLTA3L3Rlc2xhLWNhbGwtd2FzLWNvbXBsZXRlbHktd3JvbmctcmJjLXNheXMtYWZ0ZXItMS0yMDAtcmFsbHnSAQA?oc=5&hl=en-MY&gl=MY&ceid=MY:en,"{'href': 'https://www.bloomberg.com', 'title': 'Bloomberg'}",TSLA
4,4,4,Tesla Model 3 in China the ‘heart and lungs’ of owning TSLA stock: Wedbush - TESLARATI,Tesla Model 3 in China the ‘heart and lungs’ of owning TSLA stock: Wedbush  TESLARATI,"Fri, 15 Jan 2021 08:00:00 GMT",https://news.google.com/rss/articles/CBMiPWh0dHBzOi8vd3d3LnRlc2xhcmF0aS5jb20vdGVzbGEtbW9kZWwtMy1oZWFydC1hbmQtbHVuZ3MtdHNsYS_SAUFodHRwczovL3d3dy50ZXNsYXJhdGkuY29tL3Rlc2xhLW1vZGVsLTMtaGVhcnQtYW5kLWx1bmdzLXRzbGEvYW1wLw?oc=5&hl=en-MY&gl=MY&ceid=MY:en,"{'href': 'https://www.teslarati.com', 'title': 'TESLARATI'}",TSLA
5,5,5,Can Tesla (TSLA) Stock Drive To $3000? - Nasdaq,Can Tesla (TSLA) Stock Drive To $3000?  Nasdaq,"Wed, 24 Mar 2021 07:00:00 GMT",https://news.google.com/rss/articles/CBMiUGh0dHBzOi8vd3d3Lm5hc2RhcS5jb20vYXJ0aWNsZXMvY2FuLXRlc2xhLXRzbGEtc3RvY2stZHJpdmUtdG8tJTI0MzAwMC0yMDIxLTAzLTI00gEA?oc=5&hl=en-MY&gl=MY&ceid=MY:en,"{'href': 'https://www.nasdaq.com', 'title': 'Nasdaq'}",TSLA
6,6,6,"Tesla stock is off its high, but it's not 'on sale': trader - Yahoo Finance","Tesla stock is off its high, but it's not 'on sale': trader  Yahoo Finance","Tue, 23 Mar 2021 07:00:00 GMT",https://news.google.com/rss/articles/CBMiZGh0dHBzOi8vZmluYW5jZS55YWhvby5jb20vbmV3cy90ZXNsYS1zdG9jay1pcy1vZmYtaXRzLWhpZ2gtYnV0LWl0cy1ub3Qtb24tc2FsZS10cmFkZXItMTA0OTQ1Nzg4Lmh0bWzSAQA?oc=5&hl=en-MY&gl=MY&ceid=MY:en,"{'href': 'https://finance.yahoo.com', 'title': 'Yahoo Finance'}",TSLA
7,7,7,Margin requirement for TSLA at your broker - Tesla Motors Club,Margin requirement for TSLA at your broker  Tesla Motors Club,"Fri, 19 Mar 2021 07:00:00 GMT",https://news.google.com/rss/articles/CBMiWmh0dHBzOi8vdGVzbGFtb3RvcnNjbHViLmNvbS90bWMvdGhyZWFkcy9tYXJnaW4tcmVxdWlyZW1lbnQtZm9yLXRzbGEtYXQteW91ci1icm9rZXIuMjIzMjM1L9IBAA?oc=5&hl=en-MY&gl=MY&ceid=MY:en,"{'href': 'https://teslamotorsclub.com', 'title': 'Tesla Motors Club'}",TSLA
8,8,8,Tesla (TSLA) Breaks Out After Beating Delivery Targets - Investopedia,Tesla (TSLA) Breaks Out After Beating Delivery Targets  Investopedia,"Mon, 04 Jan 2021 08:00:00 GMT",https://news.google.com/rss/articles/CBMiWWh0dHBzOi8vd3d3LmludmVzdG9wZWRpYS5jb20vdGVzbGEtdHNsYS1icmVha3Mtb3V0LWFmdGVyLWJlYXRpbmctZGVsaXZlcnktdGFyZ2V0cy01MDk0MjA40gEA?oc=5&hl=en-MY&gl=MY&ceid=MY:en,"{'href': 'https://www.investopedia.com', 'title': 'Investopedia'}",TSLA
9,9,9,Should You Buy Tesla (TSLA) Stock? - U.S News & World Report Money,Should You Buy Tesla (TSLA) Stock?  U.S News & World Report Money,"Thu, 28 Jan 2021 08:00:00 GMT",https://news.google.com/rss/articles/CBMiUmh0dHBzOi8vbW9uZXkudXNuZXdzLmNvbS9pbnZlc3Rpbmcvc3RvY2stbWFya2V0LW5ld3MvYXJ0aWNsZXMvdGVzbGEtaW5jLXRzbGEtc3RvY2vSAQA?oc=5&hl=en-MY&gl=MY&ceid=MY:en,"{'href': 'https://money.usnews.com', 'title': 'U.S News & World Report Money'}",TSLA
10,10,10,Elon Musk's brother Kimbal just sold some Tesla stock. Is he calling a top? - MarketWatch,Elon Musk's brother Kimbal just sold some Tesla stock. Is he calling a top?  MarketWatch,"Thu, 11 Feb 2021 08:00:00 GMT",https://news.google.com/rss/articles/CBMieWh0dHBzOi8vd3d3Lm1hcmtldHdhdGNoLmNvbS9zdG9yeS9lbG9uLW11c2tzLWJyb3RoZXIta2ltYmFsLWp1c3Qtc29sZC1zb21lLXRlc2xhLXN0b2NrLWRpZC1oZS1qdXN0LWNhbGwtYS10b3AtMTE2MTMwNjkwODPSAX1odHRwczovL3d3dy5tYXJrZXR3YXRjaC5jb20vYW1wL3N0b3J5L2Vsb24tbXVza3MtYnJvdGhlci1raW1iYWwtanVzdC1zb2xkLXNvbWUtdGVzbGEtc3RvY2stZGlkLWhlLWp1c3QtY2FsbC1hLXRvcC0xMTYxMzA2OTA4Mw?oc=5&hl=en-MY&gl=MY&ceid=MY:en,"{'href': 'https://www.marketwatch.com', 'title': 'MarketWatch'}",TSLA
11,11,11,Tesla (TSLA) to Miss Out on U.K. Subsidy as Government Lowers Price Cap - Bloomberg,Tesla (TSLA) to Miss Out on U.K. Subsidy as Government Lowers Price Cap  Bloomberg,"Thu, 18 Mar 2021 07:00:00 GMT",https://news.google.com/rss/articles/CBMicmh0dHBzOi8vd3d3LmJsb29tYmVyZy5jb20vbmV3cy9hcnRpY2xlcy8yMDIxLTAzLTE4L3Rlc2xhLXRvLW1pc3Mtb3V0LW9uLXUtay1zdWJzaWR5LWFzLWdvdmVybm1lbnQtbG93ZXJzLXByaWNlLWNhcNIBAA?oc=5&hl=en-MY&gl=MY&ceid=MY:en,"{'href': 'https://www.bloomberg.com', 'title': 'Bloomberg'}",TSLA
12,12,12,"#TradeTalks: These are the stocks millennials are buying, and Nasdaq-100 TSLA takes the top spot - Nasdaq","#TradeTalks: These are the stocks millennials are buying, and Nasdaq-100 TSLA takes the top spot  Nasdaq","Fri, 22 Jan 2021 08:00:00 GMT",https://news.google.com/rss/articles/CBMieWh0dHBzOi8vd3d3Lm5hc2RhcS5jb20vdmlkZW9zL3RyYWRldGFsa3MlM0EtdGhlc2UtYXJlLXRoZS1zdG9ja3MtbWlsbGVubmlhbHMtYXJlLWJ1eWluZy1hbmQtbmFzZGFxLTEwMC10c2xhLXRha2VzLXRoZS10b3DSAQA?oc=5&hl=en-MY&gl=MY&ceid=MY:en,"{'href': 'https://www.nasdaq.com', 'title': 'Nasdaq'}",TSLA
13,13,13,"Tesla's $1.5B Bitcoin Investment 'A Sign Of Desperation' From Elon Musk, Says Analyst - Yahoo Finance","Tesla's $1.5B Bitcoin Investment 'A Sign Of Desperation' From Elon Musk, Says Analyst  Yahoo Finance","Mon, 08 Feb 2021 08:00:00 GMT",https://news.google.com/rss/articles/CBMiTGh0dHBzOi8vZmluYW5jZS55YWhvby5jb20vbmV3cy90ZXNsYXMtMS01Yi1iaXRjb2luLWludmVzdG1lbnQtMDczNTI3OTQzLmh0bWzSAQA?oc=5&hl=en-MY&gl=MY&ceid=MY:en,"{'href': 'https://finance.yahoo.com', 'title': 'Yahoo Finance'}",TSLA
14,14,14,Tesla (TSLA) Under Pressure After Missing EPS Estimates - Investopedia,Tesla (TSLA) Under Pressure After Missing EPS Estimates  Investopedia,"Thu, 28 Jan 2021 08:00:00 GMT",https://news.google.com/rss/articles/CBMiWmh0dHBzOi8vd3d3LmludmVzdG9wZWRpYS5jb20vdGVzbGEtdHNsYS11bmRlci1wcmVzc3VyZS1hZnRlci1taXNzaW5nLWVwcy1lc3RpbWF0ZXMtNTEwMDg1NdIBAA?oc=5&hl=en-MY&gl=MY&ceid=MY:en,"{'href': 'https://www.investopedia.com', 'title': 'Investopedia'}",TSLA
15,15,15,Tesla (TSLA) 4th Quarter Earnings: What to Expect - Nasdaq,Tesla (TSLA) 4th Quarter Earnings: What to Expect  Nasdaq,"Wed, 27 Jan 2021 08:00:00 GMT",https://news.google.com/rss/articles/CBMiXGh0dHBzOi8vd3d3Lm5hc2RhcS5jb20vYXJ0aWNsZXMvdGVzbGEtdHNsYS00dGgtcXVhcnRlci1lYXJuaW5ncyUzQS13aGF0LXRvLWV4cGVjdC0yMDIxLTAxLTI30gEA?oc=5&hl=en-MY&gl=MY&ceid=MY:en,"{'href': 'https://www.nasdaq.com', 'title': 'Nasdaq'}",TSLA
16,16,16,Tesla Earnings: What Happened With TSLA - Investopedia,Tesla Earnings: What Happened With TSLA  Investopedia,"Mon, 25 Jan 2021 08:00:00 GMT",https://news.google.com/rss/articles/CBMiO2h0dHBzOi8vd3d3LmludmVzdG9wZWRpYS5jb20vdGVzbGEtcTQtMjAyMC1lYXJuaW5ncy01MDk2OTUz0gEA?oc=5&hl=en-MY&gl=MY&ceid=MY:en,"{'href': 'https://www.investopedia.com', 'title': 'Investopedia'}",TSLA
17,17,17,Tesla (TSLA) Discloses $1.5B Investment in Bitcoin - Investopedia,Tesla (TSLA) Discloses $1.5B Investment in Bitcoin  Investopedia,"Mon, 08 Feb 2021 08:00:00 GMT",https://news.google.com/rss/articles/CBMiV2h0dHBzOi8vd3d3LmludmVzdG9wZWRpYS5jb20vdGVzbGEtdHNsYS1kaXNjbG9zZXMtdXNkMS01Yi1pbnZlc3RtZW50LWluLWJpdGNvaW4tNTEwNTA3ONIBAA?oc=5&hl=en-MY&gl=MY&ceid=MY:en,"{'href': 'https://www.investopedia.com', 'title': 'Investopedia'}",TSLA
18,18,18,TSLA Stock Cash Secured Put Generates Income - Investor's Business Daily,TSLA Stock Cash Secured Put Generates Income  Investor's Business Daily,"Tue, 23 Feb 2021 08:00:00 GMT",https://news.google.com/rss/articles/CBMiWGh0dHBzOi8vd3d3LmludmVzdG9ycy5jb20vcmVzZWFyY2gvb3B0aW9ucy90c2xhLXN0b2NrLWNhc2gtc2VjdXJlZC1wdXQtZ2VuZXJhdGVzLWluY29tZS_SAQA?oc=5&hl=en-MY&gl=MY&ceid=MY:en,"{'href': 'https://www.investors.com', 'title': ""Investor's Business Daily""}",TSLA
19,19,19,Tesla To Unveil Updated Cybertruck In Coming Quarter - Yahoo Finance,Tesla To Unveil Updated Cybertruck In Coming Quarter  Yahoo Finance,"Sun, 07 Mar 2021 08:00:00 GMT",https://news.google.com/rss/articles/CBMiVGh0dHBzOi8vZmluYW5jZS55YWhvby5jb20vbmV3cy90ZXNsYS11bnZlaWwtdXBkYXRlZC1jeWJlcnRydWNrLWNvbWluZy0wMjUzMDIzMjAuaHRtbNIBAA?oc=5&hl=en-MY&gl=MY&ceid=MY:en,"{'href': 'https://finance.yahoo.com', 'title': 'Yahoo Finance'}",TSLA
20,20,20,"He began buying Tesla at just $7.50, and now he's retiring at 39 years old with $12 million worth — he still refuses to sell a single share - MarketWatch","He began buying Tesla at just $7.50, and now he's retiring at 39 years old with $12 million worth — he still refuses to sell a single share  MarketWatch","Mon, 11 Jan 2021 08:00:00 GMT",https://news.google.com/rss/articles/CBMirgFodHRwczovL3d3dy5tYXJrZXR3YXRjaC5jb20vc3RvcnkvaGUtYmVnYW4tYnV5aW5nLXRlc2xhLWF0LTctNTAtYW5kLW5vdy1oZXMtcmV0aXJpbmctYXQtMzkteWVhcnMtb2xkLXdpdGgtMTItbWlsbGlvbi13b3J0aC1oZS1zdGlsbC1yZWZ1c2VzLXRvLXNlbGwtYS1zaW5nbGUtc2hhcmUtMTE2MTAzOTIwNjPSAbIBaHR0cHM6Ly93d3cubWFya2V0d2F0Y2guY29tL2FtcC9zdG9yeS9oZS1iZWdhbi1idXlpbmctdGVzbGEtYXQtNy01MC1hbmQtbm93LWhlcy1yZXRpcmluZy1hdC0zOS15ZWFycy1vbGQtd2l0aC0xMi1taWxsaW9uLXdvcnRoLWhlLXN0aWxsLXJlZnVzZXMtdG8tc2VsbC1hLXNpbmdsZS1zaGFyZS0xMTYxMDM5MjA2Mw?oc=5&hl=en-MY&gl=MY&ceid=MY:en,"{'href': 'https://www.marketwatch.com', 'title': 'MarketWatch'}",TSLA
21,21,21,"Investors Turn Away From Tesla (TSLA), Nio to EV Battery, Chipmakers - Bloomberg","Investors Turn Away From Tesla (TSLA), Nio to EV Battery, Chipmakers  Bloomberg","Thu, 21 Jan 2021 08:00:00 GMT",https://news.google.com/rss/articles/CBMic2h0dHBzOi8vd3d3LmJsb29tYmVyZy5jb20vbmV3cy9hcnRpY2xlcy8yMDIxLTAxLTIxL2ludmVzdG9ycy10dXJuLWF3YXktZnJvbS10ZXNsYS10c2xhLW5pby10by1ldi1iYXR0ZXJ5LWNoaXBtYWtlcnPSAQA?oc=5&hl=en-MY&gl=MY&ceid=MY:en,"{'href': 'https://www.bloomberg.com', 'title': 'Bloomberg'}",TSLA
22,22,22,"Tesla misses on earnings, expects 50% average annual growth in deliveries going forward - CNBC","Tesla misses on earnings, expects 50% average annual growth in deliveries going forward  CNBC","Wed, 27 Jan 2021 08:00:00 GMT",https://news.google.com/rss/articles/CBMiQGh0dHBzOi8vd3d3LmNuYmMuY29tLzIwMjEvMDEvMjcvdGVzbGEtdHNsYS1lYXJuaW5ncy1xNC0yMDIwLmh0bWzSAURodHRwczovL3d3dy5jbmJjLmNvbS9hbXAvMjAyMS8wMS8yNy90ZXNsYS10c2xhLWVhcm5pbmdzLXE0LTIwMjAuaHRtbA?oc=5&hl=en-MY&gl=MY&ceid=MY:en,"{'href': 'https://www.cnbc.com', 'title': 'CNBC'}",TSLA
23,23,23,"Tesla, Alibaba, UnitedHealth, Walgreens - Wednesday's Premarket Movers - TheStreet","Tesla, Alibaba, UnitedHealth, Walgreens - Wednesday's Premarket Movers  TheStreet","Wed, 06 Jan 2021 08:00:00 GMT",https://news.google.com/rss/articles/CBMiY2h0dHBzOi8vd3d3LnRoZXN0cmVldC5jb20vaW52ZXN0aW5nL3Rlc2xhLWFsaWJhYmEtdW5pdGVkaGVhbHRoLXdhbGdyZWVucy1wcmVtYXJrZXQtbW92ZXJzLXdlZG5lc2RhedIBAA?oc=5&hl=en-MY&gl=MY&ceid=MY:en,"{'href': 'https://www.thestreet.com', 'title': 'TheStreet'}",TSLA
24,24,24,Tesla's (TSLA) Regulatory Credits Help Results - Investopedia,Tesla's (TSLA) Regulatory Credits Help Results  Investopedia,"Sat, 13 Feb 2021 08:00:00 GMT",https://news.google.com/rss/articles/CBMiUGh0dHBzOi8vd3d3LmludmVzdG9wZWRpYS5jb20vdGVzbGFzLXRzbGEtcmVndWxhdG9yeS1jcmVkaXRzLWhlbHAtcmVzdWx0cy01MTA1MTQy0gEA?oc=5&hl=en-MY&gl=MY&ceid=MY:en,"{'href': 'https://www.investopedia.com', 'title': 'Investopedia'}",TSLA
25,25,25,Tesla (TSLA) and Elon Musk's Dominance Is Threatened by Volkswagen - Bloomberg,Tesla (TSLA) and Elon Musk's Dominance Is Threatened by Volkswagen  Bloomberg,"Tue, 23 Mar 2021 07:00:00 GMT",https://news.google.com/rss/articles/CBMic2h0dHBzOi8vd3d3LmJsb29tYmVyZy5jb20vbmV3cy9hcnRpY2xlcy8yMDIxLTAzLTI0L3Rlc2xhLXRzbGEtYW5kLWVsb24tbXVzay1zLWRvbWluYW5jZS1pcy10aHJlYXRlbmVkLWJ5LXZvbGtzd2FnZW7SAQA?oc=5&hl=en-MY&gl=MY&ceid=MY:en,"{'href': 'https://www.bloomberg.com', 'title': 'Bloomberg'}",TSLA
26,26,26,Tesla (TSLA) Finance Chief Zach Kirkhorn Makes His Mark Under Elon Musk - Bloomberg,Tesla (TSLA) Finance Chief Zach Kirkhorn Makes His Mark Under Elon Musk  Bloomberg,"Tue, 26 Jan 2021 08:00:00 GMT",https://news.google.com/rss/articles/CBMicWh0dHBzOi8vd3d3LmJsb29tYmVyZy5jb20vbmV3cy9hcnRpY2xlcy8yMDIxLTAxLTI2L211c2stcy1uby1ub25zZW5zZS1maW5hbmNlLWNoaWVmLXRhbGxpZXMtcHJvZml0LXN1cmdlLWF0LXRlc2xh0gEA?oc=5&hl=en-MY&gl=MY&ceid=MY:en,"{'href': 'https://www.bloomberg.com', 'title': 'Bloomberg'}",TSLA
27,27,27,"Tesla reports 499,550 vehicle deliveries for 2020, slightly missing target - CNBC","Tesla reports 499,550 vehicle deliveries for 2020, slightly missing target  CNBC","Sat, 02 Jan 2021 08:00:00 GMT",https://news.google.com/rss/articles/CBMiX2h0dHBzOi8vd3d3LmNuYmMuY29tLzIwMjEvMDEvMDIvdGVzbGEtdHNsYS1xNC0yMDIwLXZlaGljbGUtZGVsaXZlcnktYW5kLXByb2R1Y3Rpb24tbnVtYmVycy5odG1s0gFjaHR0cHM6Ly93d3cuY25iYy5jb20vYW1wLzIwMjEvMDEvMDIvdGVzbGEtdHNsYS1xNC0yMDIwLXZlaGljbGUtZGVsaXZlcnktYW5kLXByb2R1Y3Rpb24tbnVtYmVycy5odG1s?oc=5&hl=en-MY&gl=MY&ceid=MY:en,"{'href': 'https://www.cnbc.com', 'title': 'CNBC'}",TSLA
28,28,28,Tesla's bitcoin buy both 'friend and foe' as shares enter bear market - Fox Business,Tesla's bitcoin buy both 'friend and foe' as shares enter bear market  Fox Business,"Tue, 23 Feb 2021 08:00:00 GMT",https://news.google.com/rss/articles/CBMiZGh0dHBzOi8vd3d3LmZveGJ1c2luZXNzLmNvbS9tYXJrZXRzL3Rlc2xhcy1iaXRjb2luLWJ1eS1pcy1mcmllbmQtYW5kLWZvZS1hcy1zaGFyZXMtZW50ZXItYmVhci1tYXJrZXTSAWhodHRwczovL3d3dy5mb3hidXNpbmVzcy5jb20vbWFya2V0cy90ZXNsYXMtYml0Y29pbi1idXktaXMtZnJpZW5kLWFuZC1mb2UtYXMtc2hhcmVzLWVudGVyLWJlYXItbWFya2V0LmFtcA?oc=5&hl=en-MY&gl=MY&ceid=MY:en,"{'href': 'https://www.foxbusiness.com', 'title': 'Fox Business'}",TSLA
29,29,29,"Tesla, Toyota eye restarting SUV partnership: Report - Fox Business","Tesla, Toyota eye restarting SUV partnership: Report  Fox Business","Tue, 30 Mar 2021 07:00:00 GMT",https://news.google.com/rss/articles/CBMiUWh0dHBzOi8vd3d3LmZveGJ1c2luZXNzLmNvbS9saWZlc3R5bGUvdGVzbGEtdG95b3RhLWV5ZS1yZXN0YXJ0aW5nLXN1di1wYXJ0bmVyc2hpcNIBVWh0dHBzOi8vd3d3LmZveGJ1c2luZXNzLmNvbS9saWZlc3R5bGUvdGVzbGEtdG95b3RhLWV5ZS1yZXN0YXJ0aW5nLXN1di1wYXJ0bmVyc2hpcC5hbXA?oc=5&hl=en-MY&gl=MY&ceid=MY:en,"{'href': 'https://www.foxbusiness.com', 'title': 'Fox Business'}",TSLA
30,30,30,TSLA Stock Will Be Worth 50% More by 2022 Year End So Buy Its LEAPS - InvestorPlace,TSLA Stock Will Be Worth 50% More by 2022 Year End So Buy Its LEAPS  InvestorPlace,"Thu, 18 Feb 2021 08:00:00 GMT",https://news.google.com/rss/articles/CBMiaGh0dHBzOi8vaW52ZXN0b3JwbGFjZS5jb20vMjAyMS8wMi90c2xhLXN0b2NrLWlzLXdvcnRoLTUwLXBlcmNlbnQtbW9yZS1ieS0yMDIyLXllYXItZW5kLXNvLWJ1eS1pdHMtbGVhcHMv0gEA?oc=5&hl=en-MY&gl=MY&ceid=MY:en,"{'href': 'https://investorplace.com', 'title': 'InvestorPlace'}",TSLA
31,31,31,Tesla (TSLA) Bets $1.5 Billion on Bitcoin (BTC USD) in New Policy; Crypto Surges - Bloomberg,Tesla (TSLA) Bets $1.5 Billion on Bitcoin (BTC USD) in New Policy; Crypto Surges  Bloomberg,"Mon, 08 Feb 2021 08:00:00 GMT",https://news.google.com/rss/articles/CBMicGh0dHBzOi8vd3d3LmJsb29tYmVyZy5jb20vbmV3cy9hcnRpY2xlcy8yMDIxLTAyLTA4L3Rlc2xhLWJldHMtMS01LWJpbGxpb24tb24tYml0Y29pbi1pbi1uZXctcG9saWN5LWNyeXB0by1zdXJnZXPSAQA?oc=5&hl=en-MY&gl=MY&ceid=MY:en,"{'href': 'https://www.bloomberg.com', 'title': 'Bloomberg'}",TSLA
32,32,32,Tesla Q4 Earnings expectations boost stock two days before call - TESLARATI,Tesla Q4 Earnings expectations boost stock two days before call  TESLARATI,"Mon, 25 Jan 2021 08:00:00 GMT",https://news.google.com/rss/articles/CBMiRmh0dHBzOi8vd3d3LnRlc2xhcmF0aS5jb20vdGVzbGEtdHNsYS1xNC0yMDIwLWVhcm5pbmdzLXN0b2NrLWJvb3N0LXR3by_SAUpodHRwczovL3d3dy50ZXNsYXJhdGkuY29tL3Rlc2xhLXRzbGEtcTQtMjAyMC1lYXJuaW5ncy1zdG9jay1ib29zdC10d28vYW1wLw?oc=5&hl=en-MY&gl=MY&ceid=MY:en,"{'href': 'https://www.teslarati.com', 'title': 'TESLARATI'}",TSLA
33,33,33,"TSLA Design redesigns Roots, a place to discover the diverse culture and history of Singapore - It's Nice That","TSLA Design redesigns Roots, a place to discover the diverse culture and history of Singapore  It's Nice That","Fri, 26 Mar 2021 07:00:00 GMT",https://news.google.com/rss/articles/CBMiUGh0dHBzOi8vd3d3Lml0c25pY2V0aGF0LmNvbS9uZXdzL3RzbGEtZGVzaWduLXJvb3RzLWdyYXBoaWMtZGVzaWduLWRpZ2l0YWwtMjYwMzIx0gEA?oc=5&hl=en-MY&gl=MY&ceid=MY:en,"{'href': 'https://www.itsnicethat.com', 'title': ""It's Nice That""}",TSLA
34,34,34,Tesla Model 3 Demand Spikes In Japan Following 25% Price Slash - Yahoo Finance,Tesla Model 3 Demand Spikes In Japan Following 25% Price Slash  Yahoo Finance,"Sat, 06 Mar 2021 08:00:00 GMT",https://news.google.com/rss/articles/CBMiSWh0dHBzOi8vZmluYW5jZS55YWhvby5jb20vbmV3cy90ZXNsYS1tb2RlbC0zLWRlbWFuZC1zcGlrZXMtMjAyNzEzNzIyLmh0bWzSAQA?oc=5&hl=en-MY&gl=MY&ceid=MY:en,"{'href': 'https://finance.yahoo.com', 'title': 'Yahoo Finance'}",TSLA
35,35,35,Bireme Capital: “We are Short Tesla (TSLA)” - Yahoo Finance,Bireme Capital: “We are Short Tesla (TSLA)”  Yahoo Finance,"Wed, 03 Mar 2021 08:00:00 GMT",https://news.google.com/rss/articles/CBMiTWh0dHBzOi8vZmluYW5jZS55YWhvby5jb20vbmV3cy9iaXJlbWUtY2FwaXRhbC1zaG9ydC10ZXNsYS10c2xhLTE1NDExNTA1Mi5odG1s0gEA?oc=5&hl=en-MY&gl=MY&ceid=MY:en,"{'href': 'https://finance.yahoo.com', 'title': 'Yahoo Finance'}",TSLA
36,36,36,Why Tesla Stock Is Stuck in Reverse - The Motley Fool,Why Tesla Stock Is Stuck in Reverse  The Motley Fool,"Thu, 04 Mar 2021 08:00:00 GMT",https://news.google.com/rss/articles/CBMiTmh0dHBzOi8vd3d3LmZvb2wuY29tL2ludmVzdGluZy8yMDIxLzAzLzA0L3doeS10ZXNsYS1zdG9jay1pcy1zdHVjay1pbi1yZXZlcnNlL9IBAA?oc=5&hl=en-MY&gl=MY&ceid=MY:en,"{'href': 'https://www.fool.com', 'title': 'The Motley Fool'}",TSLA
37,37,37,Tesla (TSLA) Needs Elon Musk to Crack Corporate Market to Succeed in Europe - Bloomberg,Tesla (TSLA) Needs Elon Musk to Crack Corporate Market to Succeed in Europe  Bloomberg,"Tue, 02 Mar 2021 08:00:00 GMT",https://news.google.com/rss/articles/CBMifGh0dHBzOi8vd3d3LmJsb29tYmVyZy5jb20vbmV3cy9hcnRpY2xlcy8yMDIxLTAzLTAzL3Rlc2xhLXRzbGEtbmVlZHMtZWxvbi1tdXNrLXRvLWNyYWNrLWNvcnBvcmF0ZS1tYXJrZXQtdG8tc3VjY2VlZC1pbi1ldXJvcGXSAQA?oc=5&hl=en-MY&gl=MY&ceid=MY:en,"{'href': 'https://www.bloomberg.com', 'title': 'Bloomberg'}",TSLA
38,38,38,"Elon Musk (TSLA) Becomes World's Richest Person, Passes Jeff Bezos - Bloomberg","Elon Musk (TSLA) Becomes World's Richest Person, Passes Jeff Bezos  Bloomberg","Wed, 06 Jan 2021 08:00:00 GMT",https://news.google.com/rss/articles/CBMia2h0dHBzOi8vd3d3LmJsb29tYmVyZy5jb20vbmV3cy9hcnRpY2xlcy8yMDIxLTAxLTA2L211c2stY2xvc2UtdG8tc3VycGFzc2luZy1iZXpvcy1hcy13b3JsZC1zLXJpY2hlc3QtcGVyc29u0gEA?oc=5&hl=en-MY&gl=MY&ceid=MY:en,"{'href': 'https://www.bloomberg.com', 'title': 'Bloomberg'}",TSLA
39,39,39,VW New ID.4 Crozz Electric SUV Takes on Tesla (TSLA) in China - Bloomberg,VW New ID.4 Crozz Electric SUV Takes on Tesla (TSLA) in China  Bloomberg,"Tue, 19 Jan 2021 08:00:00 GMT",https://news.google.com/rss/articles/CBMicWh0dHBzOi8vd3d3LmJsb29tYmVyZy5jb20vbmV3cy9hcnRpY2xlcy8yMDIxLTAxLTE5L3Z3LWdvZXMtaGVhZC10by1oZWFkLXdpdGgtdGVzbGEtaW4tY2hpbmEtd2l0aC1uZXctZWxlY3RyaWMtc3V20gEA?oc=5&hl=en-MY&gl=MY&ceid=MY:en,"{'href': 'https://www.bloomberg.com', 'title': 'Bloomberg'}",TSLA
40,40,40,General Motors or Tesla? This Chart Shows Challenge to Elon Musk - TradeStation Market Insights,General Motors or Tesla? This Chart Shows Challenge to Elon Musk  TradeStation Market Insights,"Tue, 19 Jan 2021 08:00:00 GMT",https://news.google.com/rss/articles/CBMiWGh0dHBzOi8vd3d3LnRyYWRlc3RhdGlvbi5jb20vaW5zaWdodHMvMjAyMS8wMS8xOS9nZW5lcmFsLW1vdG9ycy1vdXRwZXJmb3Jtcy10ZXNsYS1jaGFydC_SAQA?oc=5&hl=en-MY&gl=MY&ceid=MY:en,"{'href': 'https://www.tradestation.com', 'title': 'TradeStation Market Insights'}",TSLA
41,41,41,Elon Musk nears Jeff Bezos’ net worth; Tesla sets course for Facebook’s valuation - TESLARATI,Elon Musk nears Jeff Bezos’ net worth; Tesla sets course for Facebook’s valuation  TESLARATI,"Tue, 05 Jan 2021 08:00:00 GMT",https://news.google.com/rss/articles/CBMiVGh0dHBzOi8vd3d3LnRlc2xhcmF0aS5jb20vZWxvbi1tdXNrLXZzLWplZmYtYmV6b3MtbWFya2V0LWNhcC10ZXNsYS10c2xhLXZzLWZhY2Vib29rL9IBWGh0dHBzOi8vd3d3LnRlc2xhcmF0aS5jb20vZWxvbi1tdXNrLXZzLWplZmYtYmV6b3MtbWFya2V0LWNhcC10ZXNsYS10c2xhLXZzLWZhY2Vib29rL2FtcC8?oc=5&hl=en-MY&gl=MY&ceid=MY:en,"{'href': 'https://www.teslarati.com', 'title': 'TESLARATI'}",TSLA
42,42,42,Tesla overtakes Facebook in road to becoming a $1 trillion company - TESLARATI,Tesla overtakes Facebook in road to becoming a $1 trillion company  TESLARATI,"Thu, 07 Jan 2021 08:00:00 GMT",https://news.google.com/rss/articles/CBMiQ2h0dHBzOi8vd3d3LnRlc2xhcmF0aS5jb20vdGVzbGEtdHNsYS1vdmVydGFrZXMtZmFjZWJvb2stMS10cmlsbGlvbi_SAUdodHRwczovL3d3dy50ZXNsYXJhdGkuY29tL3Rlc2xhLXRzbGEtb3ZlcnRha2VzLWZhY2Vib29rLTEtdHJpbGxpb24vYW1wLw?oc=5&hl=en-MY&gl=MY&ceid=MY:en,"{'href': 'https://www.teslarati.com', 'title': 'TESLARATI'}",TSLA
43,43,43,"Tesla (TSLA), Cloudfare (NET) Breached in Verkada Security Camera Hack - Bloomberg","Tesla (TSLA), Cloudfare (NET) Breached in Verkada Security Camera Hack  Bloomberg","Tue, 09 Mar 2021 08:00:00 GMT",https://news.google.com/rss/articles/CBMicGh0dHBzOi8vd3d3LmJsb29tYmVyZy5jb20vbmV3cy9hcnRpY2xlcy8yMDIxLTAzLTA5L2hhY2tlcnMtZXhwb3NlLXRlc2xhLWphaWxzLWluLWJyZWFjaC1vZi0xNTAtMDAwLXNlY3VyaXR5LWNhbXPSAQA?oc=5&hl=en-MY&gl=MY&ceid=MY:en,"{'href': 'https://www.bloomberg.com', 'title': 'Bloomberg'}",TSLA
44,44,44,Tesla (TSLA) launches its own solar power inverter - Electrek.co,Tesla (TSLA) launches its own solar power inverter  Electrek.co,"Thu, 14 Jan 2021 08:00:00 GMT",https://news.google.com/rss/articles/CBMiRmh0dHBzOi8vZWxlY3RyZWsuY28vMjAyMS8wMS8xNC90ZXNsYS10c2xhLXNvbGFyLXBvd2VyLWludmVydGVyLWxhdW5jaC_SAQA?oc=5&hl=en-MY&gl=MY&ceid=MY:en,"{'href': 'https://electrek.co', 'title': 'Electrek.co'}",TSLA
45,45,45,Tesla (TSLA) is about to launch its in-house insurance program in more states - Electrek,Tesla (TSLA) is about to launch its in-house insurance program in more states  Electrek,"Mon, 22 Mar 2021 07:00:00 GMT",https://news.google.com/rss/articles/CBMiWGh0dHBzOi8vZWxlY3RyZWsuY28vMjAyMS8wMy8yMi90ZXNsYS10c2xhLWxhdW5jaC1pbi1ob3VzZS1pbnN1cmFuY2UtcHJvZ3JhbS1tb3JlLXN0YXRlcy_SAQA?oc=5&hl=en-MY&gl=MY&ceid=MY:en,"{'href': 'https://electrek.co', 'title': 'Electrek'}",TSLA
46,46,46,Tesla (TSLA) Elon Musk Tone With China Authorities Differs From U.S. Officials - Bloomberg,Tesla (TSLA) Elon Musk Tone With China Authorities Differs From U.S. Officials  Bloomberg,"Tue, 09 Feb 2021 08:00:00 GMT",https://news.google.com/rss/articles/CBMicWh0dHBzOi8vd3d3LmJsb29tYmVyZy5jb20vbmV3cy9hcnRpY2xlcy8yMDIxLTAyLTA5L3Rlc2xhLXMtdG9uZS13aXRoLWNoaW5hLWF1dGhvcml0aWVzLWRpZmZlcnMtZnJvbS1tdXNrLXMtaW4tdS1z0gEA?oc=5&hl=en-MY&gl=MY&ceid=MY:en,"{'href': 'https://www.bloomberg.com', 'title': 'Bloomberg'}",TSLA
47,47,47,"Tesla (TSLA) Emissions-Credit Revenue in 2021 May Rise to $2 Billion, CS Says - Bloomberg","Tesla (TSLA) Emissions-Credit Revenue in 2021 May Rise to $2 Billion, CS Says  Bloomberg","Wed, 27 Jan 2021 08:00:00 GMT",https://news.google.com/rss/articles/CBMicGh0dHBzOi8vd3d3LmJsb29tYmVyZy5jb20vbmV3cy9hcnRpY2xlcy8yMDIxLTAxLTI3L3Rlc2xhLWNyZWRpdC1yZXZlbnVlLW1heS1yaXNlLXRvLTItYmlsbGlvbi1jcmVkaXQtc3Vpc3NlLXNheXPSAQA?oc=5&hl=en-MY&gl=MY&ceid=MY:en,"{'href': 'https://www.bloomberg.com', 'title': 'Bloomberg'}",TSLA
48,48,48,Tesla (TSLA) announces a new battery cell deal with Panasonic - Electrek,Tesla (TSLA) announces a new battery cell deal with Panasonic  Electrek,"Mon, 04 Jan 2021 08:00:00 GMT",https://news.google.com/rss/articles/CBMiRmh0dHBzOi8vZWxlY3RyZWsuY28vMjAyMS8wMS8wNC90ZXNsYS10c2xhLWJhdHRlcnktY2VsbC1kZWFsLXBhbmFzb25pYy_SAQA?oc=5&hl=en-MY&gl=MY&ceid=MY:en,"{'href': 'https://electrek.co', 'title': 'Electrek'}",TSLA
49,49,49,Tesla (TSLA) Elon Musk Cars Banned by China's Military on Camera Concerns - Bloomberg,Tesla (TSLA) Elon Musk Cars Banned by China's Military on Camera Concerns  Bloomberg,"Fri, 19 Mar 2021 07:00:00 GMT",https://news.google.com/rss/articles/CBMicmh0dHBzOi8vd3d3LmJsb29tYmVyZy5jb20vbmV3cy9hcnRpY2xlcy8yMDIxLTAzLTE5L3Rlc2xhLWNhcnMtYmFubmVkLWJ5LWNoaW5hLXMtbWlsaXRhcnktb24tY29uY2VybnMtYWJvdXQtY2FtZXJhc9IBAA?oc=5&hl=en-MY&gl=MY&ceid=MY:en,"{'href': 'https://www.bloomberg.com', 'title': 'Bloomberg'}",TSLA
50,50,50,Bill Gates talks Elon Musk and comments on his rumored TSLA short position - TESLARATI,Bill Gates talks Elon Musk and comments on his rumored TSLA short position  TESLARATI,"Thu, 18 Feb 2021 08:00:00 GMT",https://news.google.com/rss/articles/CBMiRmh0dHBzOi8vd3d3LnRlc2xhcmF0aS5jb20vdGVzbGEtZWxvbi1tdXNrLWJpbGwtZ2F0ZXMtdGFsa3MtdHNsYS1zaG9ydC_SAUpodHRwczovL3d3dy50ZXNsYXJhdGkuY29tL3Rlc2xhLWVsb24tbXVzay1iaWxsLWdhdGVzLXRhbGtzLXRzbGEtc2hvcnQvYW1wLw?oc=5&hl=en-MY&gl=MY&ceid=MY:en,"{'href': 'https://www.teslarati.com', 'title': 'TESLARATI'}",TSLA
