Unnamed: 0,Unnamed: 0.1,title,description,published date,url,publisher,company
0,0,Amazon (AMZN) Earnings Ahead - Investopedia,Amazon (AMZN) Earnings Ahead  Investopedia,"Wed, 14 Jul 2021 07:00:00 GMT",https://news.google.com/rss/articles/CBMiP2h0dHBzOi8vd3d3LmludmVzdG9wZWRpYS5jb20vYW1hem9uLWFtem4tZWFybmluZ3MtYWhlYWQtNTE5MjUwMtIBAA?oc=5&hl=en-MY&gl=MY&ceid=MY:en,"{'href': 'https://www.investopedia.com', 'title': 'Investopedia'}",AMZN
1,1,"Deforestation, warming flip part of Amazon forest from carbon sink to source - noaa.gov","Deforestation, warming flip part of Amazon forest from carbon sink to source  noaa.gov","Wed, 14 Jul 2021 07:00:00 GMT",https://news.google.com/rss/articles/CBMicWh0dHBzOi8vcmVzZWFyY2gubm9hYS5nb3YvMjAyMS8wNy8xNC9kZWZvcmVzdGF0aW9uLXdhcm1pbmctZmxpcC1wYXJ0LW9mLWFtYXpvbi1mb3Jlc3QtZnJvbS1jYXJib24tc2luay10by1zb3VyY2Uv0gEA?oc=5&hl=en-MY&gl=MY&ceid=MY:en,"{'href': 'https://research.noaa.gov', 'title': 'noaa.gov'}",AMZN
2,2,Amazon invests in nature projects to benefit communities across Europe - About Amazon,Amazon invests in nature projects to benefit communities across Europe  About Amazon,"Fri, 24 Sep 2021 07:00:00 GMT",https://news.google.com/rss/articles/CBMidmh0dHBzOi8vd3d3LmFib3V0YW1hem9uLmNvbS9uZXdzL3N1c3RhaW5hYmlsaXR5L2FtYXpvbi1pbnZlc3RzLWluLW5hdHVyZS1wcm9qZWN0cy10by1iZW5lZml0LWNvbW11bml0aWVzLWFjcm9zcy1ldXJvcGXSAQA?oc=5&hl=en-MY&gl=MY&ceid=MY:en,"{'href': 'https://www.aboutamazon.com', 'title': 'About Amazon'}",AMZN
3,3,Amazon Studios and Howard University Launch Howard Entertainment Program for Third Consecutive Year - The Dig,Amazon Studios and Howard University Launch Howard Entertainment Program for Third Consecutive Year  The Dig,"Fri, 01 Oct 2021 07:00:00 GMT",https://news.google.com/rss/articles/CBMihQFodHRwczovL3RoZWRpZy5ob3dhcmQuZWR1L2FsbC1zdG9yaWVzL2FtYXpvbi1zdHVkaW9zLWFuZC1ob3dhcmQtdW5pdmVyc2l0eS1sYXVuY2gtaG93YXJkLWVudGVydGFpbm1lbnQtcHJvZ3JhbS10aGlyZC1jb25zZWN1dGl2ZS15ZWFy0gEA?oc=5&hl=en-MY&gl=MY&ceid=MY:en,"{'href': 'https://thedig.howard.edu', 'title': 'The Dig'}",AMZN
4,4,Inside Amazon (AMZN) Flagship Fulfillment Center Where Machines Run the Show - Bloomberg,Inside Amazon (AMZN) Flagship Fulfillment Center Where Machines Run the Show  Bloomberg,"Tue, 21 Sep 2021 07:00:00 GMT",https://news.google.com/rss/articles/CBMifWh0dHBzOi8vd3d3LmJsb29tYmVyZy5jb20vbmV3cy9mZWF0dXJlcy8yMDIxLTA5LTIxL2luc2lkZS1hbWF6b24tYW16bi1mbGFnc2hpcC1mdWxmaWxsbWVudC1jZW50ZXItd2hlcmUtbWFjaGluZXMtcnVuLXRoZS1zaG930gEA?oc=5&hl=en-MY&gl=MY&ceid=MY:en,"{'href': 'https://www.bloomberg.com', 'title': 'Bloomberg'}",AMZN
5,5,If You Had Invested In Amazon's IPO... - Statista,If You Had Invested In Amazon's IPO...  Statista,"Mon, 05 Jul 2021 07:00:00 GMT",https://news.google.com/rss/articles/CBMiPWh0dHBzOi8vd3d3LnN0YXRpc3RhLmNvbS9jaGFydC8xNTMzNC9hbWF6b24tbG9uZy10ZXJtLXJldHVybi_SAUFodHRwczovL3d3dy5zdGF0aXN0YS5jb20vY2hhcnQvYW1wLzE1MzM0L2FtYXpvbi1sb25nLXRlcm0tcmV0dXJuLw?oc=5&hl=en-MY&gl=MY&ceid=MY:en,"{'href': 'https://www.statista.com', 'title': 'Statista'}",AMZN
6,6,Opinion | Dave Eggers Created the Google-Amazon Mash-Up of Your Nightmares (Published 2021) - The New York Times,Opinion | Dave Eggers Created the Google-Amazon Mash-Up of Your Nightmares (Published 2021)  The New York Times,"Mon, 13 Sep 2021 07:00:00 GMT",https://news.google.com/rss/articles/CBMiTWh0dHBzOi8vd3d3Lm55dGltZXMuY29tLzIwMjEvMDkvMTMvb3Bpbmlvbi9zd2F5LWthcmEtc3dpc2hlci1kYXZlLWVnZ2Vycy5odG1s0gEA?oc=5&hl=en-MY&gl=MY&ceid=MY:en,"{'href': 'https://www.nytimes.com', 'title': 'The New York Times'}",AMZN
7,7,Why are Amazon shares down 6% premarket? An easing pandemic - Fast Company,Why are Amazon shares down 6% premarket? An easing pandemic  Fast Company,"Fri, 30 Jul 2021 07:00:00 GMT",https://news.google.com/rss/articles/CBMifWh0dHBzOi8vd3d3LmZhc3Rjb21wYW55LmNvbS85MDY1OTc3Ny93aHktYXJlLWFtYXpvbi1zaGFyZXMtZG93bi1hbXpuLXN0b2NrLXBsdW1tZXRzLTYtcHJlLW1hcmtldC10aGFua3MtdG8tYW4tZWFzaW5nLXBhbmRlbWlj0gEA?oc=5&hl=en-MY&gl=MY&ceid=MY:en,"{'href': 'https://www.fastcompany.com', 'title': 'Fast Company'}",AMZN
8,8,Amazon is destroying unsold products by the thousands - Environment America,Amazon is destroying unsold products by the thousands  Environment America,"Tue, 31 Aug 2021 07:00:00 GMT",https://news.google.com/rss/articles/CBMiXmh0dHBzOi8vZW52aXJvbm1lbnRhbWVyaWNhLm9yZy9hcnRpY2xlcy9hbWF6b24taXMtZGVzdHJveWluZy11bnNvbGQtcHJvZHVjdHMtYnktdGhlLXRob3VzYW5kcy_SAQA?oc=5&hl=en-MY&gl=MY&ceid=MY:en,"{'href': 'https://environmentamerica.org', 'title': 'Environment America'}",AMZN
9,9,"Brazil's Amazon is now a carbon source, unprecedented study reveals - Mongabay.com","Brazil's Amazon is now a carbon source, unprecedented study reveals  Mongabay.com","Wed, 14 Jul 2021 07:00:00 GMT",https://news.google.com/rss/articles/CBMiZGh0dHBzOi8vbmV3cy5tb25nYWJheS5jb20vMjAyMS8wNy9icmF6aWxzLWFtYXpvbi1pcy1ub3ctYS1jYXJib24tc291cmNlLXVucHJlY2VkZW50ZWQtc3R1ZHktcmV2ZWFscy_SAQA?oc=5&hl=en-MY&gl=MY&ceid=MY:en,"{'href': 'https://news.mongabay.com', 'title': 'Mongabay.com'}",AMZN
10,10,Should Amazon (AMZN) Antitrust Concerns Worry Investors? - Investopedia,Should Amazon (AMZN) Antitrust Concerns Worry Investors?  Investopedia,"Tue, 17 Aug 2021 07:00:00 GMT",https://news.google.com/rss/articles/CBMiWmh0dHBzOi8vd3d3LmludmVzdG9wZWRpYS5jb20vc2hvdWxkLWFtYXpvbi1hbXpuLWFudGl0cnVzdC1jb25jZXJucy13b3JyeS1pbnZlc3RvcnMtNTE5Nzg5MdIBAA?oc=5&hl=en-MY&gl=MY&ceid=MY:en,"{'href': 'https://www.investopedia.com', 'title': 'Investopedia'}",AMZN
11,11,Amazon pledges support to forests and communities in the Brazilian Amazon - About Amazon,Amazon pledges support to forests and communities in the Brazilian Amazon  About Amazon,"Thu, 02 Sep 2021 07:00:00 GMT",https://news.google.com/rss/articles/CBMieWh0dHBzOi8vd3d3LmFib3V0YW1hem9uLmNvbS9uZXdzL3N1c3RhaW5hYmlsaXR5L2FtYXpvbi1wbGVkZ2VzLXN1cHBvcnQtdG8tZm9yZXN0cy1hbmQtY29tbXVuaXRpZXMtaW4tdGhlLWJyYXppbGlhbi1hbWF6b27SAQA?oc=5&hl=en-MY&gl=MY&ceid=MY:en,"{'href': 'https://www.aboutamazon.com', 'title': 'About Amazon'}",AMZN
12,12,What Traders Missed About Amazon (AMZN) Over the Years - Investopedia,What Traders Missed About Amazon (AMZN) Over the Years  Investopedia,"Tue, 10 Aug 2021 07:00:00 GMT",https://news.google.com/rss/articles/CBMiWWh0dHBzOi8vd3d3LmludmVzdG9wZWRpYS5jb20vd2hhdC10cmFkZXJzLW1pc3NlZC1hYm91dC1hbWF6b24tYW16bi1vdmVyLXRoZS15ZWFycy01MTk2Nzgx0gEA?oc=5&hl=en-MY&gl=MY&ceid=MY:en,"{'href': 'https://www.investopedia.com', 'title': 'Investopedia'}",AMZN
13,13,Amazon is supporting small businesses by thinking big - About Amazon,Amazon is supporting small businesses by thinking big  About Amazon,"Mon, 13 Sep 2021 07:00:00 GMT",https://news.google.com/rss/articles/CBMiaGh0dHBzOi8vd3d3LmFib3V0YW1hem9uLmNvbS9uZXdzL3BvbGljeS1uZXdzLXZpZXdzL2FtYXpvbi1pcy1zdXBwb3J0aW5nLXNtYWxsLWJ1c2luZXNzZXMtYnktdGhpbmtpbmctYmln0gEA?oc=5&hl=en-MY&gl=MY&ceid=MY:en,"{'href': 'https://www.aboutamazon.com', 'title': 'About Amazon'}",AMZN
14,14,"Amazon (AMZN) Is Grounded, Even With Bezos in the Clouds - Investopedia","Amazon (AMZN) Is Grounded, Even With Bezos in the Clouds  Investopedia","Wed, 21 Jul 2021 07:00:00 GMT",https://news.google.com/rss/articles/CBMiWmh0dHBzOi8vd3d3LmludmVzdG9wZWRpYS5jb20vYW1hem9uLWFtem4taXMtZ3JvdW5kZWQtZXZlbi13aXRoLWJlem9zLWluLXRoZS1jbG91ZHMtNTE5MzYzOdIBAA?oc=5&hl=en-MY&gl=MY&ceid=MY:en,"{'href': 'https://www.investopedia.com', 'title': 'Investopedia'}",AMZN
15,15,Amazon Handmade and Nest join together to advance gender equity and economic inclusion - About Amazon,Amazon Handmade and Nest join together to advance gender equity and economic inclusion  About Amazon,"Mon, 13 Sep 2021 07:00:00 GMT",https://news.google.com/rss/articles/CBMifmh0dHBzOi8vd3d3LmFib3V0YW1hem9uLmNvbS9uZXdzL3JldGFpbC9hbWF6b24taGFuZG1hZGUtYW5kLW5lc3Qtam9pbi10b2dldGhlci10by1hZHZhbmNlLWdlbmRlci1lcXVpdHktYW5kLWVjb25vbWljLWluY2x1c2lvbtIBAA?oc=5&hl=en-MY&gl=MY&ceid=MY:en,"{'href': 'https://www.aboutamazon.com', 'title': 'About Amazon'}",AMZN
16,16,Amazon Earnings: What to Look for from AMZN - Investopedia,Amazon Earnings: What to Look for from AMZN  Investopedia,"Wed, 28 Jul 2021 07:00:00 GMT",https://news.google.com/rss/articles/CBMiTWh0dHBzOi8vd3d3LmludmVzdG9wZWRpYS5jb20vYW1hem9uLXEyLWZ5MjAyMS1lYXJuaW5ncy1yZXBvcnQtcHJldmlldy01MTk0NDc10gEA?oc=5&hl=en-MY&gl=MY&ceid=MY:en,"{'href': 'https://www.investopedia.com', 'title': 'Investopedia'}",AMZN
17,17,Amazon VP shares how Fire TV is reimagining the largest screen in your home - About Amazon,Amazon VP shares how Fire TV is reimagining the largest screen in your home  About Amazon,"Thu, 09 Sep 2021 07:00:00 GMT",https://news.google.com/rss/articles/CBMidGh0dHBzOi8vd3d3LmFib3V0YW1hem9uLmNvbS9uZXdzL2RldmljZXMvYW1hem9uLXZwLXNoYXJlcy1ob3ctZmlyZS10di1pcy1yZWltYWdpbmluZy10aGUtbGFyZ2VzdC1zY3JlZW4taW4teW91ci1ob21l0gEA?oc=5&hl=en-MY&gl=MY&ceid=MY:en,"{'href': 'https://www.aboutamazon.com', 'title': 'About Amazon'}",AMZN
18,18,Looking Back at Amazon's (AMZN) Missed NYC HQ2 - Investopedia,Looking Back at Amazon's (AMZN) Missed NYC HQ2  Investopedia,"Tue, 24 Aug 2021 07:00:00 GMT",https://news.google.com/rss/articles/CBMiUWh0dHBzOi8vd3d3LmludmVzdG9wZWRpYS5jb20vbG9va2luZy1iYWNrLWF0LWFtYXpvbi1zLWFtem4tbWlzc2VkLW55Yy1ocTItNTE5ODYzONIBAA?oc=5&hl=en-MY&gl=MY&ceid=MY:en,"{'href': 'https://www.investopedia.com', 'title': 'Investopedia'}",AMZN
19,19,AMZN Stock Price Predictions: What Will Amazon Be Worth in 2025? 2030? - Yahoo Finance,AMZN Stock Price Predictions: What Will Amazon Be Worth in 2025? 2030?  Yahoo Finance,"Fri, 30 Jul 2021 07:00:00 GMT",https://news.google.com/rss/articles/CBMiUWh0dHBzOi8vZmluYW5jZS55YWhvby5jb20vbmV3cy9hbXpuLXN0b2NrLXByaWNlLXByZWRpY3Rpb25zLWFtYXpvbi0xNDM3MTE2ODguaHRtbNIBAA?oc=5&hl=en-MY&gl=MY&ceid=MY:en,"{'href': 'https://finance.yahoo.com', 'title': 'Yahoo Finance'}",AMZN
20,20,"Investing, creating jobs, and contributing to the American economy - About Amazon","Investing, creating jobs, and contributing to the American economy  About Amazon","Wed, 11 Aug 2021 07:00:00 GMT",https://news.google.com/rss/articles/CBMifWh0dHBzOi8vd3d3LmFib3V0YW1hem9uLmNvbS9uZXdzL2pvYi1jcmVhdGlvbi1hbmQtaW52ZXN0bWVudC9pbnZlc3RpbmctY3JlYXRpbmctam9icy1hbmQtY29udHJpYnV0aW5nLXRvLXRoZS1hbWVyaWNhbi1lY29ub2150gEA?oc=5&hl=en-MY&gl=MY&ceid=MY:en,"{'href': 'https://www.aboutamazon.com', 'title': 'About Amazon'}",AMZN
21,21,NSA Awards Secret $10 Billion Contract to Amazon - Nextgov/FCW,NSA Awards Secret $10 Billion Contract to Amazon  Nextgov/FCW,"Tue, 10 Aug 2021 07:00:00 GMT",https://news.google.com/rss/articles/CBMiYmh0dHBzOi8vd3d3Lm5leHRnb3YuY29tL21vZGVybml6YXRpb24vMjAyMS8wOC9uc2EtYXdhcmRzLXNlY3JldC0xMC1iaWxsaW9uLWNvbnRyYWN0LWFtYXpvbi8xODQzOTAv0gEA?oc=5&hl=en-MY&gl=MY&ceid=MY:en,"{'href': 'https://www.nextgov.com', 'title': 'Nextgov/FCW'}",AMZN
22,22,Amazon EC2 – 15 Years of Optimizing and Saving Your IT Costs | Amazon Web Services - AWS Blog,Amazon EC2 – 15 Years of Optimizing and Saving Your IT Costs | Amazon Web Services  AWS Blog,"Tue, 17 Aug 2021 07:00:00 GMT",https://news.google.com/rss/articles/CBMid2h0dHBzOi8vYXdzLmFtYXpvbi5jb20vYmxvZ3MvYXdzLWNsb3VkLWZpbmFuY2lhbC1tYW5hZ2VtZW50L2FtYXpvbi1lYzItMTUteWVhcnMtb2Ytb3B0aW1pemluZy1hbmQtc2F2aW5nLXlvdXItaXQtY29zdHMv0gEA?oc=5&hl=en-MY&gl=MY&ceid=MY:en,"{'href': 'https://aws.amazon.com', 'title': 'AWS Blog'}",AMZN
23,23,"Amazon (AMZN) Cracks Down on Fake Reviews, Hitting Chinese Retailers - Bloomberg","Amazon (AMZN) Cracks Down on Fake Reviews, Hitting Chinese Retailers  Bloomberg","Wed, 18 Aug 2021 07:00:00 GMT",https://news.google.com/rss/articles/CBMidGh0dHBzOi8vd3d3LmJsb29tYmVyZy5jb20vbmV3cy9hcnRpY2xlcy8yMDIxLTA4LTE4L2FtYXpvbi1hbXpuLWNyYWNrcy1kb3duLW9uLWZha2UtcmV2aWV3cy1oaXR0aW5nLWNoaW5lc2UtcmV0YWlsZXJz0gEA?oc=5&hl=en-MY&gl=MY&ceid=MY:en,"{'href': 'https://www.bloomberg.com', 'title': 'Bloomberg'}",AMZN
24,24,Happy 15th Birthday Amazon EC2 - AWS Blog,Happy 15th Birthday Amazon EC2  AWS Blog,"Mon, 23 Aug 2021 07:00:00 GMT",https://news.google.com/rss/articles/CBMiQGh0dHBzOi8vYXdzLmFtYXpvbi5jb20vYmxvZ3MvYXdzL2hhcHB5LTE1dGgtYmlydGhkYXktYW1hem9uLWVjMi_SAQA?oc=5&hl=en-MY&gl=MY&ceid=MY:en,"{'href': 'https://aws.amazon.com', 'title': 'AWS Blog'}",AMZN
25,25,Amazon.com (NASDAQ:AMZN) is Slowly Converting to a Mature Company with an Emphasis on Cash-Flows and ... - Yahoo Finance,Amazon.com (NASDAQ:AMZN) is Slowly Converting to a Mature Company with an Emphasis on Cash-Flows and ...  Yahoo Finance,"Mon, 23 Aug 2021 07:00:00 GMT",https://news.google.com/rss/articles/CBMiS2h0dHBzOi8vZmluYW5jZS55YWhvby5jb20vbmV3cy9hbWF6b24tY29tLW5hc2RhcS1hbXpuLXNsb3dseS0yMDQwNTUwODEuaHRtbNIBAA?oc=5&hl=en-MY&gl=MY&ceid=MY:en,"{'href': 'https://finance.yahoo.com', 'title': 'Yahoo Finance'}",AMZN
26,26,Banking on Amazon Destruction - Amazon Watch,Banking on Amazon Destruction  Amazon Watch,"Thu, 08 Jul 2021 07:00:00 GMT",https://news.google.com/rss/articles/CBMiRGh0dHBzOi8vYW1hem9ud2F0Y2gub3JnL25ld3MvMjAyMS8wNzA4LWJhbmtpbmctb24tYW1hem9uLWRlc3RydWN0aW9u0gEA?oc=5&hl=en-MY&gl=MY&ceid=MY:en,"{'href': 'https://amazonwatch.org', 'title': 'Amazon Watch'}",AMZN
27,27,Study Shows Impacts of Deforestation and Forest Burning on Amazon Biodiversity - University of Arizona News,Study Shows Impacts of Deforestation and Forest Burning on Amazon Biodiversity  University of Arizona News,"Wed, 01 Sep 2021 07:00:00 GMT",https://news.google.com/rss/articles/CBMiZmh0dHBzOi8vbmV3cy5hcml6b25hLmVkdS9uZXdzL3N0dWR5LXNob3dzLWltcGFjdHMtZGVmb3Jlc3RhdGlvbi1hbmQtZm9yZXN0LWJ1cm5pbmctYW1hem9uLWJpb2RpdmVyc2l0edIBAA?oc=5&hl=en-MY&gl=MY&ceid=MY:en,"{'href': 'https://news.arizona.edu', 'title': 'University of Arizona News'}",AMZN
28,28,Amazon Care may be coming to another 20 U.S. cities: report - Fierce healthcare,Amazon Care may be coming to another 20 U.S. cities: report  Fierce healthcare,"Wed, 08 Sep 2021 07:00:00 GMT",https://news.google.com/rss/articles/CBMiX2h0dHBzOi8vd3d3LmZpZXJjZWhlYWx0aGNhcmUuY29tL3RlY2gvYW1hem9uLWNhcmUtbWF5LWJlLWNvbWluZy10by1hbm90aGVyLTIwLXUtcy1jaXRpZXMtcmVwb3J00gEA?oc=5&hl=en-MY&gl=MY&ceid=MY:en,"{'href': 'https://www.fiercehealthcare.com', 'title': 'Fierce healthcare'}",AMZN
29,29,Announcing Amazon OpenSearch Service which Supports OpenSearch 1.0 - AWS Blog,Announcing Amazon OpenSearch Service which Supports OpenSearch 1.0  AWS Blog,"Wed, 08 Sep 2021 07:00:00 GMT",https://news.google.com/rss/articles/CBMiY2h0dHBzOi8vYXdzLmFtYXpvbi5jb20vYmxvZ3MvYXdzL2Fubm91bmNpbmctYW1hem9uLW9wZW5zZWFyY2gtc2VydmljZS13aGljaC1zdXBwb3J0cy1vcGVuc2VhcmNoLTEwL9IBAA?oc=5&hl=en-MY&gl=MY&ceid=MY:en,"{'href': 'https://aws.amazon.com', 'title': 'AWS Blog'}",AMZN
30,30,Amazon Stock Loses $130 Billion In Market Value After $885 Million Fine And Disappointing Earnings Report - Forbes,Amazon Stock Loses $130 Billion In Market Value After $885 Million Fine And Disappointing Earnings Report  Forbes,"Fri, 30 Jul 2021 07:00:00 GMT",https://news.google.com/rss/articles/CBMimgFodHRwczovL3d3dy5mb3JiZXMuY29tL3NpdGVzL2pvbmF0aGFucG9uY2lhbm8vMjAyMS8wNy8zMC9hbWF6b24tc3RvY2stbG9zZXMtMTMwLWJpbGxpb24taW4tbWFya2V0LXZhbHVlLWFmdGVyLTg4NS1taWxsaW9uLWZpbmUtYW5kLWRpc21hbC1lYXJuaW5ncy1yZXBvcnQv0gEA?oc=5&hl=en-MY&gl=MY&ceid=MY:en,"{'href': 'https://www.forbes.com', 'title': 'Forbes'}",AMZN
31,31,New – Amazon EFS Intelligent-Tiering Optimizes Costs for Workloads with Changing Access Patterns | Amazon Web ... - AWS Blog,New – Amazon EFS Intelligent-Tiering Optimizes Costs for Workloads with Changing Access Patterns | Amazon Web ...  AWS Blog,"Thu, 02 Sep 2021 07:00:00 GMT",https://news.google.com/rss/articles/CBMigAFodHRwczovL2F3cy5hbWF6b24uY29tL2Jsb2dzL2F3cy9uZXctYW1hem9uLWVmcy1pbnRlbGxpZ2VudC10aWVyaW5nLW9wdGltaXplcy1jb3N0cy1mb3Itd29ya2xvYWRzLXdpdGgtY2hhbmdpbmctYWNjZXNzLXBhdHRlcm5zL9IBAA?oc=5&hl=en-MY&gl=MY&ceid=MY:en,"{'href': 'https://aws.amazon.com', 'title': 'AWS Blog'}",AMZN
32,32,Restore the Amazon? Small Farmers Are Key - The Nature Conservancy,Restore the Amazon? Small Farmers Are Key  The Nature Conservancy,"Tue, 31 Aug 2021 07:00:00 GMT",https://news.google.com/rss/articles/CBMiY2h0dHBzOi8vd3d3Lm5hdHVyZS5vcmcvZW4tdXMvd2hhdC13ZS1kby9vdXItaW5zaWdodHMvcGVyc3BlY3RpdmVzL3Jlc3RvcmUtdGhlLWFtYXpvbi1zbWFsbC1mYXJtZXJzL9IBAA?oc=5&hl=en-MY&gl=MY&ceid=MY:en,"{'href': 'https://www.nature.org', 'title': 'The Nature Conservancy'}",AMZN
33,33,Amazon Community Lending pilot program to fuel small business growth - About Amazon,Amazon Community Lending pilot program to fuel small business growth  About Amazon,"Tue, 21 Sep 2021 07:00:00 GMT",https://news.google.com/rss/articles/CBMidGh0dHBzOi8vd3d3LmFib3V0YW1hem9uLmNvbS9uZXdzL3NtYWxsLWJ1c2luZXNzL2FtYXpvbi1jb21tdW5pdHktbGVuZGluZy1waWxvdC1wcm9ncmFtLXRvLWZ1ZWwtc21hbGwtYnVzaW5lc3MtZ3Jvd3Ro0gEA?oc=5&hl=en-MY&gl=MY&ceid=MY:en,"{'href': 'https://www.aboutamazon.com', 'title': 'About Amazon'}",AMZN
34,34,Fires may have affected up to 85 percent of threatened Amazon species - Science News Magazine,Fires may have affected up to 85 percent of threatened Amazon species  Science News Magazine,"Wed, 01 Sep 2021 07:00:00 GMT",https://news.google.com/rss/articles/CBMiaGh0dHBzOi8vd3d3LnNjaWVuY2VuZXdzLm9yZy9hcnRpY2xlL2ZpcmUtYW1hem9uLXJhaW5mb3Jlc3QtdGhyZWF0ZW5lZC1zcGVjaWVzLWRlZm9yZXN0YXRpb24tYmlvZGl2ZXJzaXR50gEA?oc=5&hl=en-MY&gl=MY&ceid=MY:en,"{'href': 'https://www.sciencenews.org', 'title': 'Science News Magazine'}",AMZN
35,35,Amazon EKS Anywhere – Now Generally Available to Create and Manage Kubernetes Clusters on Premises | Amazon ... - AWS Blog,Amazon EKS Anywhere – Now Generally Available to Create and Manage Kubernetes Clusters on Premises | Amazon ...  AWS Blog,"Wed, 08 Sep 2021 07:00:00 GMT",https://news.google.com/rss/articles/CBMiggFodHRwczovL2F3cy5hbWF6b24uY29tL2Jsb2dzL2F3cy9hbWF6b24tZWtzLWFueXdoZXJlLW5vdy1nZW5lcmFsbHktYXZhaWxhYmxlLXRvLWNyZWF0ZS1hbmQtbWFuYWdlLWt1YmVybmV0ZXMtY2x1c3RlcnMtb24tcHJlbWlzZXMv0gEA?oc=5&hl=en-MY&gl=MY&ceid=MY:en,"{'href': 'https://aws.amazon.com', 'title': 'AWS Blog'}",AMZN
36,36,"New for Amazon Connect: Voice ID, Wisdom, and Outbound Communications | Amazon Web Services - AWS Blog","New for Amazon Connect: Voice ID, Wisdom, and Outbound Communications | Amazon Web Services  AWS Blog","Mon, 27 Sep 2021 07:00:00 GMT",https://news.google.com/rss/articles/CBMiS2h0dHBzOi8vYXdzLmFtYXpvbi5jb20vYmxvZ3MvYXdzL3RocmVlLW5ldy1jYXBhYmlsaXRpZXMtZm9yLWFtYXpvbi1jb25uZWN0L9IBAA?oc=5&hl=en-MY&gl=MY&ceid=MY:en,"{'href': 'https://aws.amazon.com', 'title': 'AWS Blog'}",AMZN
37,37,"Introducing Amazon Redshift Query Editor V2, a Free Web-based Query Authoring Tool for Data Analysts | Amazon ... - AWS Blog","Introducing Amazon Redshift Query Editor V2, a Free Web-based Query Authoring Tool for Data Analysts | Amazon ...  AWS Blog","Wed, 29 Sep 2021 07:00:00 GMT",https://news.google.com/rss/articles/CBMiVWh0dHBzOi8vYXdzLmFtYXpvbi5jb20vYmxvZ3MvYXdzL2FtYXpvbi1yZWRzaGlmdC1xdWVyeS1lZGl0b3ItdjItd2ViLXF1ZXJ5LWF1dGhvcmluZy_SAQA?oc=5&hl=en-MY&gl=MY&ceid=MY:en,"{'href': 'https://aws.amazon.com', 'title': 'AWS Blog'}",AMZN
38,38,'The Next Amazon': 10 Undervalued Ecommerce Stocks with Huge Upside - Yahoo Finance,'The Next Amazon': 10 Undervalued Ecommerce Stocks with Huge Upside  Yahoo Finance,"Thu, 19 Aug 2021 07:00:00 GMT",https://news.google.com/rss/articles/CBMiUmh0dHBzOi8vZmluYW5jZS55YWhvby5jb20vbmV3cy9uZXh0LWFtYXpvbi0xMC11bmRlcnZhbHVlZC1lY29tbWVyY2UtMjAxOTA0NDUxLmh0bWzSAQA?oc=5&hl=en-MY&gl=MY&ceid=MY:en,"{'href': 'https://finance.yahoo.com', 'title': 'Yahoo Finance'}",AMZN
39,39,Amazon Air Launches Cargo Service at Nashville International Airport® - the Nashville International Airport,Amazon Air Launches Cargo Service at Nashville International Airport®  the Nashville International Airport,"Fri, 03 Sep 2021 07:00:00 GMT",https://news.google.com/rss/articles/CBMiYmh0dHBzOi8vZmx5bmFzaHZpbGxlLmNvbS9uZXdzL2FtYXpvbi1haXItbGF1bmNoZXMtY2FyZ28tc2VydmljZS1hdC1uYXNodmlsbGUtaW50ZXJuYXRpb25hbC1haXJwb3J00gEA?oc=5&hl=en-MY&gl=MY&ceid=MY:en,"{'href': 'https://flynashville.com', 'title': 'the Nashville International Airport'}",AMZN
40,40,Amazon Managed Grafana Is Now Generally Available with Many New Features | Amazon Web Services - AWS Blog,Amazon Managed Grafana Is Now Generally Available with Many New Features | Amazon Web Services  AWS Blog,"Tue, 31 Aug 2021 07:00:00 GMT",https://news.google.com/rss/articles/CBMiamh0dHBzOi8vYXdzLmFtYXpvbi5jb20vYmxvZ3MvYXdzL2FtYXpvbi1tYW5hZ2VkLWdyYWZhbmEtaXMtbm93LWdlbmVyYWxseS1hdmFpbGFibGUtd2l0aC1tYW55LW5ldy1mZWF0dXJlcy_SAQA?oc=5&hl=en-MY&gl=MY&ceid=MY:en,"{'href': 'https://aws.amazon.com', 'title': 'AWS Blog'}",AMZN
41,41,Executive Constantine announces Amazon contribution that will help King County Parks add iconic Wilburton Trestle to ... - King County,Executive Constantine announces Amazon contribution that will help King County Parks add iconic Wilburton Trestle to ...  King County,"Mon, 20 Sep 2021 07:00:00 GMT",https://news.google.com/rss/articles/CBMicWh0dHBzOi8vd3d3Lmtpbmdjb3VudHkuZ292L2VuL2xlZ2FjeS9lbGVjdGVkL2V4ZWN1dGl2ZS9jb25zdGFudGluZS9uZXdzL3JlbGVhc2UvMjAyMS9zZXB0ZW1iZXIvMjAtZWFzdHJhaWwtYW1hem9u0gEA?oc=5&hl=en-MY&gl=MY&ceid=MY:en,"{'href': 'https://www.kingcounty.gov', 'title': 'King County'}",AMZN
42,42,AMZN Stock Will Underperform Over the Next Decade. Here's Why - InvestorPlace,AMZN Stock Will Underperform Over the Next Decade. Here's Why  InvestorPlace,"Tue, 21 Sep 2021 07:00:00 GMT",https://news.google.com/rss/articles/CBMiXmh0dHBzOi8vaW52ZXN0b3JwbGFjZS5jb20vMjAyMS8wOS9hbXpuLXN0b2NrLXdpbGwtdW5kZXJwZXJmb3JtLW92ZXItdGhlLW5leHQtZGVjYWRlLWhlcmVzLXdoeS_SAQA?oc=5&hl=en-MY&gl=MY&ceid=MY:en,"{'href': 'https://investorplace.com', 'title': 'InvestorPlace'}",AMZN
43,43,This is Amazon - Tiffany - About Amazon,This is Amazon - Tiffany  About Amazon,"Fri, 02 Jul 2021 09:31:04 GMT",https://news.google.com/rss/articles/CBMiMWh0dHBzOi8vd3d3LmFib3V0YW1hem9uLmNvbS90aGlzaXNhbWF6b24vdGlmZmFueWrSAQA?oc=5&hl=en-MY&gl=MY&ceid=MY:en,"{'href': 'https://www.aboutamazon.com', 'title': 'About Amazon'}",AMZN
44,44,"Amazon will hire 100,000 veterans and military spouses by 2024 - About Amazon","Amazon will hire 100,000 veterans and military spouses by 2024  About Amazon","Tue, 13 Jul 2021 07:00:00 GMT",https://news.google.com/rss/articles/CBMiaWh0dHBzOi8vd3d3LmFib3V0YW1hem9uLmNvbS9uZXdzL3dvcmtwbGFjZS9hbWF6b24td2lsbC1oaXJlLTEwMC0wMDAtdmV0ZXJhbnMtYW5kLW1pbGl0YXJ5LXNwb3VzZXMtYnktMjAyNNIBAA?oc=5&hl=en-MY&gl=MY&ceid=MY:en,"{'href': 'https://www.aboutamazon.com', 'title': 'About Amazon'}",AMZN
45,45,Announcing Amazon MemoryDB for Redis - AWS Blog,Announcing Amazon MemoryDB for Redis  AWS Blog,"Thu, 19 Aug 2021 07:00:00 GMT",https://news.google.com/rss/articles/CBMiSWh0dHBzOi8vYXdzLmFtYXpvbi5jb20vYWJvdXQtYXdzL3doYXRzLW5ldy8yMDIxLzA4L2FtYXpvbi1tZW1vcnlkYi1yZWRpcy_SAQA?oc=5&hl=en-MY&gl=MY&ceid=MY:en,"{'href': 'https://aws.amazon.com', 'title': 'AWS Blog'}",AMZN
46,46,New – Amazon EC2 M6i Instances Powered by the Latest-Generation Intel Xeon Scalable Processors | Amazon Web ... - AWS Blog,New – Amazon EC2 M6i Instances Powered by the Latest-Generation Intel Xeon Scalable Processors | Amazon Web ...  AWS Blog,"Mon, 16 Aug 2021 07:00:00 GMT",https://news.google.com/rss/articles/CBMifmh0dHBzOi8vYXdzLmFtYXpvbi5jb20vYmxvZ3MvYXdzL25ldy1hbWF6b24tZWMyLW02aS1pbnN0YW5jZXMtcG93ZXJlZC1ieS10aGUtbGF0ZXN0LWdlbmVyYXRpb24taW50ZWwteGVvbi1zY2FsYWJsZS1wcm9jZXNzb3JzL9IBAA?oc=5&hl=en-MY&gl=MY&ceid=MY:en,"{'href': 'https://aws.amazon.com', 'title': 'AWS Blog'}",AMZN
47,47,Organizing Amazon Is Do-or-Die for the Labor Movement - Jacobin magazine,Organizing Amazon Is Do-or-Die for the Labor Movement  Jacobin magazine,"Wed, 29 Sep 2021 07:00:00 GMT",https://news.google.com/rss/articles/CBMiaWh0dHBzOi8vamFjb2Jpbi5jb20vMjAyMS8wOS9vcmdhbml6aW5nLWFtYXpvbi11bmlvbi10ZWFtc3RlcnMtbG9naXN0aWNzLXdhcmVob3VzZS1zaGlwcGluZy1sYWJvci1tb3ZlbWVudNIBAA?oc=5&hl=en-MY&gl=MY&ceid=MY:en,"{'href': 'https://jacobin.com', 'title': 'Jacobin magazine'}",AMZN
48,48,Amazon hit with record EU data privacy fine - Reuters,Amazon hit with record EU data privacy fine  Reuters,"Fri, 30 Jul 2021 07:00:00 GMT",https://news.google.com/rss/articles/CBMibWh0dHBzOi8vd3d3LnJldXRlcnMuY29tL2J1c2luZXNzL3JldGFpbC1jb25zdW1lci9hbWF6b24taGl0LXdpdGgtODg2LW1pbGxpb24tZXUtZGF0YS1wcml2YWN5LWZpbmUtMjAyMS0wNy0zMC_SAQA?oc=5&hl=en-MY&gl=MY&ceid=MY:en,"{'href': 'https://www.reuters.com', 'title': 'Reuters'}",AMZN
49,49,'Prime Changes Everything' reimagines happily ever after - About Amazon,'Prime Changes Everything' reimagines happily ever after  About Amazon,"Mon, 02 Aug 2021 07:00:00 GMT",https://news.google.com/rss/articles/CBMiZGh0dHBzOi8vd3d3LmFib3V0YW1hem9uLmNvbS9uZXdzL2FtYXpvbi1wcmltZS9wcmltZS1jaGFuZ2VzLWV2ZXJ5dGhpbmctcmVpbWFnaW5lcy1oYXBwaWx5LWV2ZXItYWZ0ZXLSAQA?oc=5&hl=en-MY&gl=MY&ceid=MY:en,"{'href': 'https://www.aboutamazon.com', 'title': 'About Amazon'}",AMZN
50,50,SCAM ALERT: Sheriff's Office warns about 'Amazon scam' - Clackamas County,SCAM ALERT: Sheriff's Office warns about 'Amazon scam'  Clackamas County,"Mon, 19 Jul 2021 07:00:00 GMT",https://news.google.com/rss/articles/CBMiR2h0dHBzOi8vd3d3LmNsYWNrYW1hcy51cy9zaGVyaWZmLzIwMjEtMDctMTktQ0NTT1BSLUFtYXpvblNjYW1BbGVydC5odG1s0gEA?oc=5&hl=en-MY&gl=MY&ceid=MY:en,"{'href': 'https://www.clackamas.us', 'title': 'Clackamas County'}",AMZN
51,51,Scaling Ad Verification with Machine Learning and AWS Inferentia | Amazon Web Services - AWS Blog,Scaling Ad Verification with Machine Learning and AWS Inferentia | Amazon Web Services  AWS Blog,"Wed, 22 Sep 2021 07:00:00 GMT",https://news.google.com/rss/articles/CBMiYmh0dHBzOi8vYXdzLmFtYXpvbi5jb20vYmxvZ3MvYXdzL3NjYWxpbmctYWQtdmVyaWZpY2F0aW9uLXdpdGgtbWFjaGluZS1sZWFybmluZy1hbmQtYXdzLWluZmVyZW50aWEv0gEA?oc=5&hl=en-MY&gl=MY&ceid=MY:en,"{'href': 'https://aws.amazon.com', 'title': 'AWS Blog'}",AMZN
52,52,Amazon updates return-to-office guidance - About Amazon,Amazon updates return-to-office guidance  About Amazon,"Thu, 05 Aug 2021 07:00:00 GMT",https://news.google.com/rss/articles/CBMiU2h0dHBzOi8vd3d3LmFib3V0YW1hem9uLmNvbS9uZXdzL3dvcmtwbGFjZS9hbWF6b24tdXBkYXRlcy1yZXR1cm4tdG8tb2ZmaWNlLWd1aWRhbmNl0gEA?oc=5&hl=en-MY&gl=MY&ceid=MY:en,"{'href': 'https://www.aboutamazon.com', 'title': 'About Amazon'}",AMZN
