Unnamed: 0,Unnamed: 0.1,title,description,published date,url,publisher,company,Unnamed: 0.1.1
6,6,Tesla Stock is Today's Top Performer in the S&P 500 and Nasdaq 100 - TheStreet,Tesla Stock is Today's Top Performer in the S&P 500 and Nasdaq 100  TheStreet,"Wed, 23 Jun 2021 07:00:00 GMT",https://news.google.com/rss/articles/CBMiZmh0dHBzOi8vd3d3LnRoZXN0cmVldC5jb20vdGVzbGEvbmV3cy90ZXNsYS1zdG9jay1pcy10b2RheXMtdG9wLXBlcmZvcm1lci1pbi10aGUtcy1wLTUwMC1hbmQtbmFzZGFxLTEwMNIBAA?oc=5&hl=en-MY&gl=MY&ceid=MY:en,"{'href': 'https://www.thestreet.com', 'title': 'TheStreet'}",TSLA,6.0
7,7,Infographic: Tesla (TSLA) Q1 earnings jump on strong sales; beat Street view - AlphaStreet,Infographic: Tesla (TSLA) Q1 earnings jump on strong sales; beat Street view  AlphaStreet,"Mon, 26 Apr 2021 07:00:00 GMT",https://news.google.com/rss/articles/CBMiZmh0dHBzOi8vbmV3cy5hbHBoYXN0cmVldC5jb20vaW5mb2dyYXBoaWMtdGVzbGEtdHNsYS1xMS1lYXJuaW5ncy1qdW1wLW9uLXN0cm9uZy1zYWxlcy1iZWF0LXN0cmVldC12aWV3L9IBAA?oc=5&hl=en-MY&gl=MY&ceid=MY:en,"{'href': 'https://news.alphastreet.com', 'title': 'AlphaStreet'}",TSLA,7.0
8,8,Tesla (TSLA) vs. Nikola (NKLA) vs. Workhorse (WKHS): Which is the Best Electric Vehicle Stock Today? - Cabot Wealth Network,Tesla (TSLA) vs. Nikola (NKLA) vs. Workhorse (WKHS): Which is the Best Electric Vehicle Stock Today?  Cabot Wealth Network,"Fri, 28 May 2021 07:00:00 GMT",https://news.google.com/rss/articles/CBMid2h0dHBzOi8vd3d3LmNhYm90d2VhbHRoLmNvbS9kYWlseS9ncm93dGgtc3RvY2tzL3Rlc2xhLXRzbGEtbmlrb2xhLW5rbGEtd29ya2hvcnNlLXdraHMtYmVzdC1lbGVjdHJpYy12ZWhpY2xlLXN0b2NrLXRvZGF50gEA?oc=5&hl=en-MY&gl=MY&ceid=MY:en,"{'href': 'https://www.cabotwealth.com', 'title': 'Cabot Wealth Network'}",TSLA,8.0
9,9,Tesla battery supplier Panasonic sold its entire TSLA stake for an insane profit - Electrek,Tesla battery supplier Panasonic sold its entire TSLA stake for an insane profit  Electrek,"Fri, 25 Jun 2021 07:00:00 GMT",https://news.google.com/rss/articles/CBMiV2h0dHBzOi8vZWxlY3RyZWsuY28vMjAyMS8wNi8yNS90ZXNsYS1iYXR0ZXJ5LXN1cHBsaWVyLXBhbmFzb25pYy1zb2xkLWVudGlyZS10c2xhLXN0YWtlL9IBAA?oc=5&hl=en-MY&gl=MY&ceid=MY:en,"{'href': 'https://electrek.co', 'title': 'Electrek'}",TSLA,9.0
10,10,Forget Tesla's Cars. The Real Money May Lie in Tesla's Battery Business - Yahoo Finance,Forget Tesla's Cars. The Real Money May Lie in Tesla's Battery Business  Yahoo Finance,"Tue, 13 Apr 2021 07:00:00 GMT",https://news.google.com/rss/articles/CBMiSmh0dHBzOi8vZmluYW5jZS55YWhvby5jb20vbmV3cy9mb3JnZXQtdGVzbGEtY2Fycy1yZWFsLW1vbmV5LTE3NTkxMTMxMC5odG1s0gEA?oc=5&hl=en-MY&gl=MY&ceid=MY:en,"{'href': 'https://finance.yahoo.com', 'title': 'Yahoo Finance'}",TSLA,10.0
11,11,Tesla (TSLA) Stock Price and Forecast: Tesla edges higher to $635 resistance - FXStreet,Tesla (TSLA) Stock Price and Forecast: Tesla edges higher to $635 resistance  FXStreet,"Thu, 24 Jun 2021 07:00:00 GMT",https://news.google.com/rss/articles/CBMic2h0dHBzOi8vd3d3LmZ4c3RyZWV0LmNvbS9uZXdzL3Rlc2xhLXRzbGEtc3RvY2stcHJpY2UtYW5kLWZvcmVjYXN0LXRlc2xhLWVkZ2VzLWhpZ2hlci10by02MzUtcmVzaXN0YW5jZS0yMDIxMDYyMzEwMDHSAXdodHRwczovL3d3dy5meHN0cmVldC5jb20vYW1wL25ld3MvdGVzbGEtdHNsYS1zdG9jay1wcmljZS1hbmQtZm9yZWNhc3QtdGVzbGEtZWRnZXMtaGlnaGVyLXRvLTYzNS1yZXNpc3RhbmNlLTIwMjEwNjIzMTAwMQ?oc=5&hl=en-MY&gl=MY&ceid=MY:en,"{'href': 'https://www.fxstreet.com', 'title': 'FXStreet'}",TSLA,11.0
12,12,Tesla shares scooped up by AI-powered fund with exceptional track record - TESLARATI,Tesla shares scooped up by AI-powered fund with exceptional track record  TESLARATI,"Mon, 17 May 2021 07:00:00 GMT",https://news.google.com/rss/articles/CBMiWWh0dHBzOi8vd3d3LnRlc2xhcmF0aS5jb20vdGVzbGEtdHNsYS1zaGFyZXMtc2Nvb3BlZC1ieS1hcnRpZmljaWFsLWludGVsbGlnZW5jZS1mdW5kLWFtb20v0gFdaHR0cHM6Ly93d3cudGVzbGFyYXRpLmNvbS90ZXNsYS10c2xhLXNoYXJlcy1zY29vcGVkLWJ5LWFydGlmaWNpYWwtaW50ZWxsaWdlbmNlLWZ1bmQtYW1vbS9hbXAv?oc=5&hl=en-MY&gl=MY&ceid=MY:en,"{'href': 'https://www.teslarati.com', 'title': 'TESLARATI'}",TSLA,12.0
13,13,TSLA: 2 Electric Vehicle Stocks that Plunged More than 7% Last Week - StockNews.com,TSLA: 2 Electric Vehicle Stocks that Plunged More than 7% Last Week  StockNews.com,"Mon, 17 May 2021 07:00:00 GMT",https://news.google.com/rss/articles/CBMiXGh0dHBzOi8vc3RvY2tuZXdzLmNvbS9uZXdzL3RzbGEtbmlvLTItZWxlY3RyaWMtdmVoaWNsZS1zdG9ja3MtdGhhdC1wbHVuZ2VkLW1vcmUtdGhhbi03LWxhc3Qv0gEA?oc=5&hl=en-MY&gl=MY&ceid=MY:en,"{'href': 'https://stocknews.com', 'title': 'StockNews.com'}",TSLA,13.0
14,14,GM vs. TSLA: Which Stock Is the Better Value Option? - Yahoo Singapore News,GM vs. TSLA: Which Stock Is the Better Value Option?  Yahoo Singapore News,"Wed, 16 Jun 2021 07:00:00 GMT",https://news.google.com/rss/articles/CBMiTWh0dHBzOi8vc2cubmV3cy55YWhvby5jb20vZmluYW5jZS9uZXdzL2dtLXZzLXRzbGEtc3RvY2stYmV0dGVyLTE1NDAwMzEwNC5odG1s0gEA?oc=5&hl=en-MY&gl=MY&ceid=MY:en,"{'href': 'https://sg.news.yahoo.com', 'title': 'Yahoo Singapore News'}",TSLA,14.0
15,15,"Tesla (TSLA) Q1 2021 earnings results: $10.39B in revenue, beats with $0.93 EPS - TESLARATI","Tesla (TSLA) Q1 2021 earnings results: $10.39B in revenue, beats with $0.93 EPS  TESLARATI","Mon, 26 Apr 2021 07:00:00 GMT",https://news.google.com/rss/articles/CBMiPmh0dHBzOi8vd3d3LnRlc2xhcmF0aS5jb20vdGVzbGEtdHNsYS1xMS0yMDIxLWVhcm5pbmdzLXJlc3VsdHMv0gFCaHR0cHM6Ly93d3cudGVzbGFyYXRpLmNvbS90ZXNsYS10c2xhLXExLTIwMjEtZWFybmluZ3MtcmVzdWx0cy9hbXAv?oc=5&hl=en-MY&gl=MY&ceid=MY:en,"{'href': 'https://www.teslarati.com', 'title': 'TESLARATI'}",TSLA,15.0
16,16,Tesla (TSLA) could rally up to $1000 this year if China demand remains strong: report - TESLARATI,Tesla (TSLA) could rally up to $1000 this year if China demand remains strong: report  TESLARATI,"Mon, 10 May 2021 07:00:00 GMT",https://news.google.com/rss/articles/CBMiOGh0dHBzOi8vd3d3LnRlc2xhcmF0aS5jb20vdGVzbGEtdHNsYS1zdG9jay1jaGluYS1kZW1hbmQv0gE8aHR0cHM6Ly93d3cudGVzbGFyYXRpLmNvbS90ZXNsYS10c2xhLXN0b2NrLWNoaW5hLWRlbWFuZC9hbXAv?oc=5&hl=en-MY&gl=MY&ceid=MY:en,"{'href': 'https://www.teslarati.com', 'title': 'TESLARATI'}",TSLA,16.0
17,17,Listen to the Tesla (TSLA) Q1 2021 earnings results conference call here - Shacknews,Listen to the Tesla (TSLA) Q1 2021 earnings results conference call here  Shacknews,"Mon, 26 Apr 2021 07:00:00 GMT",https://news.google.com/rss/articles/CBMib2h0dHBzOi8vd3d3LnNoYWNrbmV3cy5jb20vYXJ0aWNsZS8xMjQwMzkvbGlzdGVuLXRvLXRoZS10ZXNsYS10c2xhLXExLTIwMjEtZWFybmluZ3MtcmVzdWx0cy1jb25mZXJlbmNlLWNhbGwtaGVyZdIBeWh0dHBzOi8vd3d3LnNoYWNrbmV3cy5jb20vYXJ0aWNsZS8xMjQwMzkvbGlzdGVuLXRvLXRoZS10ZXNsYS10c2xhLXExLTIwMjEtZWFybmluZ3MtcmVzdWx0cy1jb25mZXJlbmNlLWNhbGwtaGVyZT9hbXBodG1sPTE?oc=5&hl=en-MY&gl=MY&ceid=MY:en,"{'href': 'https://www.shacknews.com', 'title': 'Shacknews'}",TSLA,17.0
18,18,Crypto exchange Binance launches Tesla (TSLA) token for fractional stock trading - TESLARATI,Crypto exchange Binance launches Tesla (TSLA) token for fractional stock trading  TESLARATI,"Mon, 12 Apr 2021 07:00:00 GMT",https://news.google.com/rss/articles/CBMiOmh0dHBzOi8vd3d3LnRlc2xhcmF0aS5jb20vdGVzbGEtdHNsYS1jcnlwdG8tYmluYW5jZS10b2tlbi_SAT5odHRwczovL3d3dy50ZXNsYXJhdGkuY29tL3Rlc2xhLXRzbGEtY3J5cHRvLWJpbmFuY2UtdG9rZW4vYW1wLw?oc=5&hl=en-MY&gl=MY&ceid=MY:en,"{'href': 'https://www.teslarati.com', 'title': 'TESLARATI'}",TSLA,18.0
19,19,"Elon Musk, Chamath Palihapitiya and Cathie Wood Face a Reddit Reckoning - Bloomberg","Elon Musk, Chamath Palihapitiya and Cathie Wood Face a Reddit Reckoning  Bloomberg","Sun, 16 May 2021 07:00:00 GMT",https://news.google.com/rss/articles/CBMid2h0dHBzOi8vd3d3LmJsb29tYmVyZy5jb20vb3Bpbmlvbi9hcnRpY2xlcy8yMDIxLTA1LTE3L211c2stdHNsYS1wYWxpaGFwaXRpeWEtaXBvZS1hbmQtd29vZC1hcmtrLWZhY2UtYS1yZWRkaXQtcmVja29uaW5n0gEA?oc=5&hl=en-MY&gl=MY&ceid=MY:en,"{'href': 'https://www.bloomberg.com', 'title': 'Bloomberg'}",TSLA,19.0
20,20,Tesla (TSLA) now has crypto stock token by Binance to buy fractional shares - Electrek.co,Tesla (TSLA) now has crypto stock token by Binance to buy fractional shares  Electrek.co,"Mon, 12 Apr 2021 07:00:00 GMT",https://news.google.com/rss/articles/CBMiRWh0dHBzOi8vZWxlY3RyZWsuY28vMjAyMS8wNC8xMi90ZXNsYS10c2xhLWNyeXB0by1zdG9jay10b2tlbi1iaW5hbmNlL9IBAA?oc=5&hl=en-MY&gl=MY&ceid=MY:en,"{'href': 'https://electrek.co', 'title': 'Electrek.co'}",TSLA,20.0
21,21,Could Reddit Traders Turn On Elon Musk And Target Tesla's Stock? - Tesla (NASDAQ:TSLA) - Benzinga,Could Reddit Traders Turn On Elon Musk And Target Tesla's Stock? - Tesla (NASDAQ:TSLA)  Benzinga,"Mon, 17 May 2021 07:00:00 GMT",https://news.google.com/rss/articles/CBMifWh0dHBzOi8vd3d3LmJlbnppbmdhLmNvbS9tYXJrZXRzL2NyeXB0b2N1cnJlbmN5LzIxLzA1LzIxMTUyMTIwL2NvdWxkLXJlZGRpdC10cmFkZXJzLXR1cm4tb24tZWxvbi1tdXNrLWFuZC10YXJnZXQtdGVzbGFzLXN0b2Nr0gEtaHR0cHM6Ly93d3cuYmVuemluZ2EuY29tL2FtcC9jb250ZW50LzIxMTUyMTIw?oc=5&hl=en-MY&gl=MY&ceid=MY:en,"{'href': 'https://www.benzinga.com', 'title': 'Benzinga'}",TSLA,21.0
22,22,"Tesla (TSLA) increases Model 3 and Model Y prices, now start at $40000 - Electrek","Tesla (TSLA) increases Model 3 and Model Y prices, now start at $40000  Electrek","Fri, 21 May 2021 07:00:00 GMT",https://news.google.com/rss/articles/CBMiRWh0dHBzOi8vZWxlY3RyZWsuY28vMjAyMS8wNS8yMS90ZXNsYS10c2xhLWluY3JlYXNlcy1tb2RlbC0zLXktcHJpY2VzL9IBAA?oc=5&hl=en-MY&gl=MY&ceid=MY:en,"{'href': 'https://electrek.co', 'title': 'Electrek'}",TSLA,22.0
23,23,Elon Musk (TSLA head) tweets on Dogecoin - ForexLive,Elon Musk (TSLA head) tweets on Dogecoin  ForexLive,"Tue, 25 May 2021 07:00:00 GMT",https://news.google.com/rss/articles/CBMiWmh0dHBzOi8vd3d3LmZvcmV4bGl2ZS5jb20vQ3J5cHRvY3VycmVuY3kvIS9lbG9uLW11c2stdHNsYS1oZWFkLXR3ZWV0cy1vbi1kb2dlY29pbi0yMDIxMDUyNdIBX2h0dHBzOi8vd3d3LmZvcmV4bGl2ZS5jb20vY3J5cHRvY3VycmVuY3kvIS9lbG9uLW11c2stdHNsYS1oZWFkLXR3ZWV0cy1vbi1kb2dlY29pbi0yMDIxMDUyNS9hbXAv?oc=5&hl=en-MY&gl=MY&ceid=MY:en,"{'href': 'https://www.forexlive.com', 'title': 'ForexLive'}",TSLA,23.0
24,24,"Will Tesla, Bitcoin Or Dogecoin Grow More By 2022? - Tesla (NASDAQ:TSLA) - Benzinga","Will Tesla, Bitcoin Or Dogecoin Grow More By 2022? - Tesla (NASDAQ:TSLA)  Benzinga","Wed, 21 Apr 2021 07:00:00 GMT",https://news.google.com/rss/articles/CBMib2h0dHBzOi8vd3d3LmJlbnppbmdhLmNvbS9tYXJrZXRzL2NyeXB0b2N1cnJlbmN5LzIxLzA0LzIwNzI1NzMzL3dpbGwtdGVzbGEtYml0Y29pbi1vci1kb2dlY29pbi1ncm93LW1vcmUtYnktMjAyMtIBLWh0dHBzOi8vd3d3LmJlbnppbmdhLmNvbS9hbXAvY29udGVudC8yMDcyNTczMw?oc=5&hl=en-MY&gl=MY&ceid=MY:en,"{'href': 'https://www.benzinga.com', 'title': 'Benzinga'}",TSLA,24.0
25,25,"Bitcoin continues to fall, fingers point at Musk tweet (implying TSLA has BTC to sell, or has sold) - ForexLive","Bitcoin continues to fall, fingers point at Musk tweet (implying TSLA has BTC to sell, or has sold)  ForexLive","Sun, 16 May 2021 07:00:00 GMT",https://news.google.com/rss/articles/CBMigQFodHRwczovL3d3dy5mb3JleGxpdmUuY29tL0NyeXB0b2N1cnJlbmN5LyEvYml0Y29pbi1jb250aW51ZXMtdG8tZmFsbG11c2stdHdlZXQtaW1wbHlpbmctdHNsYS1oYXMtYnRjLXRvLXNlbGwtb3ItaGFzLXNvbGQtMjAyMTA1MTbSAYYBaHR0cHM6Ly93d3cuZm9yZXhsaXZlLmNvbS9jcnlwdG9jdXJyZW5jeS8hL2JpdGNvaW4tY29udGludWVzLXRvLWZhbGxtdXNrLXR3ZWV0LWltcGx5aW5nLXRzbGEtaGFzLWJ0Yy10by1zZWxsLW9yLWhhcy1zb2xkLTIwMjEwNTE2L2FtcC8?oc=5&hl=en-MY&gl=MY&ceid=MY:en,"{'href': 'https://www.forexlive.com', 'title': 'ForexLive'}",TSLA,25.0
26,26,Tesla (TSLA) Stock Price and Forecast: Still rangebound as CPI may ignite some moves - FXStreet,Tesla (TSLA) Stock Price and Forecast: Still rangebound as CPI may ignite some moves  FXStreet,"Thu, 10 Jun 2021 07:00:00 GMT",https://news.google.com/rss/articles/CBMiggFodHRwczovL3d3dy5meHN0cmVldC5jb20vbmV3cy90ZXNsYS10c2xhLXN0b2NrLXByaWNlLWFuZC1mb3JlY2FzdC10ZXNsYS1zdGlsbC1yYW5nZWJvdW5kLWFzLWNwaS1tYXktaWduaXRlLXNvbWUtbW92ZXMtMjAyMTA2MTAxMDM20gGGAWh0dHBzOi8vd3d3LmZ4c3RyZWV0LmNvbS9hbXAvbmV3cy90ZXNsYS10c2xhLXN0b2NrLXByaWNlLWFuZC1mb3JlY2FzdC10ZXNsYS1zdGlsbC1yYW5nZWJvdW5kLWFzLWNwaS1tYXktaWduaXRlLXNvbWUtbW92ZXMtMjAyMTA2MTAxMDM2?oc=5&hl=en-MY&gl=MY&ceid=MY:en,"{'href': 'https://www.fxstreet.com', 'title': 'FXStreet'}",TSLA,26.0
27,27,What Is Tesla's (TSLA) Stock Forecast for 2025? - Market Realist,What Is Tesla's (TSLA) Stock Forecast for 2025?  Market Realist,"Wed, 28 Apr 2021 07:00:00 GMT",https://news.google.com/rss/articles/CBMiO2h0dHBzOi8vbWFya2V0cmVhbGlzdC5jb20vcC90c2xhLXRlc2xhLXN0b2NrLWZvcmVjYXN0LTIwMjUv0gEA?oc=5&hl=en-MY&gl=MY&ceid=MY:en,"{'href': 'https://marketrealist.com', 'title': 'Market Realist'}",TSLA,27.0
28,28,Will Tesla Continue To Dominate The Electric Car Market? One Major Investor Offers Assessment | IBTimes - International Business Times,Will Tesla Continue To Dominate The Electric Car Market? One Major Investor Offers Assessment | IBTimes  International Business Times,"Wed, 26 May 2021 07:00:00 GMT",https://news.google.com/rss/articles/CBMidWh0dHBzOi8vd3d3LmlidGltZXMuY29tL3dpbGwtdGVzbGEtY29udGludWUtZG9taW5hdGUtZWxlY3RyaWMtY2FyLW1hcmtldC1vbmUtbWFqb3ItaW52ZXN0b3Itb2ZmZXJzLWFzc2Vzc21lbnQtMzIwOTQ1M9IBAA?oc=5&hl=en-MY&gl=MY&ceid=MY:en,"{'href': 'https://www.ibtimes.com', 'title': 'International Business Times'}",TSLA,28.0
29,29,TSLA Stock Is Hot on Reddit: Can WallStreetBets Trigger a Squeeze? - Market Realist,TSLA Stock Is Hot on Reddit: Can WallStreetBets Trigger a Squeeze?  Market Realist,"Fri, 25 Jun 2021 07:00:00 GMT",https://news.google.com/rss/articles/CBMiRWh0dHBzOi8vbWFya2V0cmVhbGlzdC5jb20vcC90c2xhLXN0b2NrLXNxdWVlemUtcmVkZGl0LXdhbGxzdHJlZXRiZXRzL9IBAA?oc=5&hl=en-MY&gl=MY&ceid=MY:en,"{'href': 'https://marketrealist.com', 'title': 'Market Realist'}",TSLA,29.0
30,30,"Tesla Stock Tokens Now Available On Binance, But Not Binance.US - TheStreet","Tesla Stock Tokens Now Available On Binance, But Not Binance.US  TheStreet","Mon, 12 Apr 2021 07:00:00 GMT",https://news.google.com/rss/articles/CBMiQmh0dHBzOi8vd3d3LnRoZXN0cmVldC5jb20vY3J5cHRvL2JpdGNvaW4vdGVzbGEtc3RvY2stdG9rZW4tYmluYW5jZdIBAA?oc=5&hl=en-MY&gl=MY&ceid=MY:en,"{'href': 'https://www.thestreet.com', 'title': 'TheStreet'}",TSLA,30.0
31,31,Merging Lane Ahead! Why Tesla Might Have To Merge With Workhorse And Nikola Motors - Markets Insider,Merging Lane Ahead! Why Tesla Might Have To Merge With Workhorse And Nikola Motors  Markets Insider,"Sun, 02 May 2021 07:00:00 GMT",https://news.google.com/rss/articles/CBMijAFodHRwczovL21hcmtldHMuYnVzaW5lc3NpbnNpZGVyLmNvbS9uZXdzL3N0b2Nrcy9tZXJnaW5nLWxhbmUtYWhlYWQtd2h5LXRlc2xhLW1pZ2h0LWhhdmUtdG8tbWVyZ2Utd2l0aC13b3JraG9yc2UtYW5kLW5pa29sYS1tb3RvcnMtMTAzMDM3NDk2NNIBAA?oc=5&hl=en-MY&gl=MY&ceid=MY:en,"{'href': 'https://markets.businessinsider.com', 'title': 'Markets Insider'}",TSLA,31.0
32,32,How Elon Musk May Have Caused Another Cryptocurrency To Surge - Tesla (NASDAQ:TSLA) - Benzinga,How Elon Musk May Have Caused Another Cryptocurrency To Surge - Tesla (NASDAQ:TSLA)  Benzinga,"Sun, 16 May 2021 07:00:00 GMT",https://news.google.com/rss/articles/CBMifGh0dHBzOi8vd3d3LmJlbnppbmdhLmNvbS9tYXJrZXRzL2NyeXB0b2N1cnJlbmN5LzIxLzA1LzIxMTQzMzk2L2hvdy1lbG9uLW11c2stbWF5LWhhdmUtY2F1c2VkLWFub3RoZXItY3J5cHRvY3VycmVuY3ktdG8tc3VyZ2XSAS1odHRwczovL3d3dy5iZW56aW5nYS5jb20vYW1wL2NvbnRlbnQvMjExNDMzOTY?oc=5&hl=en-MY&gl=MY&ceid=MY:en,"{'href': 'https://www.benzinga.com', 'title': 'Benzinga'}",TSLA,32.0
33,33,"AMD Scores Tesla As A Customer: What You Need To Know - Tesla (NASDAQ:TSLA), Advanced Micro Devices (NASD - Benzinga","AMD Scores Tesla As A Customer: What You Need To Know - Tesla (NASDAQ:TSLA), Advanced Micro Devices (NASD  Benzinga","Tue, 01 Jun 2021 07:00:00 GMT",https://news.google.com/rss/articles/CBMiYWh0dHBzOi8vd3d3LmJlbnppbmdhLmNvbS9uZXdzLzIxLzA2LzIxMzYwOTYyL2FtZC1zY29yZXMtdGVzbGEtYXMtYS1jdXN0b21lci13aGF0LXlvdS1uZWVkLXRvLWtub3fSAS1odHRwczovL3d3dy5iZW56aW5nYS5jb20vYW1wL2NvbnRlbnQvMjEzNjA5NjI?oc=5&hl=en-MY&gl=MY&ceid=MY:en,"{'href': 'https://www.benzinga.com', 'title': 'Benzinga'}",TSLA,33.0
34,34,"Tesla (TSLA) Model Y could be the best selling car of any kind by 2022, claims Musk - Shacknews","Tesla (TSLA) Model Y could be the best selling car of any kind by 2022, claims Musk  Shacknews","Mon, 26 Apr 2021 07:00:00 GMT",https://news.google.com/rss/articles/CBMieWh0dHBzOi8vd3d3LnNoYWNrbmV3cy5jb20vYXJ0aWNsZS8xMjQwNDUvdGVzbGEtdHNsYS1tb2RlbC15LWNvdWxkLWJlLXRoZS1iZXN0LXNlbGxpbmctY2FyLW9mLWFueS1raW5kLWJ5LTIwMjItY2xhaW1zLW11c2vSAYMBaHR0cHM6Ly93d3cuc2hhY2tuZXdzLmNvbS9hcnRpY2xlLzEyNDA0NS90ZXNsYS10c2xhLW1vZGVsLXktY291bGQtYmUtdGhlLWJlc3Qtc2VsbGluZy1jYXItb2YtYW55LWtpbmQtYnktMjAyMi1jbGFpbXMtbXVzaz9hbXBodG1sPTE?oc=5&hl=en-MY&gl=MY&ceid=MY:en,"{'href': 'https://www.shacknews.com', 'title': 'Shacknews'}",TSLA,34.0
35,35,Tesla (TSLA) Q1 2021 earnings results and conference call transcript - Shacknews,Tesla (TSLA) Q1 2021 earnings results and conference call transcript  Shacknews,"Mon, 26 Apr 2021 07:00:00 GMT",https://news.google.com/rss/articles/CBMia2h0dHBzOi8vd3d3LnNoYWNrbmV3cy5jb20vYXJ0aWNsZS8xMjQwNDEvdGVzbGEtdHNsYS1xMS0yMDIxLWVhcm5pbmdzLXJlc3VsdHMtYW5kLWNvbmZlcmVuY2UtY2FsbC10cmFuc2NyaXB00gF1aHR0cHM6Ly93d3cuc2hhY2tuZXdzLmNvbS9hcnRpY2xlLzEyNDA0MS90ZXNsYS10c2xhLXExLTIwMjEtZWFybmluZ3MtcmVzdWx0cy1hbmQtY29uZmVyZW5jZS1jYWxsLXRyYW5zY3JpcHQ_YW1waHRtbD0x?oc=5&hl=en-MY&gl=MY&ceid=MY:en,"{'href': 'https://www.shacknews.com', 'title': 'Shacknews'}",TSLA,35.0
36,36,"When Will Tesla (TSLA) Stock Hit $1,000 and Can It Beat Apple? - Market Realist","When Will Tesla (TSLA) Stock Hit $1,000 and Can It Beat Apple?  Market Realist","Wed, 14 Apr 2021 07:00:00 GMT",https://news.google.com/rss/articles/CBMiR2h0dHBzOi8vbWFya2V0cmVhbGlzdC5jb20vcC93aGVuLXdpbGwtdGVzbGEtdHNsYS1zdG9jay1oaXQtZG9sbGFyLTEwMDAv0gEA?oc=5&hl=en-MY&gl=MY&ceid=MY:en,"{'href': 'https://marketrealist.com', 'title': 'Market Realist'}",TSLA,36.0
37,37,"TSLA Stock Down 0.16%, Brand New Tesla Model S Plaid Caught on Fire in Strange Circumstances - Coinspeaker","TSLA Stock Down 0.16%, Brand New Tesla Model S Plaid Caught on Fire in Strange Circumstances  Coinspeaker","Thu, 01 Jul 2021 07:00:00 GMT",https://news.google.com/rss/articles/CBMid2h0dHBzOi8vd3d3LmNvaW5zcGVha2VyLmNvbS90c2xhLXN0b2NrLWRvd24tMC0xNi1icmFuZC1uZXctdGVzbGEtbW9kZWwtcy1wbGFpZC1jYXVnaHQtb24tZmlyZS1pbi1zdHJhbmdlLWNpcmN1bXN0YW5jZXMv0gF7aHR0cHM6Ly93d3cuY29pbnNwZWFrZXIuY29tL3RzbGEtc3RvY2stZG93bi0wLTE2LWJyYW5kLW5ldy10ZXNsYS1tb2RlbC1zLXBsYWlkLWNhdWdodC1vbi1maXJlLWluLXN0cmFuZ2UtY2lyY3Vtc3RhbmNlcy9hbXAv?oc=5&hl=en-MY&gl=MY&ceid=MY:en,"{'href': 'https://www.coinspeaker.com', 'title': 'Coinspeaker'}",TSLA,37.0
38,38,Forget About Elon Musk. Check Out How Ethereum Is Crushing Tesla - TradeStation Market Insights,Forget About Elon Musk. Check Out How Ethereum Is Crushing Tesla  TradeStation Market Insights,"Fri, 14 May 2021 07:00:00 GMT",https://news.google.com/rss/articles/CBMiSWh0dHBzOi8vd3d3LnRyYWRlc3RhdGlvbi5jb20vaW5zaWdodHMvMjAyMS8wNS8xNC9ldGhlcmV1bS1jcnVzaGluZy10ZXNsYS_SAQA?oc=5&hl=en-MY&gl=MY&ceid=MY:en,"{'href': 'https://www.tradestation.com', 'title': 'TradeStation Market Insights'}",TSLA,38.0
39,39,Tesla's (TSLA) Price Prediction for 2021: Will It Reach $1000? - Market Realist,Tesla's (TSLA) Price Prediction for 2021: Will It Reach $1000?  Market Realist,"Tue, 18 May 2021 07:00:00 GMT",https://news.google.com/rss/articles/CBMiSWh0dHBzOi8vbWFya2V0cmVhbGlzdC5jb20vcC90ZXNsYS10c2xhLXByaWNlLXByZWRpY3Rpb24tMjAyMS1kb2xsYXItMTAwMC_SAQA?oc=5&hl=en-MY&gl=MY&ceid=MY:en,"{'href': 'https://marketrealist.com', 'title': 'Market Realist'}",TSLA,39.0
40,40,Elon Musk’s 10-year Tesla market cap target is 91% complete-after just 3 years - TESLARATI,Elon Musk’s 10-year Tesla market cap target is 91% complete-after just 3 years  TESLARATI,"Mon, 03 May 2021 07:00:00 GMT",https://news.google.com/rss/articles/CBMiVWh0dHBzOi8vd3d3LnRlc2xhcmF0aS5jb20vdGVzbGEtZWxvbi1tdXNrLTkxLXBlcmNlbnQtY29tcGxldGUtdHNsYS1wZXJmb3JtYW5jZS1hd2FyZC_SAVlodHRwczovL3d3dy50ZXNsYXJhdGkuY29tL3Rlc2xhLWVsb24tbXVzay05MS1wZXJjZW50LWNvbXBsZXRlLXRzbGEtcGVyZm9ybWFuY2UtYXdhcmQvYW1wLw?oc=5&hl=en-MY&gl=MY&ceid=MY:en,"{'href': 'https://www.teslarati.com', 'title': 'TESLARATI'}",TSLA,40.0
41,41,Tesla (TSLA) Stock Forecast: Is It a Good Buy Before Q1 Earnings? - Market Realist,Tesla (TSLA) Stock Forecast: Is It a Good Buy Before Q1 Earnings?  Market Realist,"Fri, 23 Apr 2021 07:00:00 GMT",https://news.google.com/rss/articles/CBMiOWh0dHBzOi8vbWFya2V0cmVhbGlzdC5jb20vcC9idXktdGVzbGEtYmVmb3JlLXExLWVhcm5pbmdzL9IBAA?oc=5&hl=en-MY&gl=MY&ceid=MY:en,"{'href': 'https://marketrealist.com', 'title': 'Market Realist'}",TSLA,41.0
42,42,Notorious TSLA bear Gordon Johnson reveals his father was an executive at General Motors [Update] - Drive Tesla Canada,Notorious TSLA bear Gordon Johnson reveals his father was an executive at General Motors [Update]  Drive Tesla Canada,"Thu, 06 May 2021 07:00:00 GMT",https://news.google.com/rss/articles/CBMiVmh0dHBzOi8vZHJpdmV0ZXNsYWNhbmFkYS5jYS9uZXdzL3RzbGEtZ29yZG9uLWpvaG5zb25zLWZhdGhlci1leGVjdXRpdmUtZ2VuZXJhbC1tb3RvcnMv0gEA?oc=5&hl=en-MY&gl=MY&ceid=MY:en,"{'href': 'https://driveteslacanada.ca', 'title': 'Drive Tesla Canada'}",TSLA,42.0
43,43,Is Tesla (TSLA) About To Reverse Its Position on LiDAR Tech After an Equally Dramatic Flip-Flop on Bitcoin (BTC)? - Wccftech,Is Tesla (TSLA) About To Reverse Its Position on LiDAR Tech After an Equally Dramatic Flip-Flop on Bitcoin (BTC)?  Wccftech,"Mon, 24 May 2021 07:00:00 GMT",https://news.google.com/rss/articles/CBMiggFodHRwczovL3djY2Z0ZWNoLmNvbS9pcy10ZXNsYS10c2xhLWFib3V0LXRvLXJldmVyc2UtaXRzLXBvc2l0aW9uLW9uLWxpZGFyLXRlY2gtYWZ0ZXItYW4tZXF1YWxseS1kcmFtYXRpYy1mbGlwLWZsb3Atb24tYml0Y29pbi1idGMv0gGGAWh0dHBzOi8vd2NjZnRlY2guY29tL2lzLXRlc2xhLXRzbGEtYWJvdXQtdG8tcmV2ZXJzZS1pdHMtcG9zaXRpb24tb24tbGlkYXItdGVjaC1hZnRlci1hbi1lcXVhbGx5LWRyYW1hdGljLWZsaXAtZmxvcC1vbi1iaXRjb2luLWJ0Yy9hbXAv?oc=5&hl=en-MY&gl=MY&ceid=MY:en,"{'href': 'https://wccftech.com', 'title': 'Wccftech'}",TSLA,43.0
44,44,"Tesla’s 12-month outlook gets $1,000 price tag from bull analyst Dan Ives - TESLARATI","Tesla’s 12-month outlook gets $1,000 price tag from bull analyst Dan Ives  TESLARATI","Thu, 20 May 2021 07:00:00 GMT",https://news.google.com/rss/articles/CBMiRWh0dHBzOi8vd3d3LnRlc2xhcmF0aS5jb20vdGVzbGEtMTAwMC0xMi1tb250aC1vdXRsb29rLWRhbi1pdmVzLXZpZGVvL9IBSWh0dHBzOi8vd3d3LnRlc2xhcmF0aS5jb20vdGVzbGEtMTAwMC0xMi1tb250aC1vdXRsb29rLWRhbi1pdmVzLXZpZGVvL2FtcC8?oc=5&hl=en-MY&gl=MY&ceid=MY:en,"{'href': 'https://www.teslarati.com', 'title': 'TESLARATI'}",TSLA,44.0
45,45,"Has Bitcoin Found The Bottom At $29,000? - Tesla (NASDAQ:TSLA) - Benzinga","Has Bitcoin Found The Bottom At $29,000? - Tesla (NASDAQ:TSLA)  Benzinga","Tue, 22 Jun 2021 07:00:00 GMT",https://news.google.com/rss/articles/CBMiZWh0dHBzOi8vd3d3LmJlbnppbmdhLmNvbS9tYXJrZXRzL2NyeXB0b2N1cnJlbmN5LzIxLzA2LzIxNjc3ODQzL2hhcy1iaXRjb2luLWZvdW5kLXRoZS1ib3R0b20tYXQtMjktMDAw0gEtaHR0cHM6Ly93d3cuYmVuemluZ2EuY29tL2FtcC9jb250ZW50LzIxNjc3ODQz?oc=5&hl=en-MY&gl=MY&ceid=MY:en,"{'href': 'https://www.benzinga.com', 'title': 'Benzinga'}",TSLA,45.0
46,46,Unilever picks TSLA to promote multi-vitamin gummy - Marketing Interactive,Unilever picks TSLA to promote multi-vitamin gummy  Marketing Interactive,"Tue, 06 Apr 2021 07:00:00 GMT",https://news.google.com/rss/articles/CBMiWGh0dHBzOi8vd3d3Lm1hcmtldGluZy1pbnRlcmFjdGl2ZS5jb20vdW5pbGV2ZXItcGlja3MtdHNsYS10by1wcm9tb3RlLW11bHRpLXZpdGFtaW4tZ3VtbXnSAQA?oc=5&hl=en-MY&gl=MY&ceid=MY:en,"{'href': 'https://www.marketing-interactive.com', 'title': 'Marketing Interactive'}",TSLA,46.0
47,47,Why Is Cathie Wood Selling Tesla (TSLA) Stock? - Market Realist,Why Is Cathie Wood Selling Tesla (TSLA) Stock?  Market Realist,"Tue, 20 Apr 2021 07:00:00 GMT",https://news.google.com/rss/articles/CBMiQmh0dHBzOi8vbWFya2V0cmVhbGlzdC5jb20vcC93aHktaXMtY2F0aGllLXdvb2Qtc2VsbGluZy10ZXNsYS10c2xhL9IBAA?oc=5&hl=en-MY&gl=MY&ceid=MY:en,"{'href': 'https://marketrealist.com', 'title': 'Market Realist'}",TSLA,47.0
48,48,"The Underdog in the EV Arms Race - Tesla (NASDAQ:TSLA), Nouveau Monde Graphite (NYSE:NMG) - Benzinga","The Underdog in the EV Arms Race - Tesla (NASDAQ:TSLA), Nouveau Monde Graphite (NYSE:NMG)  Benzinga","Mon, 21 Jun 2021 07:00:00 GMT",https://news.google.com/rss/articles/CBMiTWh0dHBzOi8vd3d3LmJlbnppbmdhLmNvbS9uZXdzLzIxLzA2LzIxNjUyNjE2L3RoZS11bmRlcmRvZy1pbi10aGUtZXYtYXJtcy1yYWNl0gEtaHR0cHM6Ly93d3cuYmVuemluZ2EuY29tL2FtcC9jb250ZW50LzIxNjUyNjE2?oc=5&hl=en-MY&gl=MY&ceid=MY:en,"{'href': 'https://www.benzinga.com', 'title': 'Benzinga'}",TSLA,48.0
49,49,XRP Attempts A Bounce But Could Fall Further - Tesla (NASDAQ:TSLA) - Benzinga,XRP Attempts A Bounce But Could Fall Further - Tesla (NASDAQ:TSLA)  Benzinga,"Tue, 22 Jun 2021 07:00:00 GMT",https://news.google.com/rss/articles/CBMia2h0dHBzOi8vd3d3LmJlbnppbmdhLmNvbS9tYXJrZXRzL2NyeXB0b2N1cnJlbmN5LzIxLzA2LzIxNjczMjM3L3hycC1hdHRlbXB0cy1hLWJvdW5jZS1idXQtY291bGQtZmFsbC1mdXJ0aGVy0gEtaHR0cHM6Ly93d3cuYmVuemluZ2EuY29tL2FtcC9jb250ZW50LzIxNjczMjM3?oc=5&hl=en-MY&gl=MY&ceid=MY:en,"{'href': 'https://www.benzinga.com', 'title': 'Benzinga'}",TSLA,49.0
50,50,Ethereum Holds Critical Pattern: What Does The Chart Say? - Tesla (NASDAQ:TSLA) - Benzinga,Ethereum Holds Critical Pattern: What Does The Chart Say? - Tesla (NASDAQ:TSLA)  Benzinga,"Wed, 16 Jun 2021 07:00:00 GMT",https://news.google.com/rss/articles/CBMidmh0dHBzOi8vd3d3LmJlbnppbmdhLmNvbS9tYXJrZXRzL2NyeXB0b2N1cnJlbmN5LzIxLzA2LzIxNTk0ODcxL2V0aGVyZXVtLWhvbGRzLWNyaXRpY2FsLXBhdHRlcm4td2hhdC1kb2VzLXRoZS1jaGFydC1zYXnSAS1odHRwczovL3d3dy5iZW56aW5nYS5jb20vYW1wL2NvbnRlbnQvMjE1OTQ4NzE?oc=5&hl=en-MY&gl=MY&ceid=MY:en,"{'href': 'https://www.benzinga.com', 'title': 'Benzinga'}",TSLA,50.0
51,51,Moonshine Day: Tennessee’s history with the once forbidden spirit - WREG NewsChannel 3,Moonshine Day: Tennessee’s history with the once forbidden spirit  WREG NewsChannel 3,"Sun, 06 Jun 2021 07:00:00 GMT",https://news.google.com/rss/articles/CBMiVmh0dHBzOi8vd3JlZy5jb20vbmV3cy9tb29uc2hpbmUtZGF5LXRlbm5lc3NlZXMtaGlzdG9yeS13aXRoLXRoZS1vbmNlLWZvcmJpZGRlbi1zcGlyaXQv0gFaaHR0cHM6Ly93cmVnLmNvbS9uZXdzL21vb25zaGluZS1kYXktdGVubmVzc2Vlcy1oaXN0b3J5LXdpdGgtdGhlLW9uY2UtZm9yYmlkZGVuLXNwaXJpdC9hbXAv?oc=5&hl=en-MY&gl=MY&ceid=MY:en,"{'href': 'https://wreg.com', 'title': 'WREG NewsChannel 3'}",TSLA,51.0
