Unnamed: 0,Unnamed: 0.1,Unnamed: 0.1.1,title,description,published date,url,publisher,company
50,50,50,Ford vs Ferrari Tesla - The Big Picture - Barry Ritholtz,Ford vs Ferrari Tesla - The Big Picture  Barry Ritholtz,"Thu, 06 Jan 2022 08:00:00 GMT",https://news.google.com/rss/articles/CBMiM2h0dHBzOi8vcml0aG9sdHouY29tLzIwMjIvMDEvZm9yZC12cy1mZXJyYXJpLXRlc2xhL9IBAA?oc=5&hl=en-MY&gl=MY&ceid=MY:en,"{'href': 'https://ritholtz.com', 'title': 'Barry Ritholtz'}",TSLA
51,51,51,"If You Invested $1,000 In Tesla Stock At Its Pandemic Low, Here's How Much You'd Have Now - Tesla (NASDAQ - Benzinga","If You Invested $1,000 In Tesla Stock At Its Pandemic Low, Here's How Much You'd Have Now - Tesla (NASDAQ  Benzinga","Sun, 27 Mar 2022 07:00:00 GMT",https://news.google.com/rss/articles/CBMijwFodHRwczovL3d3dy5iZW56aW5nYS5jb20vZ2VuZXJhbC9lZHVjYXRpb24vMjIvMDMvMjYyNjQ1MDkvaWYteW91LWludmVzdGVkLTEtMDAwLWluLXRlc2xhLXN0b2NrLWF0LWl0cy1wYW5kZW1pYy1sb3ctaGVyZXMtaG93LW11Y2gteW91ZC1oYXZlLW5vd9IBLWh0dHBzOi8vd3d3LmJlbnppbmdhLmNvbS9hbXAvY29udGVudC8yNjI2NDUwOQ?oc=5&hl=en-MY&gl=MY&ceid=MY:en,"{'href': 'https://www.benzinga.com', 'title': 'Benzinga'}",TSLA
52,52,52,Tesla Accepts Dogecoin for Some Merchandise Sales - Investopedia,Tesla Accepts Dogecoin for Some Merchandise Sales  Investopedia,"Tue, 18 Jan 2022 08:00:00 GMT",https://news.google.com/rss/articles/CBMiS2h0dHBzOi8vd3d3LmludmVzdG9wZWRpYS5jb20vdGVzbGEtYWNjZXB0cy1kb2dlY29pbi1mb3ItbWVyY2hhbmRpc2UtNTIxNjA2N9IBAA?oc=5&hl=en-MY&gl=MY&ceid=MY:en,"{'href': 'https://www.investopedia.com', 'title': 'Investopedia'}",TSLA
53,53,53,Why Tesla Shares Are Hitting The Brakes Today - Tesla (NASDAQ:TSLA) - Benzinga,Why Tesla Shares Are Hitting The Brakes Today - Tesla (NASDAQ:TSLA)  Benzinga,"Thu, 13 Jan 2022 08:00:00 GMT",https://news.google.com/rss/articles/CBMiWmh0dHBzOi8vd3d3LmJlbnppbmdhLmNvbS9uZXdzLzIyLzAxLzI1MDQ1MTUwL3doeS10ZXNsYS1zaGFyZXMtYXJlLWhpdHRpbmctdGhlLWJyYWtlcy10b2RhedIBLWh0dHBzOi8vd3d3LmJlbnppbmdhLmNvbS9hbXAvY29udGVudC8yNTA0NTE1MA?oc=5&hl=en-MY&gl=MY&ceid=MY:en,"{'href': 'https://www.benzinga.com', 'title': 'Benzinga'}",TSLA
54,54,54,Morgan Stanley’s Shocker: Tesla’s (TSLA) Annual Revenue To Exceed the Combined Yearly Revenues of General Motors and Ford by 2027 - Wccftech,Morgan Stanley’s Shocker: Tesla’s (TSLA) Annual Revenue To Exceed the Combined Yearly Revenues of General Motors and Ford by 2027  Wccftech,"Thu, 03 Feb 2022 08:00:00 GMT",https://news.google.com/rss/articles/CBMikQFodHRwczovL3djY2Z0ZWNoLmNvbS9tb3JnYW4tc3RhbmxleXMtc2hvY2tlci10ZXNsYS10c2xhLWFubnVhbC1yZXZlbnVlLXRvLWV4Y2VlZC10aGUtY29tYmluZWQteWVhcmx5LXJldmVudWVzLW9mLWdlbmVyYWwtbW90b3JzLWFuZC1mb3JkLWJ5LTIwMjcv0gGVAWh0dHBzOi8vd2NjZnRlY2guY29tL21vcmdhbi1zdGFubGV5cy1zaG9ja2VyLXRlc2xhLXRzbGEtYW5udWFsLXJldmVudWUtdG8tZXhjZWVkLXRoZS1jb21iaW5lZC15ZWFybHktcmV2ZW51ZXMtb2YtZ2VuZXJhbC1tb3RvcnMtYW5kLWZvcmQtYnktMjAyNy9hbXAv?oc=5&hl=en-MY&gl=MY&ceid=MY:en,"{'href': 'https://wccftech.com', 'title': 'Wccftech'}",TSLA
55,55,55,A Quick Look At The Tesla Token - Tech Build Africa,A Quick Look At The Tesla Token  Tech Build Africa,"Wed, 02 Feb 2022 08:00:00 GMT",https://news.google.com/rss/articles/CBMiOWh0dHBzOi8vdGVjaGJ1aWxkLmFmcmljYS9hLXF1aWNrLWxvb2stYXQtdGhlLXRlc2xhLXRva2VuL9IBAA?oc=5&hl=en-MY&gl=MY&ceid=MY:en,"{'href': 'https://techbuild.africa', 'title': 'Tech Build Africa'}",TSLA
56,56,56,Tesla Orders Surge 100% As People Turn To Electric Cars Amid High Gas Prices - ValueWalk,Tesla Orders Surge 100% As People Turn To Electric Cars Amid High Gas Prices  ValueWalk,"Thu, 10 Mar 2022 08:00:00 GMT",https://news.google.com/rss/articles/CBMiZmh0dHBzOi8vd3d3LnZhbHVld2Fsay5jb20vdGVzbGEtb3JkZXJzLXN1cmdlLTEwMC1hcy1wZW9wbGUtdHVybi10by1lbGVjdHJpYy1jYXJzLWFtaWQtaGlnaC1nYXMtcHJpY2VzL9IBAA?oc=5&hl=en-MY&gl=MY&ceid=MY:en,"{'href': 'https://www.valuewalk.com', 'title': 'ValueWalk'}",TSLA
57,57,57,The Secret Little Agency Announces New Leadership at JUNK | LBBOnline - Little Black Book,The Secret Little Agency Announces New Leadership at JUNK | LBBOnline  Little Black Book,"Thu, 13 Jan 2022 08:00:00 GMT",https://news.google.com/rss/articles/CBMiVGh0dHBzOi8vbGJib25saW5lLmNvbS9uZXdzL3RoZS1zZWNyZXQtbGl0dGxlLWFnZW5jeS1hbm5vdW5jZXMtbmV3LWxlYWRlcnNoaXAtYXQtanVua9IBAA?oc=5&hl=en-MY&gl=MY&ceid=MY:en,"{'href': 'https://lbbonline.com', 'title': 'Little Black Book'}",TSLA
58,58,58,TSLA taps Fabian Tan to lead strategic insights agency JUNK - Marketing Interactive,TSLA taps Fabian Tan to lead strategic insights agency JUNK  Marketing Interactive,"Thu, 13 Jan 2022 08:00:00 GMT",https://news.google.com/rss/articles/CBMiNWh0dHBzOi8vd3d3Lm1hcmtldGluZy1pbnRlcmFjdGl2ZS5jb20vdHNsYS1mYWJpYW4tdGFu0gEA?oc=5&hl=en-MY&gl=MY&ceid=MY:en,"{'href': 'https://www.marketing-interactive.com', 'title': 'Marketing Interactive'}",TSLA
59,59,59,Heckler Singapore teams up with TSLA & Stink Shanghai to find out when's good time for a KRUD - Campaign Brief Asia,Heckler Singapore teams up with TSLA & Stink Shanghai to find out when's good time for a KRUD  Campaign Brief Asia,"Tue, 15 Feb 2022 08:00:00 GMT",https://news.google.com/rss/articles/CBMihAFodHRwczovL2NhbXBhaWduYnJpZWZhc2lhLmNvbS8yMDIyLzAyLzE1L2hlY2tsZXItc2luZ2Fwb3JlLXRlYW1zLXVwLXdpdGgtdHNsYS1zdGluay1zaGFuZ2hhaS10by1maW5kLW91dC13aGVucy1nb29kLXRpbWUtZm9yLWEta3J1ZC_SAQA?oc=5&hl=en-MY&gl=MY&ceid=MY:en,"{'href': 'https://campaignbriefasia.com', 'title': 'Campaign Brief Asia'}",TSLA
60,60,60,National Bank of Canada buys over $600M worth of shares in Tesla (TSLA) and NIO (NIO) - Drive Tesla Canada,National Bank of Canada buys over $600M worth of shares in Tesla (TSLA) and NIO (NIO)  Drive Tesla Canada,"Tue, 25 Jan 2022 08:00:00 GMT",https://news.google.com/rss/articles/CBMicmh0dHBzOi8vZHJpdmV0ZXNsYWNhbmFkYS5jYS9uZXdzL25hdGlvbmFsLWJhbmstb2YtY2FuYWRhLWJ1eXMtb3Zlci02MDBtLXdvcnRoLW9mLXNoYXJlcy1pbi10ZXNsYS10c2xhLWFuZC1uaW8tbmlvL9IBAA?oc=5&hl=en-MY&gl=MY&ceid=MY:en,"{'href': 'https://driveteslacanada.ca', 'title': 'Drive Tesla Canada'}",TSLA
61,61,61,How To Pronounce Dogecoin - Tesla (NASDAQ:TSLA) - Benzinga,How To Pronounce Dogecoin - Tesla (NASDAQ:TSLA)  Benzinga,"Wed, 23 Feb 2022 08:00:00 GMT",https://news.google.com/rss/articles/CBMiWGh0dHBzOi8vd3d3LmJlbnppbmdhLmNvbS9tYXJrZXRzL2NyeXB0b2N1cnJlbmN5LzIxLzAyLzE5NDEyNjgyL2hvdy10by1wcm9ub3VuY2UtZG9nZWNvaW7SAS1odHRwczovL3d3dy5iZW56aW5nYS5jb20vYW1wL2NvbnRlbnQvMTk0MTI2ODI?oc=5&hl=en-MY&gl=MY&ceid=MY:en,"{'href': 'https://www.benzinga.com', 'title': 'Benzinga'}",TSLA
62,62,62,Cambodian Beer Brand Proves That 'Now's a Good Time for a Krud' | LBBOnline - Little Black Book,Cambodian Beer Brand Proves That 'Now's a Good Time for a Krud' | LBBOnline  Little Black Book,"Wed, 26 Jan 2022 08:00:00 GMT",https://news.google.com/rss/articles/CBMiV2h0dHBzOi8vbGJib25saW5lLmNvbS9uZXdzL2NhbWJvZGlhbi1iZWVyLWJyYW5kLXByb3Zlcy10aGF0LW5vd3MtYS1nb29kLXRpbWUtZm9yLWEta3J1ZNIBAA?oc=5&hl=en-MY&gl=MY&ceid=MY:en,"{'href': 'https://lbbonline.com', 'title': 'Little Black Book'}",TSLA
63,63,63,TSLA & GME short Andrew Left of Citron Research had his computers seized by the FBI last year - Shacknews,TSLA & GME short Andrew Left of Citron Research had his computers seized by the FBI last year  Shacknews,"Fri, 04 Feb 2022 08:00:00 GMT",https://news.google.com/rss/articles/CBMihAFodHRwczovL3d3dy5zaGFja25ld3MuY29tL2FydGljbGUvMTI4NjkyL3RzbGEtZ21lLXNob3J0LWFuZHJldy1sZWZ0LW9mLWNpdHJvbi1yZXNlYXJjaC1oYWQtaGlzLWNvbXB1dGVycy1zZWl6ZWQtYnktdGhlLWZiaS1sYXN0LXllYXLSAY4BaHR0cHM6Ly93d3cuc2hhY2tuZXdzLmNvbS9hcnRpY2xlLzEyODY5Mi90c2xhLWdtZS1zaG9ydC1hbmRyZXctbGVmdC1vZi1jaXRyb24tcmVzZWFyY2gtaGFkLWhpcy1jb21wdXRlcnMtc2VpemVkLWJ5LXRoZS1mYmktbGFzdC15ZWFyP2FtcGh0bWw9MQ?oc=5&hl=en-MY&gl=MY&ceid=MY:en,"{'href': 'https://www.shacknews.com', 'title': 'Shacknews'}",TSLA
64,64,64,DBS launches new brand campaign with TSLA - Marketing Interactive,DBS launches new brand campaign with TSLA  Marketing Interactive,"Wed, 23 Mar 2022 07:00:00 GMT",https://news.google.com/rss/articles/CBMiT2h0dHBzOi8vd3d3Lm1hcmtldGluZy1pbnRlcmFjdGl2ZS5jb20vZGJzLWxhdW5jaGVzLW5ldy1icmFuZC1jYW1wYWlnbi13aXRoLXRzbGHSAQA?oc=5&hl=en-MY&gl=MY&ceid=MY:en,"{'href': 'https://www.marketing-interactive.com', 'title': 'Marketing Interactive'}",TSLA
65,65,65,Tesla (TSLA) online shop now accepting Dogecoin (DOGE) for some items - Shacknews,Tesla (TSLA) online shop now accepting Dogecoin (DOGE) for some items  Shacknews,"Thu, 13 Jan 2022 08:00:00 GMT",https://news.google.com/rss/articles/CBMiamh0dHBzOi8vd3d3LnNoYWNrbmV3cy5jb20vYXJ0aWNsZS8xMjgzNDYvdGVzbGEtdHNsYS1vbmxpbmUtc2hvcC1ub3ctYWNjZXB0aW5nLWRvZ2Vjb2luLWRvZ2UtZm9yLXNvbWUtaXRlbXPSAXRodHRwczovL3d3dy5zaGFja25ld3MuY29tL2FydGljbGUvMTI4MzQ2L3Rlc2xhLXRzbGEtb25saW5lLXNob3Atbm93LWFjY2VwdGluZy1kb2dlY29pbi1kb2dlLWZvci1zb21lLWl0ZW1zP2FtcGh0bWw9MQ?oc=5&hl=en-MY&gl=MY&ceid=MY:en,"{'href': 'https://www.shacknews.com', 'title': 'Shacknews'}",TSLA
66,66,66,Does World's Richest Man Elon Musk Live Frugally? - Tesla (NASDAQ:TSLA) - Benzinga,Does World's Richest Man Elon Musk Live Frugally? - Tesla (NASDAQ:TSLA)  Benzinga,"Tue, 22 Mar 2022 07:00:00 GMT",https://news.google.com/rss/articles/CBMibWh0dHBzOi8vd3d3LmJlbnppbmdhLmNvbS9nZW5lcmFsL2VudGVydGFpbm1lbnQvMjIvMDMvMjYyNDcwNzcvZG9lcy13b3JsZHMtcmljaGVzdC1tYW4tZWxvbi1tdXNrLWxpdmUtZnJ1Z2FsbHnSAS1odHRwczovL3d3dy5iZW56aW5nYS5jb20vYW1wL2NvbnRlbnQvMjYyNDcwNzc?oc=5&hl=en-MY&gl=MY&ceid=MY:en,"{'href': 'https://www.benzinga.com', 'title': 'Benzinga'}",TSLA
67,67,67,"Tesla countersues JPMorgan claiming investment bank sought ""windfall"" following Musk tweet - Drive Tesla Canada","Tesla countersues JPMorgan claiming investment bank sought ""windfall"" following Musk tweet  Drive Tesla Canada","Mon, 24 Jan 2022 08:00:00 GMT",https://news.google.com/rss/articles/CBMiUGh0dHBzOi8vZHJpdmV0ZXNsYWNhbmFkYS5jYS9uZXdzL3Rlc2xhLWNvdW50ZXJzdWVzLWpwbW9yZ2FuLXdpbmRmYWxsLW11c2stdHdlZWsv0gEA?oc=5&hl=en-MY&gl=MY&ceid=MY:en,"{'href': 'https://driveteslacanada.ca', 'title': 'Drive Tesla Canada'}",TSLA
68,68,68,Tesla reports 87% surge in annual vehicle deliveries in 2021 - Proactive Investors UK,Tesla reports 87% surge in annual vehicle deliveries in 2021  Proactive Investors UK,"Mon, 03 Jan 2022 08:00:00 GMT",https://news.google.com/rss/articles/CBMiggFodHRwczovL3d3dy5wcm9hY3RpdmVpbnZlc3RvcnMuY28udWsvY29tcGFuaWVzL25ld3MvOTcwMjkzL3Rlc2xhLXJlcG9ydHMtODctc3VyZ2UtaW4tYW5udWFsLXZlaGljbGUtZGVsaXZlcmllcy1pbi0yMDIxLTk3MDI5My5odG1s0gEA?oc=5&hl=en-MY&gl=MY&ceid=MY:en,"{'href': 'https://www.proactiveinvestors.co.uk', 'title': 'Proactive Investors UK'}",TSLA
69,69,69,"Hedge Fund and Insider Trading News: Carl Icahn, Sanjay Shah, Sachem Head Capital Management, Tiger Global ... - Insider Monkey","Hedge Fund and Insider Trading News: Carl Icahn, Sanjay Shah, Sachem Head Capital Management, Tiger Global ...  Insider Monkey","Fri, 25 Feb 2022 08:00:00 GMT",https://news.google.com/rss/articles/CBMi6QFodHRwczovL3d3dy5pbnNpZGVybW9ua2V5LmNvbS9ibG9nL2hlZGdlLWZ1bmQtYW5kLWluc2lkZXItdHJhZGluZy1uZXdzLWNhcmwtaWNhaG4tc2FuamF5LXNoYWgtc2FjaGVtLWhlYWQtY2FwaXRhbC1tYW5hZ2VtZW50LXRpZ2VyLWdsb2JhbC1tYW5hZ2VtZW50LWh1ZHNvbi1iYXktY2FwaXRhbC1hdmVuZHVzLWNhcGl0YWwtbWZwLXBhcnRuZXJzLXRlc2xhLWluYy10c2xhLXJlcHVibGljLXNlci0xMDMwMjIwL9IBAA?oc=5&hl=en-MY&gl=MY&ceid=MY:en,"{'href': 'https://www.insidermonkey.com', 'title': 'Insider Monkey'}",TSLA
70,70,70,Vattanac Brewery's Krud aims to 'raise the standard' of Cambodian beer | News - Campaign Asia,Vattanac Brewery's Krud aims to 'raise the standard' of Cambodian beer | News  Campaign Asia,"Wed, 26 Jan 2022 08:00:00 GMT",https://news.google.com/rss/articles/CBMib2h0dHBzOi8vd3d3LmNhbXBhaWduYXNpYS5jb20vYXJ0aWNsZS92YXR0YW5hYy1icmV3ZXJ5cy1rcnVkLWFpbXMtdG8tcmFpc2UtdGhlLXN0YW5kYXJkLW9mLWNhbWJvZGlhbi1iZWVyLzQ3NTM5MdIBAA?oc=5&hl=en-MY&gl=MY&ceid=MY:en,"{'href': 'https://www.campaignasia.com', 'title': 'Campaign Asia'}",TSLA
71,71,71,Legal changes recommended for self-driving cars in UK - Proactive Investors UK,Legal changes recommended for self-driving cars in UK  Proactive Investors UK,"Wed, 26 Jan 2022 08:00:00 GMT",https://news.google.com/rss/articles/CBMifGh0dHBzOi8vd3d3LnByb2FjdGl2ZWludmVzdG9ycy5jby51ay9jb21wYW5pZXMvbmV3cy85NzIyMDUvbGVnYWwtY2hhbmdlcy1yZWNvbW1lbmRlZC1mb3Itc2VsZi1kcml2aW5nLWNhcnMtaW4tdWstOTcyMjA1Lmh0bWzSAQA?oc=5&hl=en-MY&gl=MY&ceid=MY:en,"{'href': 'https://www.proactiveinvestors.co.uk', 'title': 'Proactive Investors UK'}",TSLA
