Unnamed: 0,Unnamed: 0.1,title,description,published date,url,publisher,company
54,54,Here's How Much Money You Would Have If You Bought Apple Stock Instead Of An iPod In 2001 - Apple (NASDAQ - Benzinga,Here's How Much Money You Would Have If You Bought Apple Stock Instead Of An iPod In 2001 - Apple (NASDAQ  Benzinga,"Mon, 29 Aug 2022 07:00:00 GMT",https://news.google.com/rss/articles/CBMiiAFodHRwczovL3d3dy5iZW56aW5nYS5jb20vZ2VuZXJhbC8yMi8wOC8yODY2Nzc2OC9oZXJlcy1ob3ctbXVjaC1tb25leS15b3Utd291bGQtaGF2ZS1pZi15b3UtYm91Z2h0LWFwcGxlLXN0b2NrLWluc3RlYWQtb2YtYW4taXBvZC1pbi0yMDAx0gEtaHR0cHM6Ly93d3cuYmVuemluZ2EuY29tL2FtcC9jb250ZW50LzI4NjY3NzY4?oc=5&hl=en-MY&gl=MY&ceid=MY:en,"{'href': 'https://www.benzinga.com', 'title': 'Benzinga'}",AAPL
55,55,How Bill Gate's Microsoft Missed Out On $159B By Selling Apple Stock WAY Too Early - Microsoft (NASDAQ:MS - Benzinga,How Bill Gate's Microsoft Missed Out On $159B By Selling Apple Stock WAY Too Early - Microsoft (NASDAQ:MS  Benzinga,"Tue, 20 Sep 2022 07:00:00 GMT",https://news.google.com/rss/articles/CBMikQFodHRwczovL3d3dy5iZW56aW5nYS5jb20vZ2VuZXJhbC9lbnRlcnRhaW5tZW50LzIyLzA5LzI4OTM1OTgxL2JpZy1yZWdyZXQtYmlsbC1nYXRlcy1taWNyb3NvZnQtbWlzc2VkLW91dC1vbi0xNTliLWJ5LXNlbGxpbmctYXBwbGUtc3RvY2std2F5LWVhcmx50gEtaHR0cHM6Ly93d3cuYmVuemluZ2EuY29tL2FtcC9jb250ZW50LzI4OTM1OTgx?oc=5&hl=en-MY&gl=MY&ceid=MY:en,"{'href': 'https://www.benzinga.com', 'title': 'Benzinga'}",AAPL
56,56,"European Inflation Jumps While China PMI Improves - Apple (NASDAQ:AAPL), AAR (NYSE:AIR) - Benzinga","European Inflation Jumps While China PMI Improves - Apple (NASDAQ:AAPL), AAR (NYSE:AIR)  Benzinga","Fri, 01 Jul 2022 07:00:00 GMT",https://news.google.com/rss/articles/CBMiZ2h0dHBzOi8vd3d3LmJlbnppbmdhLmNvbS9uZXdzL2Vhcm5pbmdzLzIyLzA3LzI3OTM0ODMxL2V1cm9wZWFuLWluZmxhdGlvbi1qdW1wcy13aGlsZS1jaGluYS1wbWktaW1wcm92ZXPSAS1odHRwczovL3d3dy5iZW56aW5nYS5jb20vYW1wL2NvbnRlbnQvMjc5MzQ4MzE?oc=5&hl=en-MY&gl=MY&ceid=MY:en,"{'href': 'https://www.benzinga.com', 'title': 'Benzinga'}",AAPL
57,57,5 Best Tech Stocks to Buy According to Peter Algert's Algert Global - Insider Monkey,5 Best Tech Stocks to Buy According to Peter Algert's Algert Global  Insider Monkey,"Sat, 10 Sep 2022 07:00:00 GMT",https://news.google.com/rss/articles/CBMib2h0dHBzOi8vd3d3Lmluc2lkZXJtb25rZXkuY29tL2Jsb2cvNS1iZXN0LXRlY2gtc3RvY2tzLXRvLWJ1eS1hY2NvcmRpbmctdG8tcGV0ZXItYWxnZXJ0cy1hbGdlcnQtZ2xvYmFsLTEwNjQ0NzYvNdIBAA?oc=5&hl=en-MY&gl=MY&ceid=MY:en,"{'href': 'https://www.insidermonkey.com', 'title': 'Insider Monkey'}",AAPL
58,58,Apple sets new all-time high for installed base of active devices in Q3 2022 - Shacknews,Apple sets new all-time high for installed base of active devices in Q3 2022  Shacknews,"Thu, 28 Jul 2022 07:00:00 GMT",https://news.google.com/rss/articles/CBMidWh0dHBzOi8vd3d3LnNoYWNrbmV3cy5jb20vYXJ0aWNsZS8xMzE2MDcvYXBwbGUtc2V0cy1uZXctYWxsLXRpbWUtaGlnaC1mb3ItaW5zdGFsbGVkLWJhc2Utb2YtYWN0aXZlLWRldmljZXMtaW4tcTMtMjAyMtIBf2h0dHBzOi8vd3d3LnNoYWNrbmV3cy5jb20vYXJ0aWNsZS8xMzE2MDcvYXBwbGUtc2V0cy1uZXctYWxsLXRpbWUtaGlnaC1mb3ItaW5zdGFsbGVkLWJhc2Utb2YtYWN0aXZlLWRldmljZXMtaW4tcTMtMjAyMj9hbXBodG1sPTE?oc=5&hl=en-MY&gl=MY&ceid=MY:en,"{'href': 'https://www.shacknews.com', 'title': 'Shacknews'}",AAPL
59,59,"Apple iPhone 14 series launch date is tomorrow | NASDAQ:AAPL, ETR:APC - Proactive Investors UK","Apple iPhone 14 series launch date is tomorrow | NASDAQ:AAPL, ETR:APC  Proactive Investors UK","Tue, 06 Sep 2022 07:00:00 GMT",https://news.google.com/rss/articles/CBMidWh0dHBzOi8vd3d3LnByb2FjdGl2ZWludmVzdG9ycy5jby51ay9jb21wYW5pZXMvbmV3cy85OTE4NzEvYXBwbGUtaXBob25lLTE0LXNlcmllcy1sYXVuY2gtZGF0ZS1pcy10b21vcnJvdy05OTE4NzEuaHRtbNIBAA?oc=5&hl=en-MY&gl=MY&ceid=MY:en,"{'href': 'https://www.proactiveinvestors.co.uk', 'title': 'Proactive Investors UK'}",AAPL
60,60,"Apple reveals major security risk for iPhones, iPads and Macs - Proactive Investors Australia","Apple reveals major security risk for iPhones, iPads and Macs  Proactive Investors Australia","Mon, 22 Aug 2022 07:00:00 GMT",https://news.google.com/rss/articles/CBMihAFodHRwczovL3d3dy5wcm9hY3RpdmVpbnZlc3RvcnMuY29tLmF1L2NvbXBhbmllcy9uZXdzLzk5MDYzNS9hcHBsZS1yZXZlYWxzLW1ham9yLXNlY3VyaXR5LXJpc2stZm9yLWlwaG9uZXMtaXBhZHMtYW5kLW1hY3MtOTkwNjM1Lmh0bWzSAQA?oc=5&hl=en-MY&gl=MY&ceid=MY:en,"{'href': 'https://www.proactiveinvestors.com.au', 'title': 'Proactive Investors Australia'}",AAPL
